QUEST_LV_0500_20220210_001316	宿命。	숙명.	카오닐라 헨류시
QUEST_LV_0500_20220210_001317	その宿命を妨げないことが、{nl}王国を再建できる唯一の方法です。	그 숙명을 방해하지 않는 것이.{nl}왕국을 재건할 수 있는 유일한 방법입니다.	카오닐라 헨류시
QUEST_LV_0500_20220210_001318	理解できないと言いたげな顔ですね。{nl}……そう思うのも仕方ありません。{nl}神の意向はいつだって人間の想像を遥かに超えます。{nl}私もあなたも彼の者達の宿命論の前では、どうすることもできないのです。	이해할 수 없다는 표정이군요.{nl}그럴 수 있습니다.{nl}신의 뜻은 언제나 인간의 상상을 초월하니까요.{nl}저도 당신도 그들의 숙명론 앞에선 그 무엇도 바꿀 수 없으니까요.	카오닐라 헨류시
QUEST_LV_0500_20220210_001319	ここであなたができることは、もうありません。{nl}この海図を持って、ヘオシャ将軍の元へ行ってください。{nl}彼女があなたをオルシャへ送り届けてくれるでしょう。	이제 이곳에서 당신이 더 이상 할 일이 없습니다.{nl}이 해도를 드릴 테니 헤오샤 장군에게 찾아가십시오.{nl}그녀가 당신을 오르샤로 보내줄 것입니다.	카오닐라 헨류시
QUEST_LV_0500_20220210_001320	ヘオシャ	헤오샤	
QUEST_LV_0500_20220210_001321	ああ、啓示者様ですね。{nl}姫様に言われて来たのですか？	아, 계시자님이시군요.{nl}공주님이 보내셨다고요?	헤오샤
QUEST_LV_0500_20220210_001322	私も私の軍隊も、そろそろここを発つ準備を始めます。{nl}それまでは、ここで待ちます。	저와 제 군대도 이제 이곳을 떠날 준비를 시작할 것입니다.{nl}그때를 기다리겠습니다.	카오닐라 헨류시
QUEST_LV_0500_20220210_001323	つい先日、姫様がお話されていました。{nl}あなたをオルシャへと向かう船に乗せろとのことですが……{nl}他に、何か聞きたいことはありますか？	얼마 전에 공주님께서 당신에 대한 이야기를 하셨죠.{nl}오르샤로 향하는 다른 배를 태우라고 하셨는데..{nl}더 들으신 이야기가 있으십니까?	헤오샤
QUEST_LV_0500_20220210_001324	{nl}その顔からして、知らないようですね。	{nl}표정을 보니 모르시는 모양이군요.	헤오샤
QUEST_LV_0500_20220210_001325	先日オルシャへ戻るという話が公邸内に広まったことがあります。{nl}姫様は人間である本物の避難民と避難民に化けて公邸に侵入した魔族達の二手に分かれさせ、船に乗せました。{nl}二隻の船は同時に出発しましたが、魔族達を乗せた船は今頃……女神ユラテの領域に入ったでところでしょう。{nl}おそらく奴らは無事では済まないはず。	얼마 전에 오르샤로 돌아간다는 이야기가 공관 내에 퍼진 적이 있습니다.{nl}공주님은 피난민과 공관에 침입한 마족들을 분류해서 배에 태우셨죠.{nl}두 배는 같이 출발했지만, 마족들이 탄 배는 지금쯤 유라테 여신의 영역으로 들어갔을 겁니다.{nl}아마 녀석들은 무사하기 힘들 겁니다.	헤오샤
QUEST_LV_0500_20220210_001326	あなたが乗る船は女神ユラテの領域を迂回し、無事オルシャへ向かえるよう手配せよと姫様より仰せつかっています。{nl}長い航海となるでしょう。	공주님은 당신이 탈 배는 유라테 여신의 영역을 우회하여 무사히 오르샤로 갈 수 있게 하라고 하시더군요.{nl}준비가 되면 말씀해주십시오.{nl}먼 항해가 될 겁니다.	헤오샤
QUEST_LV_0500_20220210_001327	カオニーラ姫が、君を無事に送り届けてくれたんだね。	카오닐라 공주가 널 무사히 보내줬구나.	소녀의 환영
QUEST_LV_0500_20220210_001328	そしてユラテも……{nl}	그리고 유라테도..{nl}	소녀의 환영
QUEST_LV_0500_20220210_001329	これで君はオルシャに辿り着いた。私がまた君の元へ現れるその日まで、君はオルシャの領主を助けてあげて。	이제 오르샤에 도착했으니 내가 다시 찾을 때까지 오르샤 영주를 도와줘야 해.	소녀의 환영
QUEST_LV_0500_20220210_001330	この先君が何を経験しようと、誰と出会おうと。	앞으로 네가 무엇을 겪던, 누구를 만나건.	소녀의 환영
QUEST_LV_0500_20220210_001331	私は常に、陰から君を見てるから。	난 항상 네 뒤에 있을 거니까.	소녀의 환영
QUEST_LV_0500_20220210_001332	生き残ってね。	살아 남아줘.	소녀의 환영
QUEST_LV_0500_20220210_001333	まだ生き残る準備ができてないようだね。{nl}インベントリ(F2)を開いて、装備をつけた方がいい。	아직까지 살아남을 준비가 되지 않은 것 같구나.{nl}인벤토리(F2)를 열어서 장비를 착용하는 게 좋겠어.	소녀의 환영
QUEST_LV_0500_20220210_001334	まだ装備をつけてないの？{nl}どうして？	아직 장비를 꺼내입지 않은 거야?{nl}어째서?	소녀의 환영
QUEST_LV_0500_20220210_001335	そのくらいなら、この先に待ち構えている戦いでも生き残れると思う。	그 정도면 곧 있을 전투에서 살아남을 수 있을 거야.	소녀의 환영
QUEST_LV_0500_20220210_001336	悪いが今は忙しい。姫様の元へ急ぐように。	난 바쁘니 어서 공주님께 찾아가게.	대장군 라민
QUEST_LV_0500_20220210_001337	あなたが言っていたその避難民……{nl}私、今朝一緒に食事をしたんですけど……{nl}なんてこと……	당신이 말한 그 피난민...{nl}오늘 아침에 저와 아침 식사를 했어요.{nl}어떻게 이런 일이..	오위니아 딜벤
QUEST_LV_0500_20220210_001338	啓示者様。{nl}以前アシャーク地下監獄で回収した証拠物は、王室へ届けさせていただきました。	계시자님.{nl}지난번 아샤크 지하감옥에서 회수했던 증거물들을 왕실에 전달했습니다.	이네사 해먼데일
QUEST_LV_0500_20220210_001339	そして、キレン地方とオルシャを攻撃した注視者の軍制に立ち向かうため、ついに私達は、再び剣をとりました。{nl}注視者の本拠地であるデルムーアへ向けてラミン大将軍率いる王国軍が大々的な攻撃を開始しています。	그리고 마침내, 키렌 지방과 오르샤를 공격한 주시자의 군세에 맞서기 위해 우리는 다시금 검을 쥐었습니다.{nl}주시자의 본거지인 델무어를 향해 라민 대장군이 이끄는 왕국군이 대대적인 공격을 개시했습니다.	이네사 해먼데일
QUEST_LV_0500_20220210_001340	今頃は、規模の大小にかかわらず、何度目かの戦いが終わっていることでしょう。{nl}この戦いのために、前もって隊に合流したパヤウタさんより「あなたに合流してほしい」と言伝を頼まれましたので、ここに寄っていただきました。	지금쯤이면, 크고 작은 전투가 몇 차례 치러진 후일 겁니다.{nl}공격에 앞서서 공격대에 합류한 파야우타씨께서 당신께 합류해 달라는 부탁을 남기기 위해 이곳에 들렀습니다.	이네사 해먼데일
QUEST_LV_0500_20220210_001341	啓示者様。{nl}あなたは多くの人々からは尊敬の対象、敵からは畏敬の対象です。{nl}どうか、キレン地方の守護のため尽力してくださいますよう……オルシャの領主としてお頼み申します。	계시자님.{nl}당신께서는 많은 이들에게 존경의 대상으로, 적에게는 경외의 대상입니다.{nl}부디, 키렌 지방의 수호를 위해 힘써주시길 오르샤의 영주로서 간곡히 부탁드리겠습니다.	이네사 해먼데일
QUEST_LV_0500_20220210_001342	重大な決断となるというのに……本当にありがとうございます。{nl}あなたの献身と苦労……この御恩は必ず。	크나큰 결정을 해주셔서 감사합니다.{nl}당신의 희생과 노고에 반드시 보답하겠습니다.	이네사 해먼데일
QUEST_LV_0500_20220210_001343	デルムーアの入口であるデルムーア小作村は、現在キルティマス森を通り過ぎることで辿り着けるはずです。{nl}レンパリサ池と繋がっているデルムーア外郭へと続く普及路は、戦闘の余波で断たれてしまいました。	델무어의 초입지인 델무어 소작촌은 현재 키르티마스 숲을 지나 도달하실 수 있을 겁니다.{nl}렘파라사 연못과 연결된 델무어 외성으로 곧바로 갈 수 있는 보급로는 전투의 여파로 차단되어 버렸습니다.	이네사 해먼데일
QUEST_LV_0500_20220210_001344	それでは、どうかご無事で……	그럼 부디 무사하시길 바랍니다.	이네사 해먼데일
QUEST_LV_0500_20220210_001345	デルムーアの入口であるデルムーア小作村は、現在キルティマス森を通り過ぎることで辿り着けるはずです。{nl}レンパリサ池と繋がっているデルムーア外郭へと続く普及路は、現在戦闘の余波で遮断されています。	델무어의 초입지인 델무어 소작촌은 현재 키르티마스 숲을 지나 도달하실 수 있을 겁니다.{nl}렘파라사 연못과 연결된 델무어 외성으로 곧바로 갈 수 있는 보급로는 현재는 전투의 여파로 차단되어 버렸습니다.	이네사 해먼데일
QUEST_LV_0500_20220210_001346	貴方が、パヤウタ殿が仰っていた啓示者ですね。{nl}お会いできて光栄です。	당신이 파야우타씨 께서 말씀하신 계시자로군요.{nl}뵙게 되어 영광입니다.	센츄리온 마스터
QUEST_LV_0500_20220210_001347	貴方のことはよく聞いております。{nl}しかし今この場は戦場であります故、ゆっくりと話すのはまた次の機会にしましょう。	당신의 이야기라면 익히 들었습니다.{nl}하지만 여긴 전쟁터이니 사담은 다음을 기약하기로 하죠.	센츄리온 마스터
QUEST_LV_0500_20220210_001348	パヤウタ殿は、貴方だけがこの戦争に終止符を打てる人物であると仰っておりました。	파야우타씨께서는 당신만이 이 전쟁의 종지부를 찍을 수 있는 사람이라고 말했습니다.	센츄리온 마스터
QUEST_LV_0500_20220210_001349	私はここで貴方をお迎えするために、この場を守っておりました。{nl}しかし敵の攻勢のせいで長くもちませんでした。	저는 여기서 당신을 맞이하기 위해 이곳을 지키고 있었습니다.{nl}하지만 적들의 공세에 오래 버티지는 못했습니다.	센츄리온 마스터
QUEST_LV_0500_20220210_001350	乱戦は今も続いており、その最中で兵士達とも散り散りになってしまいました。{nl}啓示者様を奥までお連れするのは難しくありませんが……今は戦争中。戦争では勝利することも重要となります。	난전이 계속되고 있고 와중에 병사들이 흩어져 버렸습니다.{nl}계시자님 한 분을 안쪽으로 들여보내기는 어렵지 않겠지만, 전쟁에서의 승리도 중요합니다.	센츄리온 마스터
QUEST_LV_0500_20220210_001351	故に、散り散りになった兵士達をもう一度合流させて、本隊へ増援させる必要があります。{nl}まずは私と共にこの場の状況を打破しましょう。	흩어진 병사들을 다시 합류시키고 본대를 증원할 필요가 있습니다.{nl}우선 저와 함께 이곳 상황을 정리해주시겠습니까?	센츄리온 마스터
QUEST_LV_0500_20220210_001352	急ぎはぐれた兵士達を捜しましょう。	서둘러 흩어진 병사들을 찾죠.	센츄리온 마스터
QUEST_LV_0500_20220210_001353	兵士達もかなり苦戦しているようです。{nl}ですが、幸い戦闘に支障はなさそうです。	병사들이 꽤 고전 중이었나 보군요.{nl}다행히 전투에는 지장이 없을 거 같습니다.	센츄리온 마스터
QUEST_LV_0500_20220210_001354	はぐれた兵士がまだ沢山います。{nl}ここから近い地点から捜してみましょう。	아직 흩어진 병사들이 더 많습니다.{nl}가까운 지점부터 찾아보도록 하죠.	센츄리온 마스터
QUEST_LV_0500_20220210_001355	急ぎましょう。{nl}戦況が芳しくありません。	서두르죠.{nl}전황이 좋지 않습니다.	센츄리온 마스터
QUEST_LV_0500_20220210_001356	やはり負傷者も出ているようですね。{nl}中には武器が破損している兵士達も見えます。	역시나 부상자도 나오고 있군요.{nl}무기가 손상된 병사들도 더러 보입니다.	센츄리온 마스터
QUEST_LV_0500_20220210_001357	戦える兵士達はいれど、武器がまともに使える状態ではありません。{nl}{#003399}ブリークフェレット{/}から武器を奪取できれば、兵士達の武器をいくつか確保できるかもしれません。	싸울 수 있는 병사들은 있지만 정작 무기들이 제구실을 못하고 있습니다.{nl}{#003399}블릭페릿{/}들에게서 무기를 탈취한다면 병사들이 쓸 무기를 확보할 수 있을 겁니다.	센츄리온 마스터
QUEST_LV_0500_20220210_001358	{#003399}ブリークフェレット{/}から武器を奪取できれば、兵士達の武器をいくつか確保できるかもしれません。	{#003399}블릭페릿{/}들에게서 무기를 탈취한다면 병사들이 쓸 무기를 확보할 수 있을 겁니다.	센츄리온 마스터
QUEST_LV_0500_20220210_001359	これくらいでしたら十分でしょう。	이 정도면 부족하지 않을 겁니다.	센츄리온 마스터
QUEST_LV_0500_20220210_001360	デルムーア小作村ではぐれた兵士達は、これでほとんど集まったと思います。{nl}啓示者様のおかげで不足していた武器も確保できたことですし、微弱ながら戦力を回復できたと見ていいでしょう。	델무어 소작촌에서 흩어진 병사들은 대부분 모인 거 같습니다.{nl}계시자님 덕에 부족한 무기도 확보할 수 있었으니 미약하지만, 전력을 회복했다고 볼 수 있겠군요.	센츄리온 마스터
QUEST_LV_0500_20220210_001361	我々の動きを見て、敵も動き出したようです。{nl}数としてはこちらが劣勢。……敵が集まりだしたら敵いません。	우리의 움직임에 따라 적들도 움직이기 시작한 거 같습니다.{nl}아무래도 수적으로는 열세이니 적들이 모이기 시작하면 당해낼 도리가 없습니다.	센츄리온 마스터
QUEST_LV_0500_20220210_001362	敵の群れ同士の連絡手段である「連絡係」を先に取り除きましょう。{nl}敵が襲撃する時間などが、少しでも分かるかもしれません。	적들의 무리와 무리 사이의 연락을 넘기는 연락책을 미리 제거하도록 하죠.{nl}적들이 집결할 시간을 조금이나마 벌 수 있을 겁니다.	센츄리온 마스터
QUEST_LV_0500_20220210_001363	では、今すぐ行動に移りましょう。	그럼 어서 움직이죠.	센츄리온 마스터
QUEST_LV_0500_20220210_001364	連絡係さえ取り除ければ、敵が襲撃する時間などが、少しでも分かるかもしれません。	연락책들을 제거한다면 적들이 집결할 시간을 조금이나마 늦출 수 있을 겁니다.	센츄리온 마스터
QUEST_LV_0500_20220210_001365	混乱している戦場の真っ只中ですし、確実に効果があるはずです。	혼란스러운 전쟁터의 한가운데이니 확실히 효과가 있을 겁니다.	센츄리온 마스터
QUEST_LV_0500_20220210_001366	付近にデルムーア荘園へと向かう昇降機があります。{nl}万が一の時は退路となるかもしれません。先に確認してみるのはどうでしょう？	근처에 델무어 장원으로 가는 승강기가 있습니다.{nl}혹시 모를 위기에 퇴로가 될 수도 있을 테니 미리 확인해 보는 게 어떠십니까?	센츄리온 마스터
QUEST_LV_0500_20220210_001367	はい。{nl}イシュンティ十字路から上の道へ向かえば昇降機がある場所に着きます。	좋습니다.{nl}이쉰티 사거리에서 윗길을 따라가면 승강기가 있는 곳입니다.	센츄리온 마스터
QUEST_LV_0500_20220210_001368	イシュンティ十字路から上の道へ向かえば昇降機がある場所に着きます。	이쉰티 사거리에서 윗길을 따라가면 승강기가 있는 곳입니다.	센츄리온 마스터
QUEST_LV_0500_20220210_001369	これは……	이런..	센츄리온 마스터
QUEST_LV_0500_20220210_001370	退路が無いということを兵士達が知ってしまえば、戦意を失ってしまうかもしれません。	병사들이 퇴로가 없다는 사실을 알게 되면 전의를 잃게 될 겁니다.	센츄리온 마스터
QUEST_LV_0500_20220210_001371	突き出たクルビナの障壁が移動装置を破壊した	솟아난 크루비나 장벽이 이동 장치를 파괴했다	PC
QUEST_LV_0500_20220210_001372	残された方法は、デルムーア荘園へと続いている陸路を確保するという方法しか……	방법은 델무어 장원으로 이어진 육로를 확보하는 방법뿐입니다.	센츄리온 마스터
QUEST_LV_0500_20220210_001373	啓示者様が参戦してくださるのなら、兵士達にとっても大きな力となるはずです。	계사자님 께서 참전해주신다면 병사들에게도 큰 힘이 될 겁니다.	센츄리온 마스터
QUEST_LV_0500_20220210_001374	兵士達を代表して、心より感謝申し上げます。	병사들을 대신하여 감사드립니다.	센츄리온 마스터
QUEST_LV_0500_20220210_001375	共同墓地の上の道を通ればデルムーア荘園へと向かえます。{nl}そこを攻撃しましょう。	공동묘지의 윗길을 통해 델무어 장원으로 갈 수 있습니다.{nl}그곳을 공격하죠.	센츄리온 마스터
QUEST_LV_0500_20220210_001376	啓示者様がいらっしゃらなければ、兵士達も勇猛果敢に戦うことはできなかったでしょう。	계시자님이 없었더라면 병사들도 용맹하게 싸우지 못했을 겁니다.	센츄리온 마스터
QUEST_LV_0500_20220210_001377	デルムーア荘園へ移動します。	델무어 장원으로 이동하겠습니다.	센츄리온 마스터
QUEST_LV_0500_20220210_001378	そこにも苦戦中の兵士達が多いはずです。	그곳에서도 고전 중인 병사들이 많이 있을 겁니다.	센츄리온 마스터
QUEST_LV_0500_20220210_001379	私が思っていたよりも、戦況は良くありません。	전황이 제 생각보다 안 좋습니다.	센츄리온 마스터
QUEST_LV_0500_20220210_001380	兵士達も相当疲れているようです。	병사들이 지쳐있습니다.	센츄리온 마스터
QUEST_LV_0500_20220210_001381	おそらく孤立した状況でパニックになってしまったせいでしょう。{nl}戦場の真っ只中ではありますが、兵士達を集めて色々と立て直すための場所が必要です。	아무래도 고립된 상황에서 공황을 겪은 탓일 겁니다.{nl}전장의 한가운데지만 병사들을 집결하고 재정비할 장소가 필요합니다.	센츄리온 마스터
QUEST_LV_0500_20220210_001382	周辺に崩れた物資などを利用して、簡単なバリケードだけでも作った方が良さそうです。兵士達もそれで少しは安心できるはず。	주변에 부서진 물자들을 이용한 간단한 바리케이드만 있어도 병사들이 조금은 안심할 수 있을 겁니다.	센츄리온 마스터
QUEST_LV_0500_20220210_001383	このようなことにも手を貸してくださり、ありがとうございます。{nl}近くの捨てられた作業員テント付近をあたってみてください。	시답지 않은 일이겠지만, 나서주셔서 감사합니다.{nl}근처에 버려진 인부 숙소 근처를 찾아보시길 바랍니다.	센츄리온 마스터
QUEST_LV_0500_20220210_001384	テントの素材まで集めていただいたおかげで、負傷兵達の身体を寝かせられる場所ができました。	텐트 자재까지 모아 주신 덕에 부상병들의 몸을 누일 곳이 생겼군요.	센츄리온 마스터
QUEST_LV_0500_20220210_001385	後はバリケードの設置ですね。	이제 바리케이드를 배치하면 되겠군요.	센츄리온 마스터
QUEST_LV_0500_20220210_001386	では、お願いしてもよろしいでしょうか。	그렇게 해주시겠습니까?	센츄리온 마스터
QUEST_LV_0500_20220210_001387	バリケードを適度に配置していいただければ、臨時拠点の安全も確保できるはずです。	바리케이드를 적당히 배치해주시면 임시 거점의 안전을 확보할 수 있을 겁니다.	센츄리온 마스터
QUEST_LV_0500_20220210_001388	十分です。	충분합니다.	센츄리온 마스터
QUEST_LV_0500_20220210_001389	デルムーア荘園のいたる所で交戦している兵士達がいるはずです。	델무어 장원에 곳곳에 흩어져 교전 중인 병사들이 있을 겁니다.	센츄리온 마스터
QUEST_LV_0500_20220210_001390	散り散りになっている兵士達をここ臨時拠点へ集め、体制を整えましょう。ここで体制を整えれば、この後控えている戦闘にも支援できると思います。	흩어진 병사들을 이곳 임시 거점으로 모아 재정비한다면 추후 있을 전투를 지원할 수 있을 겁니다.	센츄리온 마스터
QUEST_LV_0500_20220210_001391	パニックに陥ったあの兵士2人だけをここに残すわけにはいきません。{nl}私はここに残り、臨時拠点を補強しております。啓示者様には散り散りになった兵士達に、ここへ来るよう伝えていただけませんか？	공황에 빠진 저 두 병사만 이곳에 두고 가기는 곤란합니다.{nl}저는 여기 남아 임시 거점을 보강할 테니 계시자님께서 흩어진 병사들을 이곳으로 보내주실 수 있겠습니까?	센츄리온 마스터
QUEST_LV_0500_20220210_001392	ありがとうございます。{nl}三叉路と埋没した広場を抜けて、城壁再建区域へ向かってみてください。	감사합니다.{nl}삼거리와 매몰된 광장을 지나 성벽 재건 구역으로 가보십시오.	센츄리온 마스터
QUEST_LV_0500_20220210_001393	広い地形ですから、兵士達が交戦中だとしたらすぐに見つかるはずです。	넓은 지형이니 병사들이 교전 중이라면 그곳부터 찾아보실 수 있을 겁니다.	센츄리온 마스터
QUEST_LV_0500_20220210_001394	三叉路と埋没した広場を抜けて、城壁再建区域へ向かってみてください。	삼거리와 매몰된 광장을 지나 성벽 재건 구역으로 가보십시오.	센츄리온 마스터
QUEST_LV_0500_20220210_001395	広い地形ですから、兵士達が交戦中だとしたらすぐに見つかるはずです。	넓은 지형이니 병사들이 교전 중이라면 그 곳부터 찾아 보실 수 있을 겁니다.	센츄리온 마스터
QUEST_LV_0500_20220210_001396	危ないところでしたね。{nl}おかげで危機を無事乗り越えることができました。	하마터면 큰일 날 뻔 했군요.{nl}제때 와주신 덕에 위기를 넘겼습니다.	센츄리온 마스터
QUEST_LV_0500_20220210_001397	やはり私はここに残り、周辺でまだ合流できていない兵士達を捜そうと思います。{nl}この先で大将軍率いる王国軍の本隊と、貴方の仲間であるパヤウタ殿が交戦中のはずです。	아무래도 저는 여기 남아 주변에서 아직 합류하지 못한 병사들을 찾아야겠습니다.{nl}이 앞으로는 대장군께서 이끄는 왕국군의 본대와 당신의 동료인 파야우타씨가 교전 중일 겁니다.	센츄리온 마스터
QUEST_LV_0500_20220210_001398	そうしていただけますと助かります。	그렇게 해주신다면 큰 도움이 될 겁니다.	센츄리온 마스터
QUEST_LV_0500_20220210_001399	ではまたお会いしましょう。	그럼, 다시 뵙겠습니다,	센츄리온 마스터
QUEST_LV_0500_20220210_001400	この先で大将軍率いる王国軍の本隊と、貴方の仲間であるパヤウタ殿が交戦中のはずです。	이 앞으로는 대장군께서 이끄는 왕국군의 본대와 당신의 동료인 파야우타씨가 교전 중일 겁니다.	센츄리온 마스터
QUEST_LV_0500_20220210_001401	ではまたお会いしましょう。	그럼, 다시 뵙겠습니다.	센츄리온 마스터
QUEST_LV_0500_20220210_001402	いつもこんな形で会うね、あたし達。	우리는 항상 이런 식으로 만나는 거 같네.	파야우타
QUEST_LV_0500_20220210_001403	ここに来る途中見てきたと思うけど、状況は全く良くないわ。{nl}でも君が来てくれたから、ひとまず安心した。	여기까지 지나오며 봤겠지만, 상황이 마냥 좋지 않아.{nl}그래도 네가 와줬으니 안심이야.	파야우타
QUEST_LV_0500_20220210_001404	大将軍と王国軍本隊は、ここよりもっと奥の方にいる。{nl}あたしはここを拠点にしている{#003399}ブリークフェレット{/}達の拠点を探してるの。	대장군과 왕국군 본대는 더 안쪽에 있어.{nl}나는 여기에 거점을 잡고 있는 {#003399}블릭페릿{/}들의 거점을 찾으며 별도로 움직이고 있어.	파야우타
