QUEST_LV_0500_20210125_000567	[每週] 歼灭 - 昆虫、恶魔、植物型怪物	[주간] 섬멸 - 곤충, 악마, 식물형 몬스터	
QUEST_LV_0500_20210125_000568	[每週] 歼灭 - 野兽型怪物	[주간] 섬멸 - 야수형 몬스터	
QUEST_LV_0500_20210125_000569	[每週] 歼灭 - 大型怪物	[주간] 섬멸 - 대형 몬스터	
QUEST_LV_0500_20210125_000570	[每週] 歼灭 - 中型怪物	[주간] 섬멸 - 중형 몬스터	
QUEST_LV_0500_20210125_000571	[每週] 歼灭 - 小型怪物	[주간] 섬멸 - 소형 몬스터	
QUEST_LV_0500_20210125_000572	[每週] 歼灭 - 淨化欧勒夏	[주간] 섬멸 - 오르샤 정화	
QUEST_LV_0500_20210125_000573	[每週] 征服 - 贝勒尼凯碎片副本	[주간] 정복 - 베르니케 파편 던전	
QUEST_LV_0500_20210125_000574	[每週] 征服 - 召唤兽地下城	[주간] 정복 - 어시스터 던전	
QUEST_LV_0500_20210125_000575	[每週] 征服 - 1人远征队	[주간] 정복 - 1인 레이드	
QUEST_LV_0500_20210125_000576	[每週] 征服 - 传说远征队	[주간] 정복 - 레전드 레이드	
QUEST_LV_0500_20210125_000577	[每週] 征服 - 每週BOSS远征队	[주간] 정복 - 주간 보스 레이드	
QUEST_LV_0500_20210125_000578	[每週] 先锋 - 合作战	[주간] 선봉 - 협동전	
QUEST_LV_0500_20210125_000579	[每週] 先锋 - 等级地下城	[주간] 선봉 - 레벨 던전	
QUEST_LV_0500_20210125_000580	[每週] 先锋 - 挑战	[주간] 선봉 - 챌린지	
QUEST_LV_0500_20210125_000581	[每週] 先锋 - 分裂特别传点	[주간] 선봉 - 분열 특이점	
QUEST_LV_0500_20210125_000582	[每日] 收复 - 莲帕拉沙池塘	[일일] 수복 - 렘파라사 연못	
QUEST_LV_0500_20210125_000583	[每日] 收复 - 加桥森林	[일일] 수복 - 덧댄다리 숲	
QUEST_LV_0500_20210125_000584	[每日] 收复 - 帕欧皮斯渡口	[일일] 수복 - 파우피스 나루	
QUEST_LV_0500_20210125_000585	[每日] 收复 - 伊萨巫古迪森林	[일일] 수복 - 이사우고티 숲	
QUEST_LV_0500_20210125_000586	[每日] 收复 - 奇勒提玛斯森林	[일일] 수복 - 키르티마스 숲	
QUEST_LV_0500_20210125_000587	[每日] 回收 - 莲帕拉沙池塘	[일일] 회수 - 렘파라사 연못	
QUEST_LV_0500_20210125_000588	[每日] 回收 - 加桥森林	[일일] 회수 - 덧댄다리 숲	
QUEST_LV_0500_20210125_000589	[每日] 回收 - 帕欧皮斯渡口	[일일] 회수 - 파우피스 나루	
QUEST_LV_0500_20210125_000590	[每日] 回收 - 伊萨巫古迪森林	[일일] 회수 - 이사우고티 숲	
QUEST_LV_0500_20210125_000591	[每日] 回收 - 奇勒提玛斯森林	[일일] 회수 - 키르티마스 숲	
QUEST_LV_0500_20210125_000592	[反覆] 救援 - 淨化世界	[반복] 구원 - 세계 정화	
QUEST_LV_0500_20210125_000593	[反覆] 救援 - 传说远征队	[반복] 구원 - 레전드 레이드	
QUEST_LV_0500_20210125_000594	[反覆] 救援 - 挑战	[반복] 구원 - 챌린지	
QUEST_LV_0500_20210125_000595	事前准备	사전 준비	
QUEST_LV_0500_20210125_000596	寻找方法	방법을 찾아서	
QUEST_LV_0500_20210125_000597	表示有想到的人	생각나는 사람이 있다고 한다.	
QUEST_LV_0500_20210125_000598	表示不太清楚	잘 모르겠다고 한다.	
QUEST_LV_0500_20210125_000599	莫提尼斯储藏所	머티니스 저장소	
QUEST_LV_0500_20210125_000600	表示会立刻出发前往伊萨巫古迪森林	이사우고티 숲으로 바로 출발하겠다고 한다.	
QUEST_LV_0500_20210125_000601	以夷制夷(1)	이이제이(1)	
QUEST_LV_0500_20210125_000602	表示请稍等一下	잠시만 기다려달라고 한다.	
QUEST_LV_0500_20210125_000603	以夷制夷(2)	이이제이(2)	
QUEST_LV_0500_20210125_000604	表示会去传达之后回来	전달하고 오겠다고 한다.	
QUEST_LV_0500_20210125_000605	表示还有要做的事情	아직 할 것이 남았다고 한다.	
QUEST_LV_0500_20210125_000606	以夷制夷(3)	이이제이(3)	
QUEST_LV_0500_20210125_000607	以夷制夷(4)	이이제이(4)	
QUEST_LV_0500_20210125_000608	表示会去查看莫提尼斯储藏所然后回来	머티니스 저장소를 살펴보고 오겠다고 한다.	
QUEST_LV_0500_20210125_000609	表示还不是时候	아직 때가 아닌 것 같다고 한다.	
QUEST_LV_0500_20210125_000610	以夷制夷(5)	이이제이(5)	
QUEST_LV_0500_20210125_000611	爆破	발파	
QUEST_LV_0500_20210125_000612	消灭的莫提尼斯(1)	소멸한 머티니스(1)	
QUEST_LV_0500_20210125_000613	消灭的莫提尼斯(2)	소멸한 머티니스(2)	
QUEST_LV_0500_20210125_000614	消灭的莫提尼斯(3)	소멸한 머티니스(3)	
QUEST_LV_0500_20210125_000615	消灭的莫提尼斯(4)	소멸한 머티니스(4)	
QUEST_LV_0500_20210125_000616	表示会去传达	전하러 가겠다고 한다.	
QUEST_LV_0500_20210125_000617	表示在这裡还有其他的事情要做	아직 이곳에 볼일이 남았다고 한다.	
QUEST_LV_0500_20210125_000618	消灭的莫提尼斯(5)	소멸한 머티니스(5)	
QUEST_LV_0500_20210125_000619	无尽的威胁	끝나지 않은 위협	
QUEST_LV_0500_20210125_000620	王国重建团	왕국 재건단	
QUEST_LV_0500_20210125_000621	表示会后援援助王国重建团	왕국 재건단을 후원하고 돕겠다고 한다	
QUEST_LV_0500_20210125_000622	表示无法相信你们	당신들을 믿을 수 없다고 한다	
QUEST_LV_0500_20210125_000623	到拉伊玛的圣所与拉伊玛见面	라이마의 성소에서 라이마를 만나기	
QUEST_LV_0500_20210125_000624	请到拉伊玛的圣所与拉伊玛见面	라이마의 성소에서 라이마를 만나세요	
QUEST_LV_0500_20210125_000625	前进祭坛	제단으로 다가가기	
QUEST_LV_0500_20210125_000626	进入到拉伊玛的圣所内部了。{nl}请前进祭坛。	라이마의 성소 내부로 들어왔습니다{nl}제단으로 다가가세요	
QUEST_LV_0500_20210125_000627	在白魔女森林(独特)进行调查	하얀 마녀의 숲(유니크)에서 조사를 진행하기.	QUEST_LV_0500_20200724_000201	在白魔女森林裡进行调查。	하얀 마녀의 숲에서 조사를 진행하기.	
QUEST_LV_0500_20210125_000628	去找欧勒夏领主伊内沙黑蒙戴伊	오르샤의 영주 이네사 헤먼데일을 찾아가기	
QUEST_LV_0500_20210125_000629	在欧勒夏发生了异变，{nl}欧勒夏领主伊内沙黑蒙戴伊为了紧急请求启示者们的协助正在寻找你。	오르샤에 이변이 일어났습니다{nl}오르샤의 영주인 이네사 헤먼데일은 계시자들을 비롯한 당신에게 급한 도움을 부탁하기 위해 당신을 찾고 있습니다	
QUEST_LV_0500_20210125_000630	在欧勒夏发生了异变，{nl}欧勒夏领主伊内沙黑蒙戴伊为了紧急请求启示者们的协助正在寻找你。	오르샤에 이변이 일어났습니다{nl}오르샤의 영주인 이네사 헤먼데일은 계시자들을 비롯한 당신에게 급한 도움을 부탁하기 위해 당신을 찾고있습니다	
QUEST_LV_0500_20210125_000631	在欧勒夏发生了异变，{nl}欧勒夏领主伊内沙黑蒙戴伊为了紧急请求启示者们的协助正在寻找你。	오르샤에 이변이 일어났습니다{nl}오르샤의 영주인 이네사 헤먼데일은 계시자들을 비롯, 당신에게 급한 도움을 부탁하기 위해 당신을 찾고있습니다	
QUEST_LV_0500_20210125_000632	在拉伊玛的圣所与拉达女神见面。{nl}拉伊玛的圣所可透过柯拉佩达、欧勒夏、佩迪米安的女神像移动。	라이마의 성소에서 라다 여신을 만나기{nl}라이마의 성소는 클라페다, 오르샤, 페디미안의 여신상으로 이동할 수 있습니다	
QUEST_LV_0500_20210125_000633	伊内沙黑蒙戴伊说在正式展开战斗之前有寻找你的存在，因此请你前往拉伊玛的圣所。{nl}请利用柯拉佩达、欧勒夏、佩迪米安的女神像移动到拉伊玛的圣所。	이네사 헤먼데일은 본격적인 전투에 앞서, 당신을 찾는 존재가 있으니 라이마의 성소로 가보라고 합니다{nl}클라페다, 오르샤, 페디미안의 여신상을 이용해 라이마의 성소로 이동하세요	
QUEST_LV_0500_20210125_000634	在莲帕拉沙池塘寻找拉达女神	렘파라사 연못에서 라다 여신을 찾기	
QUEST_LV_0500_20210125_000635	拉达女神正在莲帕拉沙池塘等你，{nl}请在莲帕拉沙池塘与拉达女神对话。	라다 여신은 렘파라사 연못에서 기다리고 있습니다{nl}렘파라사 연못에서 라다 여신과 대화하세요	
QUEST_LV_0500_20210125_000636	与拉达女神对话	라다 여신과 대화하기	
QUEST_LV_0500_20210125_000637	为了在这裡必须要做的事情，请与拉达女神对话。	이곳에서 해야 할 일을 찾기 위해 라다 여신과 대화하세요	
QUEST_LV_0500_20210125_000638	歼灭周遭魔族并找来魔族收集的物品	주변의 마족을 처치하여 마족이 모으고 있는 물건을 찾아오기	
QUEST_LV_0500_20210125_000639	拉达女神请你去歼灭周遭的魔族，并查清楚魔族们在欧勒夏一带正在收集的东西是什麽。	라다 여신은 주변의 마족을 처치하고 마족들이 오르샤 일대에서 모으고 있는 것을 알아 와 주길 부탁했습니다	
QUEST_LV_0500_20210125_000640	获得了推测是魔族收集的不明矿石。{nl}请将不明的物质拿去给拉达女神看。	마족이 모으고 있는 물건으로 추정되는 정체불명의 광석을 획득했습니다{nl}라다 여신에게 가져가 정체불명의 물질을 보여주세요	
QUEST_LV_0500_20210125_000641	歼灭魔族后，在他们的持有品中发现了不明的矿石。{nl}是一眼就可看出非常危险的矿石。{nl}请拿去给拉达女神询问一下来历。	마족들을 처치하자 그들의 소지품 속에서 정체불명의 광석을 발견했습니다{nl}한 눈에 보기에도 위험해 보이는 광석입니다{nl}라다 여신에게 가져가 정체를 물어보세요	
QUEST_LV_0500_20210125_000642	歼灭%s 后获得目标 	%s 처치 후 목표 획득	
QUEST_LV_0500_20210125_000643	向拉达女神询问接下来要做的事	라다 여신에게 다음 해야 할 일에 관해 물어보세요	
QUEST_LV_0500_20210125_000644	在蓝图鲁玛休憩地协助拉达女神的魔族审问	란돌루마 쉼터에서 라다 여신의 마족 심문을 돕기	
QUEST_LV_0500_20210125_000645	拉达女神为揭发魔族侵略欧勒夏的计画，打算利用魔族。{nl}请在蓝图鲁玛休憩地外围调查魔族。	라다 여신은 오르샤를 침공한 마족들의 계획을 밝히기 위해 마족들을 이용하자고 합니다{nl}란돌루마 쉼터의 외진 곳에서 마족들을 조사하세요	
QUEST_LV_0500_20210125_000646	歼灭魔族的同时，拉达女神透过魔族的灵魂读取了记忆。{nl}请去询问拉达女神是否有调查出些什麽。	마족들을 처치하고 라다 여신이 마족의 영혼을 통해 기억을 읽어냈습니다{nl}라다 여신이 무엇을 알아냈는지 물어보세요	
QUEST_LV_0500_20210125_000647	拉达女神陷入了沉思。{nl}请向拉达女神询问是否有从魔族的灵魂那裡读取到什麽。	라다 여신이 생각에 잠겨 있습니다{nl}라다 여신에게 마족들의 영혼으로부터 읽은 기억이 무엇인지 물어보세요	
QUEST_LV_0500_20210125_000648	收集魔族的灵魂并拿去给在阿达塔街道的拉达女神	마족들의 영혼을 모아 아다타 가도에 있는 라다 여신에게 가져가기	
QUEST_LV_0500_20210125_000649	拉达女神从魔族的灵魂那裡读取了注视者的气息。{nl}透过注视者的经历，在更严重的情况之下拉达女神需要更多的情报。{nl}如在阿达塔街道歼灭魔族，并在残留的魔族灵魂上使用拉达女神的祝福，将可淨化魔族的灵魂，而拉达女神也可读取灵魂的记忆。	라다 여신은 마족들의 영혼으로부터 주시자의 기운을 읽었습니다{nl}주시자가 엮여 있는 만큼 더 심각해진 상황에 라다 여신은 더 많은 정보가 필요하다고 합니다{nl}아다타 가도에서 마족을 처치하고 잔류한 마족의 영혼에 라다 여신의 축복을 사용하면, 마족의 영혼이 정화되어 라다 여신이 영혼의 기억을 읽을 수 있습니다	
QUEST_LV_0500_20210125_000650	向拉达女神询问结果	라다 여신에게 결과를 묻기	
QUEST_LV_0500_20210125_000651	充分地淨化了魔族的灵魂并送去给拉达女神了。{nl}请去寻找拉达女神并询问是否有查出什麽。	충분한 마족의 영혼을 정화했고 라다 여신에게 보냈습니다{nl}라다 여신에게 찾아가 알아낸 게 있는지 물어보세요	
QUEST_LV_0500_20210125_000652	请与拉达女神聊聊下一个目标。	라다 여신과 다음 목표에 관해 이야기하세요	
QUEST_LV_0500_20210125_000653	拉达女神从魔族的记忆中查出注视者的目的了。{nl}请与拉达女神聊聊下一个目标。	라다 여신은 마족의 기억으로부터 주시자의 목적을 알아냈습니다{nl}라다 여신과 다음 목표에 관해 이야기하세요	
QUEST_LV_0500_20210125_000654	在马尔柯斯伐木场调查不明的龟裂	말코스 벌목지에서 정체불명의 균열을 조사하기	
QUEST_LV_0500_20210125_000655	拉达女神从魔族的记忆中目击了陌生的龟裂，{nl}拉达女神已先前往加桥森林了，请在调查马尔柯斯伐木场后，如有发现任何事情请到加桥森林向拉达女神报告。	라다 여신은 한편으로, 마족의 기억으로부터 낯선 균열을 목격했다고 한다{nl}라다 여신은 먼저 덧댄다리 숲으로 향했으니 말코스 벌목지를 조사 후 무엇이든 발견하면 덧댄다리 숲에서 라다 여신을 만나 건네주자	
QUEST_LV_0500_20210125_000656	前往加桥森林与拉达女神见面	덧댄다리 숲에서 라다 여신을 만나기	
QUEST_LV_0500_20210125_000657	在调查不明的龟裂时歼灭了出现的利普斯纳巨大火甲虫，并取下了利普斯纳巨大火甲虫头上长出的一部分水晶。{nl}看来拿去给拉达女神会比较好。	정체불명의 균열을 조사 중 나타난 리프스나 파이어버그를 처치했고, 리프스나 파이어버그의 머리에 솟아난 수정을 일부 떼어냈습니다{nl}라다 여신에게 가져가 보여주는 게 좋겠습니다	
QUEST_LV_0500_20210125_000658	调查马尔柯斯伐木场后获得证据	말코스 벌목지 조사 후 증거 획득	
QUEST_LV_0500_20210125_000659	消灭袭击的 %s	습격한 %s 처치	
QUEST_LV_0500_20210125_000660	向拉达女神聆听加桥森林的计画	라다 여신에게 덧댄 다리 숲에서의 계획을 듣기	
QUEST_LV_0500_20210125_000661	平安地到达加桥森林了。{nl}拉达女神已先行来到这裡查看加桥森林的情况了。{nl}请将你拿来的水晶碎片和拉达女神询问是否看到了什麽。	무사히 덧댄다리 숲에 도착했습니다{nl}라다 여신은 앞서 이곳에 와서 덧댄다리 숲의 정황을 살핀 듯합니다{nl}당신이 가져온 수정 조각에 대한 것과 라다 여신이 무엇을 봤는지 물어보세요	
QUEST_LV_0500_20210125_000662	加桥森林似乎有比莲帕拉沙池塘有更多的龟裂，{nl}魔族们仍从散发出光与烟气的龟裂中採集著莫提尼斯。{nl}请与拉达女神对话。	덧댄다리 숲에는 렘파라사 연못에서 보았던 균열이 더 많아 보입니다{nl}여전히 빛과 연기를 뿜어내는 균열 속에서 마족들이 머티니스를 채굴 중이었습니다{nl}라다 여신과 대화하세요	
QUEST_LV_0500_20210125_000663	拉达女神因为过去的事情，决定与你一起执行守护欧勒夏的任务。{nl}请向拉达女神询问计画。	라다 여신은 과거 일로, 당신은 오르샤 수호의 임무로 함께 움직이기로 했습니다{nl}라다 여신에게 계획을 물어보세요	
QUEST_LV_0500_20210125_000664	歼灭加桥森林入口处的魔族	덧댄다리 숲 진입로의 마족 처치	
QUEST_LV_0500_20210125_000665	为了阻止加桥森林的魔族们移动到莲帕拉沙池塘，你必须歼灭魔族。	당신은 덧댄다리 숲의 마족들이 렘파라사 연못으로 이동하는 걸 저지하기 위해 마족들을 처치해야 합니다	
QUEST_LV_0500_20210125_000666	回去找拉达女神	라다 여신에게 돌아가기	
QUEST_LV_0500_20210125_000667	消灭了一部分在加桥森林和莲帕拉沙池塘连接通道上的魔族，{nl}请回去找拉达女神。	덧댄다리 숲과 렘파라사 연못이 이어진 통로 부근 마족들을 일부 정리했습니다{nl}라다 여신에게 돌아가세요	
QUEST_LV_0500_20210125_000668	歼灭入口处的魔族	진입로의 마족 처치	
QUEST_LV_0500_20210125_000669	整顿了前往莲帕拉沙池塘的入口。{nl}现在你必须要扫荡加桥森林的魔族，并向拉达女神询问将来是否要同路前行。	렘파라사 연못으로 가는 진입로는 정리했습니다{nl}당신은 이제 덧댄 다리 숲의 마족들을 소탕해야 하며, 라다 여신에게 가는 길이 같을지 이야기해 보세요	
QUEST_LV_0500_20210125_000670	调查吉贝尼大道的莫提尼斯龟裂	지베니 대로의 머티니스 균열 조사하기	
QUEST_LV_0500_20210125_000671	拉达女神为了回收莫提尼斯前往了吉贝尼大道。{nl}你为了进入加桥森林更深处也同样必须经过那裡。{nl}正好那裡有莫提尼斯龟裂，有调查的必要性。	라다 여신은 머티니스 회수를 위해 지베니 대로로 향한다고 합니다{nl}당신 역시, 덧댄다리 숲의 깊은 곳으로 들어가기 위해서는 그곳을 지나야만 합니다{nl}마침 그곳에는 머티니스 균열이 있으니 조사할 가치가 있습니다	
QUEST_LV_0500_20210125_000672	在吉贝尼大道上方与拉达女神见面	지베니 대로 위쪽에서 라다 여신을 만나기	
QUEST_LV_0500_20210125_000673	调查了莫提尼斯龟裂。{nl}正好拉达女神也到达了吉贝尼大道上方。{nl}请去见拉达女神。	머티니스 균열을 조사했습니다{nl}마침 라다 여신도 지베니 대로 위쪽에 도착했습니다{nl}라다 여신을 만나세요	
QUEST_LV_0500_20210125_000674	向拉达女神询问魔力的来历	라다 여신에게 마력의 정체에 관해 묻기	
QUEST_LV_0500_20210125_000675	拉达女神说融化龟裂的魔力来源是注视者的魔力。{nl}请继续聆听拉达女神。	라다 여신은 균열을 녹이고 있는 마력의 정체가 주시자의 마력이라고 했습니다{nl}라다 여신의 이야기를 더 들어보세요	
QUEST_LV_0500_20210125_000676	越过布维彼德之桥在摩鲁哥斯农场寻找魔力的根源地	부뷜비떼 다리를 건너 모르꼬스 농장에서 마력의 근원지를 찾기	
QUEST_LV_0500_20210125_000677	拉达女神为了阻止莫提尼斯的採集，表示需要找出魔力的根源地并破坏它。{nl}利用拉达女神降下的祝福可找到魔力的根源地。	라다 여신은 머티니스 채굴을 막기 위해 마력의 근원지를 찾아 파괴할 필요가 있다고 합니다{nl}라다 여신이 떨어뜨린 축복으로 마력의 근원지를 찾을 수 있을 듯합니다	
QUEST_LV_0500_20210125_000678	确认注视者的黑色水晶	주시자의 검은 수정을 확인하기	
QUEST_LV_0500_20210125_000679	利用拉达女神的祝福可找到注视者的黑色水晶。{nl}请查看是否可破坏。	라다 여신의 축복을 이용해 주시자의 검은 수정을 찾을 수 있었습니다{nl}파괴가 가능할지 살펴보세요	
QUEST_LV_0500_20210125_000680	破坏注视者的黑色水晶	주시자의 검은 수정을 파괴하기	
QUEST_LV_0500_20210125_000681	使用拉达女神的祝福破坏黑色水晶	라다 여신의 축복을 사용해 검은 수정을 파괴하기	
QUEST_LV_0500_20210125_000682	确认莫提尼斯龟裂	머티니스 균열을 확인하기	
QUEST_LV_0500_20210125_000683	拉达女神的祝福成功地破坏了注视者的黑色水晶。{nl}请确认莫提尼斯龟裂是否有凝固。	라다 여신의 축복이 주시자의 검은 수정을 파괴하는 데 성공했습니다{nl}머티니스 균열이 굳었는지 확인해보세요	
QUEST_LV_0500_20210125_000684	再次调查莫提尼斯龟裂	머티니스 균열을 다시 조사하기	
QUEST_LV_0500_20210125_000685	虽在摩鲁哥斯农场破坏了注视者的黑色水晶，但吉贝尼大道中的莫提尼斯龟裂仍沸腾著。{nl}看来一定还有其他的黑色水晶。{nl}请调查莫提尼斯龟裂以获得线索。	모르꼬스 농장에서 주시자의 검은 수정을 파괴했지만 지베니 대로의 머티니스 균열은 여전히 끓고 있었습니다{nl}다른 검은 수정이 있는 게 분명합니다{nl}머티니스 균열을 조사해 단서를 얻으세요	
QUEST_LV_0500_20210125_000686	在宝岚林间小路使用拉达女神的祝福寻找注视者的黑色水晶	보난 숲길에서 라다 여신의 축복을 사용해 주시자의 검은 수정 찾기	
QUEST_LV_0500_20210125_000687	仍可感受到因莫提尼斯龟裂而流散的魔力。{nl}请在尚未调查的宝岚林间小路寻找注视者的黑色水晶。	머티니스 균열로 스며드는 마력이 여전히 느껴집니다{nl}아직 조사하지 않은 보난 숲길에서 주시자의 검은 수정을 찾아보세요	
QUEST_LV_0500_20210125_000688	在宝岚林间小路寻找到注视者的黑色水晶了，{nl}请再次使用拉达女神的祝福破坏注视者的黑色水晶。	보난 숲길에서 주시자의 검은 수정을 찾아냈습니다{nl}다시 라다 여신의 축복을 사용하여 주시자의 검은 수정을 파괴하세요	
QUEST_LV_0500_20210125_000689	破坏黑色水晶	검은 수정을 파괴하기	
QUEST_LV_0500_20210125_000690	虽失去了拉达女神的祝福，但不管怎麽样还是要破坏注视者的黑色水晶。{nl}请破坏注视者的黑色水晶。	라다 여신의 축복을 잃었지만, 어떻게든 주시자의 검은 수정을 파괴해야만 합니다{nl}주시자의 검은 수정을 파괴하세요	
QUEST_LV_0500_20210125_000691	歼灭袭击的魔族	습격한 마족들을 처치하기	
QUEST_LV_0500_20210125_000692	为了阻止莫提尼斯的採集，拉达女神想要破坏注视者的黑色水晶。{nl}请你去处理侵攻欧勒夏的魔族。	라다 여신은 머티니스 채굴을 막기 위해 주시자의 검은 수정을 파괴할 생각입니다{nl}당신은 오르샤를 침공한 마족들을 처리하세요	
QUEST_LV_0500_20210125_000693	在你对抗侵攻欧勒夏的魔族同时，拉达女神找到了自己的目标。{nl}请与拉达女神对话。	당신이 오르샤를 침공한 마족들을 상대하는 동안 라다 여신은 자신의 목표를 이룬 듯합니다{nl}라다 여신과 대화하세요	
QUEST_LV_0500_20210125_000694	请与拉达女神对话	라다 여신과 대화하세요	
QUEST_LV_0500_20210125_000695	拉达女神成功地破坏了最后的黑色水晶。{nl}请与拉达女神对话。	라다 여신이 마지막 검은 수정을 파괴하는 데 성공했습니다{nl}라다 여신과 이야기하세요	
QUEST_LV_0500_20210125_000696	为了前往帕欧皮斯渡口， 前往宝岚林间小路的上方道路	파우피스 나루로 가기 위해 보난 숲길의 윗길로 올라가기	
QUEST_LV_0500_20210125_000697	拉达女神为了回收莫提尼斯，而你为了破坏魔族的目的，必须要寻找出莫提尼斯储藏所并破坏它。{nl}为了进入森林深处，现在必须要前往帕欧皮斯渡口。	머티니스 저장소를 찾아 라다 여신은 머티니스의 회수를 위해, 당신은 마족의 목적을 무산시키기 위해 파괴해야합니다{nl}숲 깊이 들어가기 위해 지금은 파우피스 나루로 향해야 합니다	
QUEST_LV_0500_20210125_000698	拉达女神为了回收莫提尼斯，而你为了破坏魔族的目的，必须要寻找出莫提尼斯储藏所并破坏它。{nl}为了进入森林深处，现在必须要前往帕欧皮斯渡口。	머티니스 저장소를 찾아 라다 여신은 머티니스의 회수를 위해, 당신은 마족의 목적을 무산시키기 위해 파괴해야 합니다{nl}숲 깊이 들어가기 위해 지금은 파우피스 나루로 향해야 합니다	
QUEST_LV_0500_20210125_000699	消灭达勒巴斯史梅修	다르바스 스매셔 처치	
QUEST_LV_0500_20210125_000700	佔据帕欧皮斯渡口的势力	파우피스 나루를 점거한 세력들	
QUEST_LV_0500_20210125_000701	在帕欧皮斯渡口与拉达女神见面	파우피스 나루에서 라다 여신을 만나기	
QUEST_LV_0500_20210125_000702	拉达女神去追击消失的注视者了。{nl}需要前进森林的更深处，因此请你前往帕欧皮斯渡口与拉达女神见面。	사라진 주시자를 라다 여신이 쫓아갔습니다{nl}숲의 더 깊은 곳으로 갔을 테니 파우피스 나루로 가서 라다 여신을 만나세요	
QUEST_LV_0500_20210125_000703	与拉达女神对话	라다 여신과 이야기하기	
QUEST_LV_0500_20210125_000704	魔族们正在帕欧皮斯渡口互相对立著。{nl}请与拉达女神对话。	파우피스 나루에는 마족들끼리 서로 대치 중입니다{nl}라다 여신과 이야기하세요	
QUEST_LV_0500_20210125_000705	从拉达女神那裡得知帕欧皮斯渡口的情况了。{nl}请与拉达女神对话，确认从这裡开始各自要做的事情。	파우피스 나루의 상황을 라다 여신으로부터 들었습니다{nl}여기서부터 각자 할 일이 무엇일지 라다 여신과 이야기하세요	
QUEST_LV_0500_20210125_000706	在没有人迹的渡口歼灭魔族并获得上级的标志	인적없는 나루터에서 마족들을 처치하고 상급자의 증표 획득하기	
