QUEST_LV_0500_20220614_001897	与欧勒夏手续负责人说话	오르샤 수속 담당자와 이야기하기	
QUEST_LV_0500_20220614_001898	从莫洛斯官邸抵达欧勒夏了。 {nl} 少女的幻影要求帮助领主。 {nl}和入港手续负责人交谈，询问有关伊内沙的位置。	모로스 공관에서 오르샤로 도착했다. {nl} 소녀의 환영은 영주를 도우라고 했다. {nl} 입항 수속자에게 말을 걸어 이네사의 위치에 대해서 물어보자.	
QUEST_LV_0500_20220614_001899	手续负责人在表示是启示者后，就很亲切地告知了领主的位置。 {nl}请和欧勒夏的领主伊内沙黑蒙戴伊说话。	수속 담당자는 계시자인 것을 밝히자 친절하게 영주의 위치에 대해서 알려주었다.{nl}오르샤의 영주 이네사 헤먼데일과 이야기를 하자.	
QUEST_LV_0500_20220614_001900	与伊内沙黑蒙戴伊说话	이네사 헤먼데일과 이야기하기	
QUEST_LV_0500_20220614_001901	知道我们是启示者的伊内决定提供我们所需要的支援。 {nl}和伊内沙说话吧。	우리가 계시자임을 안 이네사는 우리에게 필요한 지원을 해주기로 한다.{nl}이네사와 이야기하자.	
QUEST_LV_0500_20220614_001902	女神远征队 	가디스 레이드 	
QUEST_LV_0500_20220614_001903	沉没的海盗船	 가라앉는 나포선	
QUEST_LV_0500_20220614_001904	寻找欧勒夏入港手续负责人	오르샤의 입항 수속 담당자를 찾기	
QUEST_LV_0500_20220614_001905	听说进入欧勒夏的船舶们的入港手续负责人正在搜索失踪的难民们。 {nl}请了解一下发生了什么事，并帮助入港手续负责人吧。	오르샤로 들어오는 선박들의 입항 수속 담당자가 실종된 피난민들을 수색하고 있다고 합니다.{nl}무슨 일이 있는지 파악하고 입항 수속 담당자를 도우세요.	
QUEST_LV_0500_20220614_001906	在帕萨卡峡谷寻找尼悠雷进行调查	파사카 협곡에서 니욜레를 찾아 조사하기	
QUEST_LV_0500_20220614_001907	在发生失踪者的船上有潜入的魔族，而且在该魔族的部份随身物品中有	실종자가 발생한 배에 숨어든 마족이 있었고 해당 마족의 소지품 일부에서 	
QUEST_LV_0500_20220614_001908	的名字被提到了。 {nl}	라는 이름이 언급되었습니다.{nl}	
QUEST_LV_0500_20220614_001909	是很常见的人类名字，但入港手续负责人被魔族提及，的确存在可疑之处。 {nl}为了弄清尼悠雷的真实身份，需要进行调查。请先去找在帕萨卡峡谷的尼悠雷进行调查吧。	는 흔한 인간의 이름이지만, 입항 수속 담당자는 마족에게 언급되어 의심스러운 부분이 있다고합니다.{nl}니욜레의 정체를 알아내기 위해 조사가 필요합니다. 먼저 파사카 협곡에 있는 니욜레를 찾아가 조사하세요.	
QUEST_LV_0500_20220614_001910	和帕萨卡峡谷的尼悠雷对话	파사카 협곡의 니욜레와 대화하기	
QUEST_LV_0500_20220614_001911	在帕萨卡峡谷找到了尼悠雷。 {nl}请和帕萨卡峡谷的尼悠雷对话。	파사카 협곡에서 니욜레를 찾았습니다.{nl}파사카 협곡의 니욜레와 대화하세요	
QUEST_LV_0500_20220614_001912	在大王关口寻找尼悠雷进行调查	대왕의 관문에서 니욜레를 찾아 조사하기	
QUEST_LV_0500_20220614_001913	在帕萨卡峡谷名叫尼悠雷的人，至少与此次事件没有关联。 {nl}接下来，在大王关口寻找尼悠雷进行调查吧。	파사카 협곡에서 찾은 니욜레라는 사람은 적어도 이번 사건과는 연관이 없었습니다.{nl}다음은 대왕의 관문에서 니욜레를 찾아 조사하세요	
QUEST_LV_0500_20220614_001914	和大王关口的尼悠雷对话	대왕의 관문의 니욜레와 대화하기	
QUEST_LV_0500_20220614_001915	在大王关口找到尼悠雷了。 {nl}大王关口的尼悠雷介绍自己是研究员。 {nl}请和尼悠雷对话	대왕의 관문에서 니욜레를 찾았습니다.{nl}대왕의 관문에 있는 니욜레는 자신을 연구원이라고 소개했습니다.{nl}니욜레와 대화하세요	
QUEST_LV_0500_20220614_001916	在伊基提沿岸寻找尼悠雷调查	이기티 연안에서 니욜레를 찾아 조사하기	
QUEST_LV_0500_20220614_001917	在大王关口找到的尼悠雷也似乎与此次事件没有关联。 {nl}最后，去找在伊基提沿岸的尼悠雷吧。	대왕의 관문에서 찾은 니욜레도 이번 사건과는 연관성이 없어보입니다.{nl}마지막으로 이기티 연안에 있다는 니욜레를 찾아가세요.	
QUEST_LV_0500_20220614_001918	和伊基提沿岸的继承者尼悠雷对话	이기티 연안의 전승자 니욜레와 대화하기	
QUEST_LV_0500_20220614_001919	在伊基提沿岸找到了侍奉尤拉泰女神的继承者尼悠雷了。 {nl}请和继承者尼悠雷对话	이기티 연안에서 유라테 여신을 모시는 전승자 니욜레를 찾았습니다{nl}전승자 니욜레와 대화하세요	
QUEST_LV_0500_20220614_001920	和欧勒夏入港手续负责人对话	오르샤의 입항 수속 담당자와 대화하기	
QUEST_LV_0500_20220614_001921	透过继承者尼悠雷从尤拉泰女神那里获得了神谕。 {nl}尤拉泰女神要求对事件的真相缄口不言，请仅将必要的部分向入港手续负责人报告。	전승자 니욜레를 통해 유라테 여신으로부터 신탁을 받았습니다.{nl}유라테 여신은 사건의 진상에 대해 함구하라 하였으니, 필요한 부분만 입항 수속 담당자에게 보고하세요.	
QUEST_LV_0500_20220614_001922	回去找伊基提沿岸的尼悠雷	이기티 연안의 니욜레에게 돌아가기	
QUEST_LV_0500_20220614_001923	我适当的和欧勒夏入港手续负责人瞎掰一下了。 {nl}虽然入港手续负责人有些犹豫，幸好没有怀疑。 {nl}回去找伊基提沿岸的尼悠雷吧。	오르샤 입항 수속 담당자에게는 적당히 이야기를 둘러댔습니다{nl}입항 수속 담당자는 다소 찜찜한 기분을 내비쳤지만, 다행히 의심은 없어보입니다{nl}이기티 연안의 니욜레에게 돌아가세요	
QUEST_LV_0500_20220614_001924	完成女神远征队：沉没的海盗船	가디스 레이드 : 가라앉는 나포선 완료하기	
QUEST_LV_0500_20220614_001925	请沿着尼悠雷在伊基提沿岸往开辟的道路，去消灭洁莉泽吧。 {nl}不论难度如何，必须完成1次女神远征队：沉没的海盗船。	이기티 연안에서 니욜레가 열어준 길을 따라 젤리젤을 처치하러 가십시오{nl}가디스 레이드 : 가라앉는 나포선을 난이도에 상관 없이 1회 완료하여야 합니다	
QUEST_LV_0500_20220830_001926	看到?平安到达，我稍微放心了。	무사히 도착한 것을 보니 조금 안심이 되는군.	대장군 라민
QUEST_LV_0500_20220830_001927	获得关于注视者的线索后，追?结果发现这个??藏在这里的某个地方。	주시자가 사라진 곳에 대한 단서를 얻고 추적한 결과, 이 곳 어딘가에 놈이 숨었다는 사실을 알았다.	대장군 라민
QUEST_LV_0500_20220830_001928	这里是领主德慕尔建造的?密场所{nl}，他判断大规模投入士兵太危险了。	이 곳은 델무어 영주가 만든 비밀의 장소 같은 곳이라{nl}대규모로 병사들을 투입하는 것은 너무 위험하다고 판단했다.	대장군 라민
QUEST_LV_0500_20220830_001929	所以他只叫?亚乌塔和?以及少数士兵来。	그래서 파야우타와 자네 그리고 소수의 병사들만 오라고 했다.	대장군 라민
QUEST_LV_0500_20220830_001930	这里肯定有注视者。{nl}不过，从现在开始要搜寻?在那里。	이 곳에 주시자가 있는 것은 분명해.{nl}그러나 어디에 숨었는지는 지금부터 수색해야겠지.	대장군 라민
QUEST_LV_0500_20220830_001931	如果做好粉碎那??的私欲的准备，那就行动?。	놈의 야욕을 부술 준비가 되었다면 움직여 보자.	대장군 라민
QUEST_LV_0500_20220830_001932	不寻常。	심상치 않아.	대장군 라민
QUEST_LV_0500_20220830_001933	注视者到底想在这地方做什??？	주시자는 도대체 이곳에서 무엇을 하려는 거지? 	대장군 라민
QUEST_LV_0500_20220830_001934	?是不祥。如果连在这里都拿不出证据的话…	어쩐지 불길해. 여기서조차 결론이 나지 않는다면…	대장군 라민
QUEST_LV_0500_20220830_001935	士兵们正在动摇。{nl}我安抚士兵们之后就会出发，{nl}??我调?一下?亚乌塔和刚才的征兆?。	병사들이 동요하고 있다.{nl}나는 병사들을 진정시킨 뒤에 출발할테니{nl}파야우타와 방금 전 징조에 대해 조사해 주겠나?	대장군 라민
QUEST_LV_0500_20220830_001936	士兵之间好像流传著?可?的话。	병사들 사이에서 흉흉한 말들이 돌았나봐.	파야우타
QUEST_LV_0500_20220830_001937	安抚不安的士兵也是大将军的任务?。	불안해 하는 병사들을 진정시키는 일도 대장군님의 임무겠지.	파야우타
QUEST_LV_0500_20220830_001938	所以，我们也好好完成我们的任务?！{nl}我要侦察周围，??我?理一下周围的怪物。	그러니 우리도 우리의 임무를 잘 해내자!{nl}나는 주변을 정찰할테니까 계시자 너는 그쪽 주변 몬스터들을 정리해줘.	파야우타
QUEST_LV_0500_20220830_001939	现在不是这样的时候。{nl}快点各自做自己该做的事情?。	이러고 있을 때가 아니야.{nl}빨리 각자 할 일을 하자.	파야우타
QUEST_LV_0500_20220830_001940	拉明大将军好像已经完成了士兵们的重新整顿。{nl}现在快去?！	라민 대장군님이 병사들의 재정비를 마친 거 같아.{nl}이제 가 보자!	파야우타
QUEST_LV_0500_20220830_001941	首先对动摇的士兵采取了适当的措施。	우선 동요하는 병사들에게는 적당한 조치를 취했다.	대장군 라민
QUEST_LV_0500_20220830_001942	现在开始调??。{nl}准备好了?？	이제 조사를 시작하도록 하지.{nl}준비는 되었나?	대장군 라민
QUEST_LV_0500_20220830_001943	不过，放著动摇的士兵们采取行动，情报非常不?。{nl}我先再次回去欧勒夏整顿士兵，{nl}?从伊内沙领主那获得情报回来?。	그러나 동요하는 병사들을 두고 이동하기에는 정보가 너무 부족하다.{nl}난 우선 다시 오르샤로 돌아가 병사를 정돈하고,{nl} 이네사 영주로부터 정보를 구해서 돌아오지.	대장군 라민
QUEST_LV_0500_20220830_001944	到那时?止，我会和?亚乌塔一起尽量收集情报。	그때까지 파야우타와 함께 최대한 모을 수 있는 정보를 모아주게.	대장군 라민
QUEST_LV_0500_20220830_001945	拉明大将军去一?欧勒夏时，我们最好还是做我们能做的事情。	라민 대장군님이 오르샤에 다녀오실 동안 우리는 우리가 할 수 있는 일을 하는 게 좋겠어.	파야우타
QUEST_LV_0500_20220830_001946	我在?击退怪物的时候，调?了周围。{nl}到处都有像是红色痕迹一样的东西。	네가 몬스터를 잡고 있는 동안 주변을 조사했는데,{nl}여기저기에서 붉은 흔적 같은 것이 있었어.	파야우타
QUEST_LV_0500_20220830_001947	这个…感觉就像是?久以前的克鲁比那。从?们身上感受到了和刚才的震动相似的魔力波长。?可以?我调?在拉伊普斯诺斯待命室里是否有能喷出这种红色痕迹的水晶?？{nl}我会?看?所调?的红色痕迹。	이건 … 오래 전의 크루비나 같은 느낌이야. 그것들에서 방금 전 진동과 비슷한 마력 파장 같은 게 느껴졌거든. 너는 라이프스노스 대기실에 혹시 이런 붉은 흔적을 뿜는 수정 같은 게 있나 알아봐줄래?{nl}난 내가 조사한 붉은 흔적들을 좀 살펴봐야겠어.	파야우타
QUEST_LV_0500_20220830_001948	看这些痕迹的时候，看起来就像是克鲁比那…	이 흔적들을 볼 때, 이건 크루비나 같아보이는데..	파야우타
QUEST_LV_0500_20220830_001949	看到从那边回来的样子，果然我预期的一致。{nl}给我赤红水晶?。	그쪽에서 돌아오는 걸 보니 역시, 예상이 맞았네. {nl}그 붉은 수정들을 줘봐.	파야우타
QUEST_LV_0500_20220830_001950	?所拿回来的赤红水晶如我所预料，肯定与{#003399}克鲁比那{/}有关系。	네가 가져온 붉은 수정들은 내 예상대로, {#003399}크루비나{/}와 관련된 게 틀림없어.	파야우타
QUEST_LV_0500_20220830_001951	如果?预料的没错，等候室中央周围的怪物们那里也会?有赤红水晶，{nl}沿著那条路走，就可以见到注视者了?？	네 예상이 맞다면, 대합실 중앙 주변의 몬스터들에게도 이 붉은 수정들이 박혀있을거고,{nl}그 길을 따라 가면 주시자놈을 만날 수 있겠는걸?	파야우타
QUEST_LV_0500_20220830_001952	沿著路消灭怪物收集水晶之后，再来?我?。{nl}这些赤红水晶会有用处的。	길을 따라 몬스터들을 잡아서 수정들을 모은 뒤에 만나자.{nl}이 붉은 수정이 쓸모가 있을 거야.	파야우타
QUEST_LV_0500_20220830_001953	果然?马上就?到了。{nl}现在?带来的水晶有助于打开这个结界。	역시 바로 찾아왔네.{nl}이제 네가 가져온 수정들이 이 결계를 여는 데 도움이 될 것 같아.	파야우타
QUEST_LV_0500_20220830_001954	要不要?近一下结界?？	한 번 결계에 다가가 볼까?	파야우타
QUEST_LV_0500_20220830_001955	如果赤红水晶?的是?纯粹的克鲁比那，{nl}然后，那结界是注视者的结界的话，应该可以打破那结界…！	붉은 수정이 정말 순수한 크루비나라면,{nl}그리고 저 결계가 주시자의 결계라면 결계를 부술 수 있을거야…!	파야우타
QUEST_LV_0500_20220830_001956	快去看看?。	어서 한 번 가봐.	파야우타
QUEST_LV_0500_20220830_001957	辛苦了。{nl}有什?收获?？	고생했다.{nl}무언가 수확이 있었나?	대장군 라민
QUEST_LV_0500_20220830_001958	原来那个就是卷轴?。{nl}果然。答案总是在问题的附近。	그건 스크롤이군.{nl}역시. 언제나 해답은 문제의 근처에 있는 법.	대장군 라민
QUEST_LV_0500_20220830_001959	现在使用那卷轴，就能解除那结界。{nl}那个任务就交给?了。{nl}我在后面观察周围。	이제 그 스크롤을 이용해서 저 결계를 해제하는 것이다.{nl}그 역할은 자네가 해 주게.{nl}난 뒤에서 주변을 살피도록 하지.	대장군 라민
QUEST_LV_0500_20220830_001960	解除结界?。{nl}如果是?的神圣力，也许足?让卷轴有反应。	결계를 해제해 주게.{nl}아마 자네의 신성력이라면 충분히 스크롤이 반응할거다.	대장군 라민
QUEST_LV_0500_20220830_001961	结界已解除了。{nl}向隐藏的通路进军。	결계가 해제되었군.{nl}숨겨진 통로로 진군한다.	대장군 라민
QUEST_LV_0500_20220830_001962	注视者可能是透过等候室进入这里后，?动了结界。{nl}往里走?。	주시자는 대합실을 통해서 이 곳으로 진입한 뒤 결계를 작동해 두었을 것이다.{nl}안쪽으로 들어가 보자.	대장군 라민
QUEST_LV_0500_20220830_001963	?是让人心情不好的气息?…{nl}一定要在这里?出注视者?消灭掉才行…	기분나쁜 기운이군....{nl}이 곳에서 반드시 주시자를 찾아 없애야 한다....	대장군 라민
QUEST_LV_0500_20220830_001964	根据在欧勒夏听见的情报，{nl}这里?可能是德慕尔鲁巴因防范自己无法控制克鲁比那的力量， {nl}而在四处制作了魔力控置装置。	오르샤에서 들은 정보에 의하면,{nl}이 곳에는 아마도 델무어 르바임이 자신이 크루비나의 힘을 제어할 수 없을 때를 대비해서{nl}곳곳에 마력 제어장치를 만들어 두었다는 것이다.	대장군 라민
QUEST_LV_0500_20220830_001965	无论注视者是否使用了那装置，都没有关系了。{nl}首先，?了以后做准备，确保深处的路，{nl}寻?那控制装置，??出能控制那魔力的方法会比较好。	주시자가 그 장치들을 이용했는지의 여부와는 관계없이,{nl}우선 나중을 대비하고 심부로의 길을 확보하기 위해{nl}그 제어장치들을 찾아 마력을 제어할 방도를 만들어 두면 좋을 것이다.	대장군 라민
QUEST_LV_0500_20220830_001966	虽然拿回了显示控制装置的位置的地图…	제어 장치의 위치를 표시한 지도를 여기 받아왔는데…	대장군 라민
QUEST_LV_0500_20220830_001967	一展开显示控制装置的地图就遭到怪物的袭击…{nl}这是偶然?？	제어 장치가 표시된 지도를 펼치는 순간에 몬스터의 습격이라니....{nl}우연인가?	대장군 라민
QUEST_LV_0500_20220830_001968	总之，已阻止了袭击，所以我就说明一下魔力控制装置?。	어쨌든 습격을 막았으니 마력 제어 장치에 대한 설명을 하도록 하지.	대장군 라민
QUEST_LV_0500_20220830_001969	我们现在必须操作这4个魔力控制装置。	우리는 이제 이 4개의 마력 제어 장치를 조작해야만 한다.	대장군 라민
QUEST_LV_0500_20220830_001970	第一个魔力控制装置在德慕尔连接路那边，?确认一下?。	첫번째 마력 제어 장치는 델무어 연결로 쪽에 있으니 자네가 확인 해 보도록.	대장군 라민
QUEST_LV_0500_20220830_001971	?一边?亚乌塔就交给?走一??。	다른 쪽은 파야우타 자네가 다녀오게.	대장군 라민
QUEST_LV_0500_20220830_001972	前往这边显示的第一个装置??动?。{nl}位置就标示在地图上。	이 쪽에 표시된 첫 번째 장치로 가서 작동을 시켜라.{nl}위치는 지도에 표시되어 있다.	대장군 라민
QUEST_LV_0500_20220830_001973	控制装置还没有运作?？{nl}可能是因?好久没有使用，所以魔力没有了?。	제어 장치가 작동하지 않았다는 것인가?{nl}아마도 오랜 시간 사용하지 않아서 마력이 떨어진 모양이군. 	대장군 라민
QUEST_LV_0500_20220830_001974	?了应对这种情况，欧勒夏的领主让出了自己的坠饰。{nl}虽然是?小的坠饰，但据说可以注入大量的魔力。	이런 상황을 대비해서 오르샤의 영주가 자신의 펜던트를 내주었다.{nl}작은 펜던트지만 대량의 마력을 주입할 수 있다고 한다.	대장군 라민
QUEST_LV_0500_20220830_001975	消灭周围的怪物们，将魔力注入至坠饰后，应该就可以重新?动控制装置。	주변의 몬스터들을 처치해서 펜던트에 마력을 주입해 두면 제어 장치를 다시 가동할 수 있을 것이다.	대장군 라민
QUEST_LV_0500_20220830_001976	击退在这一带的怪物，对坠饰补充魔力就好。	이 일대에 있는 몬스터를 잡아 펜던트에 마력을 채우면 된다.	대장군 라민
QUEST_LV_0500_20220830_001977	?是了不起。{nl}这些数量，控制装置就能运作了。	훌륭하군.{nl}이 정도면 제어 장치가 작동할 것이다.	대장군 라민
QUEST_LV_0500_20220830_001978	坠饰似乎已收集足?的魔力了。{nl}现在带著那个，再次前往控制装置??动?。	펜던트에 마력이 충분히 모인 듯 하다.{nl}이제 그걸 가지고 다시 제어 장치로 가서 작동시키도록.	대장군 라민
QUEST_LV_0500_20220830_001979	魔力控制装置运作了?？	마력 제어 장치는 작동되었나?	대장군 라민
QUEST_LV_0500_20220830_001980	第一，魔力控制装置已运作了。	첫 번째 마력 제어 장치가 작동되었군.	대장군 라민
QUEST_LV_0500_20220830_001981	因?控制装置运作了，让人心情不好的压迫感似乎稍微消失了。{nl}辛苦了。	역시. 제어장치가 작동되니 기분 나쁜 위압감이 조금 사라진 것 같다.{nl}수고했다.	대장군 라민
QUEST_LV_0500_20220830_001982	那?，现在轮到?动剩下的魔力控制装?了。{nl}?…越过中央广场，应该就能看到了。	그럼 이제 나머지 마력 제어 장치를 작동시킬 차례다.{nl}어디… 중앙 광장을 넘어가면 있는 모양이군.	대장군 라민
QUEST_LV_0500_20220830_001983	在中央广场和?亚乌塔会合后前往。	중앙 광장에서 파야우타와 합류해서 간다.	대장군 라민
QUEST_LV_0500_20220830_001984	没关系?？	괜찮나?	대장군 라민
QUEST_LV_0500_20220830_001985	注视者的最后一定……。	주시자의 마지막은 반드시…….	대장군 라민
QUEST_LV_0500_20220830_001986	?，我暂时与拉明大将军有话要说。{nl}能不能让一下位子?？	아, 나는 잠시 라민 대장군님이랑 할 이야기가 있어.{nl}자리를 좀 비켜주지 않을래? 	파야우타
QUEST_LV_0500_20220830_001987	竟然在暂时放心的时候，遭到了奇袭…{nl}作?大将军的我?是?愧。	잠시 방심한 사이에 기습을 당하다니...{nl}대장군으로서 부끄럽군.	대장군 라민
QUEST_LV_0500_20220830_001988	无论如何，?快?动控制装置，追击注视者?。	어쨌든 빨리 제어 장치를 작동하고 주시자를 추격하도록 하지.	대장군 라민
QUEST_LV_0500_20220830_001989	我暂时要去确认一下士兵们的状态。{nl}如果有什?事，就与?亚乌塔对话。	난 잠시 병사들의 상태를 확인하고 오겠다.{nl}무슨 일이 생기면 파야우타와 이야기를 하도록.	대장군 라민
QUEST_LV_0500_20220830_001990	马上就感觉到第二个魔力装置启动了！{nl}辛苦了！	두 번째 마력 장치가 작동한게 바로 느껴질 정도였어!{nl}고생했어!	파야우타
QUEST_LV_0500_20220830_001991	坠饰的魔力也还?充足，最后的魔力控制装置应该没有问题。{nl}马上?动最后的魔力装置?。	펜던트의 마력도 아직 충분한 걸 보니 마지막 마력 제어 장치는 문제 없을거야.{nl}바로 마지막 마력 장치를 작동해보자.	파야우타
QUEST_LV_0500_20220830_001992	事情正在有条不紊地进行著。{nl}就这?把那??…	일이 차근차근 진행되고 있어.{nl}이대로 놈을…	파야우타
QUEST_LV_0500_20220830_001993	刚才的震动和巨响是什??？{nl}拉明大将军听见了?？	방금 진동이랑 굉음은 뭐지?{nl}라민 대장군님은 들으셨나요?	파야우타
QUEST_LV_0500_20220830_001994	刚才的巨响是什?？	방금 전 굉음은 뭐지?	대장군 라민
QUEST_LV_0500_20220830_001995	?动了最后的魔力控制装置，结果出现了这样的巨响？{nl}先去声音的源头的中央广场看看?。	마지막 마력 제어 장치를 작동시켰더니 이런 굉음이 발생했다고?{nl}일단 소리의 근원인 중앙 광장 쪽으로 가보자.	대장군 라민
QUEST_LV_0500_20220830_001996	终于抵达了注视者?藏的议事堂了。{nl}注视者所在的位置都是特定的。{nl}那家?在这里好像在策划著什?。	드디어 주시자가 숨어있는 의사당에 도착했다.{nl}주시자가 있는 위치는 특정할 수 있다.{nl}녀석은 여기서 무언가를 꾸미고 있는 모양이야.	대장군 라민
QUEST_LV_0500_20220830_001997	总之，注视者所在的地方会有结界。{nl}从这里开始我也没从领主那里听到过什?。	일단 주시자가 있을 법한 곳에 결계가 있다.{nl}여기서부터는 나도 영주에게 들은 것이 없다.	대장군 라민
QUEST_LV_0500_20220830_001998	?示者，如果是?的力量也许可以破坏结界。{nl}破坏结界看看?。	계시자, 너의 힘이라면 결계를 파괴할 수도 있을지 모른다.{nl}결계를 파괴해봐라.	대장군 라민
QUEST_LV_0500_20220830_001999	时间是分秒必争。{nl}?快破坏结界?。	시간은 일각을 다투고 있다.{nl}어서 결계를 파괴해라.	대장군 라민
QUEST_LV_0500_20220830_002000	有时候以获得?示之人的神圣力也难以破坏…{nl}?亚乌塔，没有什?办法?？	한 때 계시를 받은 자의 신성력으로도 파괴는 힘들다는 건가…{nl}파야우타, 무언가 방법이 없나?	대장군 라민
QUEST_LV_0500_20220830_002001	我从等候室开始就感觉到了…{nl}这地方有我们以?全部都消失?久的克鲁比那，而且那克鲁比那对结界?没有太大的反应。{nl}好像有更?大的力量…在守护这个魔法?障。	내가 대합실에서부터 느꼈지만…{nl}이 곳에 오래 전 모두 사라진 줄 알았던 크루비나도 있고, 그 크루비나가 결계에 큰 반응도 없었거든.{nl}뭔가 더 엄청난 힘이… 이 마법 장벽을 지키고 있는 것 같았어.	파야우타
QUEST_LV_0500_20220830_002002	希望我的预想是错的，所以调?了一下…	내 예상이 틀리길 바라면서 조사를 해봤는데...	파야우타
QUEST_LV_0500_20220830_002003	这个…	이건…	파야우타
QUEST_LV_0500_20220830_002004	{#003399}莫提尼斯{/}?。	{#003399}머티니스{/}야.	파야우타
QUEST_LV_0500_20220830_002005	明明知道什?都被破坏掉了…	분명 모두 파괴되었다고 알고 있었는데....	파야우타
QUEST_LV_0500_20220830_002006	这种{#003399}莫提尼斯{/}有几个，因?那力量，所以?障不会消失。	이런 {#003399}머티니스{/}가 몇 개 있고, 그 힘 때문에 장벽이 사라지지 않는거지. 	파야우타
QUEST_LV_0500_20220830_002007	?到{#003399}莫提尼斯{/}后，必须要破坏掉。	그 {#003399}머티니스{/}를 찾아서 파괴해야 해.	파야우타
QUEST_LV_0500_20220830_002008	如果?到{#003399}莫提尼斯{/}，一定要破坏掉?。	{#003399}머티니스{/}를 찾으면 반드시 파괴하자.	파야우타
QUEST_LV_0500_20220830_002009	....{nl}?亚乌塔...	....{nl}파야우타...	대장군 라민
