QUEST_LV_0500_20210125_000422	除了你发现的两个黑色水晶以外还有无数的水晶。{nl}破坏了所有在加桥森林裡的水晶。	당신이 발견한 두 개의 검은 수정 외에도 많은 수정이 있었습니다.{nl}덧댄다리 숲에 있던 수정은 모두 파괴했습니다.	여신 라다
QUEST_LV_0500_20210125_000423	加桥森林的莫提尼斯龟裂凝固了。 	덧댄다리 숲의 머티니스 균열들은 굳었습니다.	여신 라다
QUEST_LV_0500_20210125_000424	但{nl}仍有这段期间魔族们採集的莫提尼斯，{nl}在这裡无法找到莫提尼斯。	그러나{nl}그동안 마족들이 채굴한 머티니스가 있을 텐데,{nl}여기서는 머티니스를 찾을 수 없었습니다.	여신 라다
QUEST_LV_0500_20210125_000425	那些莫提尼斯绝不能落入注视者的手中，{nl}我必须要找到那个储藏所并将莫提尼斯回收回来。	그 머티니스들이 주시자의 손에 들어가서는 안 됩니다.{nl}저는 그 저장소를 찾아 머티니스를 회수해야 합니다.	여신 라다
QUEST_LV_0500_20210125_000426	启示者啊，{nl}你也有你必须要执行的任务。	계시자여,{nl}그대도 해야 할 일이 있습니다.	여신 라다
QUEST_LV_0500_20210125_000427	请在帕欧皮斯渡口寻找拉达女神。	파우피스 나루에서 라다 여신을 찾으세요	PC
QUEST_LV_0500_20210125_000428	既然驱赶了注视者，看著这裡的情况我正在等待著启示者。	주시자를 쫓았으나, 이곳의 상황을 보고 계시자님을 기다리고 있었습니다.	여신 라다
QUEST_LV_0500_20210125_000429	你应该察觉到了吧？{nl}侵略攻击欧勒夏的并非只有注视者一人，{nl}加上你刚才所见的两势力魔族包含注视者，就足足有三个势力在侵略欧勒夏了。	눈치 채셨겠죠?{nl}오르샤를 침공한 건 주시자 뿐만이 아니라는 이야기입니다.{nl}방금 본 두개 세력의 마족들만 하더라도 주시자를 포함하여 세 개의 세력이 오르샤를 침공했군요.	여신 라다
QUEST_LV_0500_20210125_000430	但可以确认的是他们的目标全都是莫提尼斯。{nl}他们分别是魔王卡鲁塔斯的魔族和魔神罗迦娜旗下的魔族。	하지만 모두 머티니스가 목표인 건 확실합니다.{nl}저들은 각각 마왕 카르타스의 마족과 마신 라가나의 휘하 마족들입니다.	여신 라다
QUEST_LV_0500_20210125_000431	仅管如此仍不能肯定，{nl}特别是无法相信魔王卡鲁塔斯竟和魔神罗迦娜对敌。	그렇지만, 확신을 가질 수는 없습니다.{nl}특히나 마왕 카르타스가 마신인 라가나와 대적한다는 건 믿을 수가 없군요.	여신 라다
QUEST_LV_0500_20210125_000432	说不定还存在有其他操控他们的存在。	저들을 움직이는 다른 존재가 있을지도 모릅니다.	여신 라다
QUEST_LV_0500_20210125_000433	首先，我们需要确认操控魔王卡鲁塔斯部下的真正上级是谁。{nl}你认为要怎麽处理侵略欧勒夏的那些魔族呢？	먼저, 마왕 카르타스의 부하들을 움직이는 진짜 상급자가 누구인지 확인해 둘 필요가 있겠군요.{nl}당신은 오르샤를 침공한 저 마족들을 어떻게 하시겠습니까?	여신 라다
QUEST_LV_0500_20210125_000434	感谢你的理解。	묵묵히 이해해주셔서 감사합니다.	여신 라다
QUEST_LV_0500_20210125_000435	那麽我会继续去寻找到底觊觎莫提尼斯的存在是谁的。	그럼 저 역시 머티니스를 노리는 존재들이 누구인지 찾아보겠습니다.	여신 라다
QUEST_LV_0500_20210125_000436	我会在这裡与你再见的。	이 자리에서 다시 뵙겠습니다.	여신 라다
QUEST_LV_0500_20210125_000437	请在帕瑟兰隐居地消灭宾美狄丝并获得上级的标志。	파슬랍 은거지에서 빈미디스를 처치하고 상급자의 징표를 획득하세요	PC
QUEST_LV_0500_20210125_000438	这个巴以卡和罗迦娜的标志..{nl}你说卡鲁塔斯的魔族们持有巴以卡的标志？	이건 바이가와 라가나의 증표..{nl}바이가의 증표를 카르타스의 마족들이 가지고 있었다는 말씀이신가요?	여신 라다
QUEST_LV_0500_20210125_000439	虽魔王卡鲁塔斯无法对抗罗迦娜..{nl}但如是巴以卡的话就说不定了。	마왕 카르타스가 라가나에게 대항할 수 없겠지만..{nl}바이가라면 가능할지도 모릅니다.	여신 라다
QUEST_LV_0500_20210125_000440	魔王巴以卡从很久前就与魔神巴乌巴斯有紧密的合作了。{nl}魔神巴乌巴斯在吉特涅不在的现在，绝对是最强悍的魔族。	마왕 바이가는 오랜 옛날부터 마신 바우바스와 긴밀한 협력을 이루고 있습니다.{nl}마신 바우바스는 길티네가 없는 지금으로서는 가장 강한 마족임이 틀림없습니다.	여신 라다
QUEST_LV_0500_20210125_000441	让人深刻感受到这是没有吉特涅的世界啊。	길티네가 사라진 세상이라는 게 새삼 실감이 나는군요.	여신 라다
QUEST_LV_0500_20210125_000442	巴以卡的魔族们的确在觊觎著莫提尼斯，{nl}但奇怪的是罗迦娜的魔族却想妨碍莫提尼斯的採集，并没有觊觎莫提尼斯的情况。	바이가의 마족들은 확실히 머티니스를 노리고 있었습니다.{nl}라가나의 마족들은 이상하게도 머티니스 채굴을 방해하려고만 했지, 머티니스 자체를 노리는 정황은 없더군요.	여신 라다
QUEST_LV_0500_20210125_000443	不管怎麽样撇开他们的目的，要是莫提尼斯的主人是魔族，那对女神、对人类来说都不是件好事。{nl}请尽快去寻找莫提尼斯储藏所。	아무튼 그들의 목적을 떠나 머티니스의 주인이 마족이 되는 건 여신에게든 인간에게든 좋을 수 없을 겁니다.{nl}서둘러 머티니스 저장소를 찾는게 좋겠습니다.	여신 라다
QUEST_LV_0500_20210125_000444	但在进来这裡后四处袭来强烈的魔力，{nl}无法确认这是注视者的黑色水晶，还是仅次于它的其他存在。	다만, 여기에 들어온 후로 사방에서 강력한 마력들이 휘몰아치고 있습니다.{nl}주시자의 검은 수정인지, 혹은 그에 버금갈 다른 존재인지는 확실하지 않습니다.	여신 라다
QUEST_LV_0500_20210125_000445	你是拉伊玛的小喽喽啊。	너는 라이마의 끄나풀이로군.	마왕 바이가
QUEST_LV_0500_20210125_000446	老实说我有吓到，{nl}虽然拉伊玛说要帮忙，但人类小毛头竟击退了吉特涅，如要说那是本领我也认可了。	솔직하게 말하자면 놀라웠다.{nl}비록 라이마가 도왔다고는 하나, 인간 애송이가 길티네를 몰아넣었으니 재주라면 재주겠지.	마왕 바이가
QUEST_LV_0500_20210125_000447	你很好奇我来这裡的理由吗？	내가 이곳에 온 이유가 궁금한가?	마왕 바이가
QUEST_LV_0500_20210125_000448	神树的树根不是你这种小毛头该费心的东西。	신수의 뿌리는 너같은 애송이가 신경쓸 물건이 아니다.	마왕 바이가
QUEST_LV_0500_20210125_000449	你了解的世界连在现实存在世界中的尘埃都还不如。{nl}仅拥有短暂生命的人类竟有如此狂妄的好奇心。	네 녀석이 알고 있는 세계는 실제 존재하는 세계의 티끌 만큼도 안 된다.{nl}고작 순간의 삶을 살다 죽을 필멸의 인간따위가 건방진 호기심을 가지고 있군.	마왕 바이가
QUEST_LV_0500_20210125_000450	别费心思了。	신경꺼라.	마왕 바이가
QUEST_LV_0500_20210125_000451	你见过巴以卡了啊。{nl}在集中追击罗迦娜后，才后知后觉地发现到巴以卡的存在。	바이가를 만나셨군요.{nl}라가나를 쫓는 데 집중한 나머지 뒤늦게 바이가의 존재를 알아차렸습니다.	여신 라다
QUEST_LV_0500_20210125_000452	罗迦娜啊，{nl}在森林裡追击她时，当我发现这是件不可能的事后就错手了。	라가나는,{nl}숲 속에서 그녀를 쫓는 건 거의 불가능한 일이라 놓치고 말았습니다.	여신 라다
QUEST_LV_0500_20210125_000453	但可确定的是罗迦娜和巴以卡彼此是对立的。{nl}他们的提议对我们来说虽看似有好处，{nl}但仍无法相信魔族的内心。{nl}因此不管是什麽样的诱惑，都不能欣然地接受。	라가나와 바이가가 서로 대립하고 있는 건 확실하군요.{nl}그들의 제안은 궁극적으로 우리에게 이점인 것 처럼 보이겠지만,{nl}마족의 속내는 믿을 수 없습니다.{nl}그러니 어떤 유혹에도 결코 선뜻 받아들여서는 안 됩니다.	여신 라다
QUEST_LV_0500_20210125_000454	另一方面..{nl}现在要与注视者、罗迦娜、巴以卡以及其身后的巴乌巴斯对敌是非常危险的。	한 편으로는..{nl}지금 당장 주시자, 라가나, 바이가와 그 뒤의 바우바스까지 모두를 대적하기에는 위험합니다.	여신 라다
QUEST_LV_0500_20210125_000455	与你和吉特涅对抗时不同，{nl}能帮助你的只有保存力量的女神奥施莉奈而已..{nl}但你也明白奥施莉奈并不想要介入此事。	당신이 길티네와 싸웠을 때와는 달리,{nl}당신을 도울 수 있을 정도로 힘을 보존한 여신은 아우슈리네님 뿐..{nl}그러나 아우슈리네님께서는 이 일에 개입하시기를 원하지 않으신다는 걸 당신도 아실 겁니다.	여신 라다
QUEST_LV_0500_20210125_000456	有个方法。	방법은 있습니다.	여신 라다
QUEST_LV_0500_20210125_000457	如能确保可比注视者的魔族更先找到採集的莫提尼斯，{nl}那就一定能取得主导权了。{nl}因此得尽快找到莫提尼斯的储藏所。	주시자의 마족들이 채굴한 머티니스를 그들보다 먼저 찾아내 확보한다면,{nl}분명히 주도권을 쥘 수 있습니다.{nl}그러니 서둘러 머티니스의 저장소를 찾죠.	여신 라다
QUEST_LV_0500_20210125_000458	但现在我因与罗迦娜对抗消耗了太多力量，因此需要恢复的时间。	다만, 지금은 제가 라가나와의 싸움으로 힘을 많이 소모한 탓에 회복할 시간이 필요합니다.	여신 라다
QUEST_LV_0500_20210125_000459	就这麽办吧。{nl}我不会花太多时间休息恢复的。	그러시죠.{nl}회복하는데 오래 걸리지는 않을 겁니다.	여신 라다
QUEST_LV_0500_20210125_000460	请你仍得牢记著我们要为各自的责任而动起来。	여전히 우리는 각자의 책임을 위해 움직이고 있다는 걸 명심하세요.	여신 라다
QUEST_LV_0500_20210125_000461	这样啊..{nl}说到喀贝斯街道...那是前往森林内部的道路。	그렇군요..{nl}갓베스 가도라면 숲의 안쪽으로 이어지는 길입니다.	여신 라다
QUEST_LV_0500_20210125_000462	看来有必要前往喀贝斯街道了。	갓베스 가도로 가 볼 필요가 있겠군요.	여신 라다
QUEST_LV_0500_20210125_000463	我还需要一点时间。	저는 아직 시간이 조금 더 필요합니다.	여신 라다
QUEST_LV_0500_20210125_000464	反正我们都有各自要做的事情，{nl}启示者你先启程也没关係。	어차피 우리는 각자가 해야할 일을 하고 있을 뿐이니,{nl}계시자님 께서 먼저 가셔도 괜찮습니다.	여신 라다
QUEST_LV_0500_20210125_000465	知道了。{nl}我一恢复好就会跟上的。 	알겠습니다.{nl}저도 회복되는대로 따라가겠습니다.	여신 라다
QUEST_LV_0500_20210125_000466	在喀贝斯街道也有莫提尼斯龟裂。{nl}请先前往喀贝斯街道。	갓베스 가도에도 머티니스 균열이 있습니다.{nl}갓베스 가도로 먼저 가세요	여신 라다
QUEST_LV_0500_20210125_000467	我也会在恢复好后跟上的。	저도 회복되는대로 따라가겠습니다.	여신 라다
QUEST_LV_0500_20210125_000468	车轮痕迹的方向是朝向著伊萨巫古迪森林的。	수레 바퀴 자국의 방향이 이사우고티 숲을 향하고있다	PC
QUEST_LV_0500_20210125_000469	我就知道会往这个方向。{nl}在要进入森林更深处的地方将会有更多莫提尼斯的力量流散的。	이쪽으로 오실 줄 알았습니다.{nl}이 앞으로 들어가는 깊은 숲에서 너무 많은 머티니스의 힘이 흘러나오고 있습니다.	여신 라다
QUEST_LV_0500_20210125_000470	莫提尼斯储藏所一定就在裡面。{nl}虽然情况很危急，{nl}但事情似乎比想像中的还要严重，所以为了做好整顿准备，我想你最好先去拉伊玛的圣所。	분명 머티니스 저장소는 이 안쪽에 있을 겁니다.{nl}상황이 위급한 건 사실이지만,{nl}생각보다 일이 커지고 있으니 재정비를 위해 잠시 라이마의 성소로 돌아가는 게 좋겠습니다.	여신 라다
QUEST_LV_0500_20210125_000471	那麽，{nl}我们在拉伊玛的圣所见了。	그럼,{nl}라이마의 성소에서 다시 뵙죠.	여신 라다
QUEST_LV_0500_20210125_000472	请做准备..	준비하세요..	뮬리아
QUEST_LV_0500_20210125_000473	灾难即将到来..	재앙이 오고 있습니다..	뮬리아
QUEST_LV_0500_20210125_000474	人类会灭亡的..	인간들은 파멸할 거예요..	뮬리아
QUEST_LV_0500_20210125_000475	小心..	조심..	라이마
QUEST_LV_0500_20210125_000476	千万..{nl}小心..	부디..{nl}조심..	라이마
QUEST_LV_0500_20210125_000477	你必须要有的..{nl}如不介意..{nl}请闭上眼睛..	당신이 가져가야할 게..{nl}괜찮으시다면..{nl}눈을 감아주세요..	라이마
QUEST_LV_0500_20210125_000478	如能再休息一下会更好。	조금 더 쉴 수 있으면 좋겠어요.	뮬리아
QUEST_LV_0500_20210125_000479	是散发出不吉利气息的箱子。{nl}看来是保管著採集的莫提尼斯。	불길한 기운이 뿜어져 나오는 상자다.{nl}채굴한 머티니스를 보관 중인 것 같다.	안내
QUEST_LV_0500_20210125_000480	请在刚才发现的箱子堆中设置炸弹。	방금 발견한 저 상자 더미에 폭탄을 설치하자.	PC
QUEST_LV_0500_20210125_000481	{nl}好像安全地设置好炸弹了。	{nl}무사히 폭탄을 설치한 것 같다.	PC
QUEST_LV_0500_20210125_000482	索格玛斯执行者	소거마스 집행자	
QUEST_LV_0500_20210125_000483	贪图注视者珍贵莫提尼斯的小偷是你吗？	주시자님의 소중한 머티니스를 탐내는 도둑이 네 녀석인가?	소거마스 집행자
QUEST_LV_0500_20210125_000484	从现在起，将执行对小偷的死刑！	지금부터 도둑에 대한 사형을 집행하겠다!	소거마스 집행자
QUEST_LV_0500_20210125_000485	[王国重建团] 欧勒夏负责人	[왕국 재건단] 오르샤 담당인	
QUEST_LV_0500_20210125_000486	你说有听过关于我们的消息？{nl}正好我们也听说了有关启示者的传闻。	저희에 대한 소식을 들으셨다구요?{nl}마침 저희도 계시자님에 대한 소문을 들었습니다.	[왕국 재건단] 오르샤 담당인
QUEST_LV_0500_20210125_000487	我们是以王国重建团的名义凝聚在一起的团体。{nl}我们是为了振兴因神树之日而灭亡的王国及世界而聚集的。	저희는 왕국 재건단이라는 이름으로 뭉쳐있습니다.{nl}우리는 신수의 날로 인해 무너진 왕국과 세계를 다시 일으키기 위해 모였죠.	[왕국 재건단] 오르샤 담당인
QUEST_LV_0500_20210125_000488	与其等待消失的女神们的答应，我们人类应该要自立自强重建王国。	사라진 여신들의 대답을 기다리기보다, 우리 인간들 스스로 왕국을 재건해야 합니다.	[왕국 재건단] 오르샤 담당인
QUEST_LV_0500_20210125_000489	啊，但请别误会。{nl}我们仍是崇敬女神的人，{nl}只不过以现在的情况来看，也许是女神们希望我们人类能够变得更强大吧。	아, 그러나 오해하진 마세요.{nl}우리도 역시 여신들에게 신앙심을 가진 사람들입니다.{nl}다만 지금 이 상황이 어쩌면 여신들께서 인간들이 스스로 더 강해지길 바라시기 때문일 수도 있죠.	[왕국 재건단] 오르샤 담당인
QUEST_LV_0500_20210125_000490	所以我们王国重建团不仅只有大陆，同时也派遣团员前往世界各地去努力协助解决当地的问题。	그래서 우리 왕국 재건단은 대륙은 물론 세계 곳곳으로 파견되어 현장의 문제를 돕는데 최선을 다하고 있습니다.	[왕국 재건단] 오르샤 담당인
QUEST_LV_0500_20210125_000491	启示者的故事我已经听过很多次了。{nl}如启示者能帮助我们，那绝对会是相当大的助力的。	계시자님의 이야기는 익히 들었습니다.{nl}계시자님께서 저희를 도와주신다면 큰 힘이 될 겁니다.	[왕국 재건단] 오르샤 담당인
QUEST_LV_0500_20210125_000492	请去见被派遣到各地的王国重建团团员吧。{nl}他们会需要启示者的。	각 현장에 파견되어 있는 왕국 재건단 단원들을 만나보세요.{nl}그들이 계시자님을 필요로 할 겁니다.	[왕국 재건단] 오르샤 담당인
QUEST_LV_0500_20210125_000493	[王国重建团] 欧勒夏派遣兵	[왕국 재건단] 오르샤 파견병	
QUEST_LV_0500_20210125_000494	如启示者能给予我们帮助，我们也一定会给予你相对应的回报的。{nl}启示者的英雄事蹟也会流传到世界各地的。	계시자님께서 저희를 도와주신다면 반드시 상응하는 보답을 하겠습니다.{nl}계시자님의 영웅담은 세계 각지로 뻗어나가게 될 겁니다.	[왕국 재건단] 오르샤 파견병
QUEST_LV_0500_20210125_000495	[王国重建团] 欧勒夏支援兵	[왕국 재건단] 오르샤 자원병	
QUEST_LV_0500_20210125_000496	神树之日后为了振兴陷入悲恸的大陆，就得靠我们人类的团结了。{nl}我们会为了复兴王国而战的，{nl}启示者也一同加入我们吧。	신수의 날 이후로 비탄에 빠진 대륙을 다시 일으킬 수 있는 건 바로 우리 인간들의 결속력입니다.{nl}곧 우리 모두가 왕국을 일으키기 위해 싸울 겁니다.{nl}계시자님께서도 함께 하시죠.	[왕국 재건단] 오르샤 자원병
QUEST_LV_0500_20210125_000497	[王国重建团] 欧勒夏调查员	[왕국 재건단] 오르샤 조사원	
QUEST_LV_0500_20210125_000498	我们王国重建团为了协助陷入危机的人们，正在持续调查灾难现场。{nl}这裡也同样情况相当糟糕啊。	저희 왕국 재건단이 위기에 빠진 사람들을 도울 수 있도록 재난 현장을 지속적으로 조사 중 입니다.{nl}여기도 만만치 않게 엉망이군요.	[왕국 재건단] 오르샤 조사원
QUEST_LV_0500_20210125_000499	[王国重建团] 欧勒夏医疗支援兵	[왕국 재건단] 오르샤 의료지원병	
QUEST_LV_0500_20210125_000500	虽然我们总是用尽全力去做好我们份内的事，但每当看到死去的士兵时内心总是无比伤痛。{nl}希望他们的灵魂能回到奥施莉奈女神的怀抱中。	항상 최선을 다하고 있지만 죽어가는 병사들의 모습을 볼 때면 가슴이 아려오네요.{nl}부디 그들의 영혼이 아우슈리네 여신에게 돌아갈 수 있기를 바라고 있어요.	[왕국 재건단] 오르샤 의료지원병
QUEST_LV_0500_20210125_000501	[王国重建团] 欧勒夏传令	[왕국 재건단] 오르샤 전령	
QUEST_LV_0500_20210125_000502	在战斗地区为了不遗弃士兵们，就必须要持续地与本部联繫。{nl}但要突破魔族的包围并不是件简单的事。	전투 지역에 병사들이 버려지지 않도록 본부와의 연락을 계속해야 합니다.{nl}그러나 마족들의 포위망을 뚫는 건 여간 쉬운일이 아니군요.	[왕국 재건단] 오르샤 전령
QUEST_LV_0500_20210125_000503	吉特涅留下的东西	길티네가 남긴 것	
QUEST_LV_0500_20210125_000504	闭上眼睛	눈을 감는다	
QUEST_LV_0500_20210125_000505	不闭上眼睛	눈을 감지 않는다	
QUEST_LV_0500_20210125_000506	陷入危机的欧勒夏	위기에 빠진 오르샤	
QUEST_LV_0500_20210125_000507	表示愿意帮助欧勒夏	오르샤를 돕겠다고 한다	
QUEST_LV_0500_20210125_000508	表示还需要思考	생각이 필요하다고 한다	
QUEST_LV_0500_20210125_000509	女神的召唤	여신의 부름	
QUEST_LV_0500_20210125_000510	开始调查(1)	조사 개시(1)	
QUEST_LV_0500_20210125_000511	表示还需要一点时间	조금 더 시간이 필요하다고 한다	
QUEST_LV_0500_20210125_000512	开始调查(2)	조사 개시(2)	
QUEST_LV_0500_20210125_000513	表示在蓝图鲁玛休憩地再见	란돌루마 쉼터에서 만나자고 한다	
QUEST_LV_0500_20210125_000514	开始调查(3)	조사 개시(3)	
QUEST_LV_0500_20210125_000515	表示会前往阿达塔街道	아다타 가도로 향하겠다고 한다	
QUEST_LV_0500_20210125_000516	表示会先做其他的事情之后再来	다른 일을 먼저 하고 오겠다고 한다	
QUEST_LV_0500_20210125_000517	他们的目的是	그들의 목적은	
QUEST_LV_0500_20210125_000518	表示会调查马尔柯斯伐木场	말코스 벌목지를 조사하겠다고 한다	
QUEST_LV_0500_20210125_000519	加桥森林的採集设施	덧댄다리 숲의 채굴 시설	
QUEST_LV_0500_20210125_000520	表示恢复欧勒夏是最优先的事，因此会一起战斗的	오르샤의 회복이 우선이니 함께 싸우겠다고 한다	
QUEST_LV_0500_20210125_000521	表示不想再与神们有瓜葛了。	더는 신들과 엮이고 싶지 않다고 한다	
QUEST_LV_0500_20210125_000522	为守护欧勒夏	오르샤를 수호하기 위해	
QUEST_LV_0500_20210125_000523	表示会阻止前往欧勒夏的魔族	오르샤로 가는 마족들을 저지하겠다고 한다	
QUEST_LV_0500_20210125_000524	表示会先处理其他地方的事情	다른 곳의 일을 우선 처리하겠다고 한다	
QUEST_LV_0500_20210125_000525	调查龟裂	균열 조사	
QUEST_LV_0500_20210125_000526	表示正要前往吉贝尼大道	지베니 대로로 갈 참이었다고 한다	
QUEST_LV_0500_20210125_000527	表示要先解决其他地方的事情	다른 곳의 일을 먼저 해결하겠다고 한다	
QUEST_LV_0500_20210125_000528	魔力的根源地	마력의 근원지	
QUEST_LV_0500_20210125_000529	表示想前往摩鲁哥斯农场	모르꼬스 농장으로 갈 생각이라고 한다	
QUEST_LV_0500_20210125_000530	表示现在需要再整顿一下	지금은 재정비가 필요하다고 한다	
QUEST_LV_0500_20210125_000531	破坏黑色水晶	검은 수정 파괴	
QUEST_LV_0500_20210125_000532	使用拉达女神的祝福	라다 여신의 축복을 사용한다	
QUEST_LV_0500_20210125_000533	看似很危险决定停手	위험해 보이니 그만둔다	
QUEST_LV_0500_20210125_000534	其他的黑色水晶	또 다른 검은 수정	
QUEST_LV_0500_20210125_000535	调查龟裂	균열을 조사한다	
QUEST_LV_0500_20210125_000536	现在正在执行其他的事情	지금은 다른 일을 한다	
QUEST_LV_0500_20210125_000537	破坏最后的黑色水晶	마지막 검은 수정 파괴	
QUEST_LV_0500_20210125_000538	攻击黑色水晶	검은 수정을 공격한다	
QUEST_LV_0500_20210125_000539	因为很危险而停手	위험하니 그만둔다	
QUEST_LV_0500_20210125_000540	注视者的目的	주시자의 목적	
QUEST_LV_0500_20210125_000541	表示如破坏莫提尼斯储藏所将可给予敌人很大的打击	머티니스 저장소를 파괴하면 적에게 큰 타격을 줄 수 있다고 한다	
QUEST_LV_0500_20210125_000542	表示要先整顿一下	우선 재정비를 하겠다고 한다	
QUEST_LV_0500_20210125_000543	佔据帕欧皮斯渡口的势力(1)	파우피스 나루를 점거한 세력들(1)	
QUEST_LV_0500_20210125_000544	表示想听听帕欧皮斯渡口的情况	파우피스 나루의 상황을 듣고 싶다고 한다	
QUEST_LV_0500_20210125_000545	表示还有更紧急的事情	보다 더 급한 일이 있다고 한다	
QUEST_LV_0500_20210125_000546	佔据帕欧皮斯渡口的势力(2)	파우피스 나루를 점거한 세력들(2)	
QUEST_LV_0500_20210125_000547	表示会去歼灭攻击欧勒夏的魔族	오르샤를 공격한 마족들을 처치하겠다고 한다	
QUEST_LV_0500_20210125_000548	表示现在有紧急需要前往的地方	지금은 급히 가봐야 할 곳이 있다고 한다	
QUEST_LV_0500_20210125_000549	佔据帕欧皮斯渡口的势力(3)	파우피스 나루를 점거한 세력들(3)	
QUEST_LV_0500_20210125_000550	罗迦娜的提议	라가나의 제안	
QUEST_LV_0500_20210125_000551	表示会去调查洛浑沙峭壁	로혼사 절벽을 조사하러 가겠다고 한다	
QUEST_LV_0500_20210125_000552	表示需要休息	쉬어야겠다고 한다	
QUEST_LV_0500_20210125_000553	巴以卡的提议	바이가의 제안	
QUEST_LV_0500_20210125_000554	询问目的	목적을 묻는다	
QUEST_LV_0500_20210125_000555	默默地离开	묵묵히 자리를 떠난다	
QUEST_LV_0500_20210125_000556	询问神树的树根	신수의 뿌리에 대해 묻는다	
QUEST_LV_0500_20210125_000557	莫提尼斯的下落(1)	머티니스의 행방(1)	
QUEST_LV_0500_20210125_000558	表示这期间会去调查附近的莫提尼斯龟裂	그동안 근처의 머티니스 균열을 조사하겠다고 한다	
QUEST_LV_0500_20210125_000559	表示正好有其他的事情，请他先休息	마침 다른 일이 있으니 쉬고 있으라고 한다	
QUEST_LV_0500_20210125_000560	莫提尼斯的下落(2)	머티니스의 행방(2)	
QUEST_LV_0500_20210125_000561	表示先前往喀贝斯街道	먼저 갓베스 가도로 가겠다고 한다	
QUEST_LV_0500_20210125_000562	表示不需急躁	서두를 필요가 없다고 한다	
QUEST_LV_0500_20210125_000563	莫提尼斯的下落(3)	머티니스의 행방(3)	
QUEST_LV_0500_20210125_000564	表示是好的意见	좋은 의견이라고 한다	
QUEST_LV_0500_20210125_000565	表示并不是好的想法	좋지 않은 생각이라고 한다	
QUEST_LV_0500_20210125_000566	[每週] 歼灭 - 变异型怪物	[주간] 섬멸 - 변이형 몬스터	
