QUEST_LV_0500_20190509_000001	I would rather have someone else do it if it's something that absolutely needs doing.{nl}Why does it always have to be me?	누군가는 해야 할 일이면 다른 사람이 했으면 좋겠어요.{nl}왜 저한태 이런 걸 시키는 걸까요.	케도라 상단원 이네타
QUEST_LV_0500_20190509_000002	怪物和魔族氾滥…{nl}至少不用担心遇到强盗了。{nl}只要能活著回去的话。	몬스터와 마족들이 득실거리니..{nl}적어도 강도를 만날 걱정은 안 해도 되겠어.{nl}살아서 돌아갈 수 있다면 말이지.	케도라 상단원 타다스
QUEST_LV_0500_20190509_000003	花好几天侦查，又要花好几天回报！{nl}这样事情什麽时候才会做完啊？	정찰하는 데 며칠, 보고하는 데 또 며칠!{nl}이러면 일은 언제 끝낼 생각인 거지?	바바리안 볼케
QUEST_LV_0500_20190509_000004	我是来协助塔达斯的。{nl}不是来收拾波尔凯闯的祸。	전 타다스님을 도우러 온 것이지.{nl}볼케님이 사고 치는 걸 처리하러 온 게 아닙니다.	케도라 상단원 니르기
QUEST_LV_0500_20190509_000005	我骗过了卡鲁塔斯，没有让他抢走神树的种子。{nl}如果解开这束缚，就可以借助种子的力量恢复力量。	카르타스의 눈을 속여 신수의 씨앗을 빼앗기지 않았어요.{nl}이 속박을 풀어낸다면 씨앗의 능력으로 힘을 다시 회복할 수 있을 거예요.	여신 메데이나
QUEST_LV_0500_20190509_000006	卡鲁塔斯在这片森林设下结界追赶我的原因是什麽呢…{nl}难道他真的知道这颗种子的存在吗？	카르타스가 이 숲에 거대한 결계를 펼치면서까지 저를 쫓는 이유가 무엇일까요..{nl}정말 이 씨앗의 존재를 알고 있는 걸까요?	여신 메데이나
QUEST_LV_0500_20190509_000007	我一调养好身体，就要马上去找奈凌卡。{nl}奈凌卡一定知道从卡鲁塔斯手中拯救梅德依那女神的方法的。	저는 몸을 추스리는대로 네링가님을 찾아가 보려 해요.{nl}네링가님이라면 분명 카르타스로부터 메데이나님을 구할 방법을 알고 계실 거에요.	큐폴 아스트라
QUEST_LV_0500_20190509_000008	啊，启示者！这片森林被设下了邪恶的结界，进来的话很危险的！{nl}请快离开吧！	아! 계시자님! 이 숲에는 사악한 결계가 펼쳐져 있어서 들어오시면 위험해요!{nl}어서 벗어나세요!	큐폴 아스트라
QUEST_LV_0500_20190509_000009	由于卡鲁塔斯在这一带的森林设下了结界，以目前梅迪安娜的力量是无法离开这裡的。{nl}梅迪安娜女神需要快点恢复气力才行啊…	카르타스가 숲 일대에 펼친 결계 때문에 지금 메데이나님의 힘으로는 이곳을 벗어날 수 없어요.{nl}메데이나님이 어서 기운을 차리시고 회복하셔야 할 텐데..	큐폴 일로나
QUEST_LV_0500_20190509_000010	如果卡鲁塔斯发现这裡就完蛋了。{nl}启示者，请你帮助梅德依那女神恢复过来吧。	카르타스가 이곳을 발견하면 큰일이에요.{nl}메데이나님이 회복할 수 있도록 계시자님께서 도와주세요.	큐폴 일로나
QUEST_LV_0500_20190509_000011	虽然陷入了束缚的结界裡…还好依罗娜平安无事。{nl}启示者，请你找找有没有解除结界的方法。	속박의 결계에 걸리긴 했지만.. 그래도 일로나가 무사해서 다행이에요.{nl}계시자님. 결계를 해제할만한 방법이 있을지 찾아봐 주세요.	큐폴 율리아
QUEST_LV_0500_20190509_000012	快和依罗娜一起去找梅德依那女神吧。	어서 일로나와 함께 메데이나님을 찾으러 가 봐요.	큐폴 율리아
QUEST_LV_0500_20190509_000013	梅德依那女神的踪迹到这边就断了，去别院裡面看看怎麽样？	메데이나님의 흔적이 이 앞에서 끊겼으니 이 안뜰 안쪽을 확인해보는 게 어떨까요?	큐폴 율리아
QUEST_LV_0500_20190509_000014	梅德依那女神平安无事，真是太好了！{nl}必须破坏对女神设下的魔界移动法阵才行…	메데이나님이 무사하셔서 다행이에요!{nl}그보다 메데이나님에게 펼쳐진 마계 이동 마법진을 파훼해야 할텐데..	큐폴 율리아
QUEST_LV_0500_20190509_000015	启示者！请清除对梅德依那女神设下的魔界移动法阵。{nl}卡鲁塔斯现在不在，是个好机会。	계시자님! 메데이나님에게 펼쳐진 마계 이동 마법진을 없애주세요.{nl}카르타스가 없는 지금이 기회에요.	큐폴 일로나
QUEST_LV_0500_20190509_000016	多亏了启示者才能解开梅德依那女神的结界呢。{nl}现在得赶紧离开这裡…	계시자님 덕분에 메데이나님이 결계를 풀어낼 수 있었네요.{nl}어서 이곳을 벗어나야 할 텐데..	큐폴 일로나
QUEST_LV_0500_20190509_000017	在辅助魔法阵中注入魔力，让它超载很有效呢。	보조 마법진에 마력을 과부하 되게 주입하는 게 효과가 있었네요.	큐폴 율리아
QUEST_LV_0500_20190509_000018	啊…都是因为我们，梅德依那女神她…	아.. 저희 때문에 메데이나님이..	큐폴 율리아
QUEST_LV_0500_20190509_000019	梅德依那女神…	메데이나님..	큐폴 일로나
QUEST_LV_0500_20190509_000020	我来得太晚了…	제가 너무 늦었어요..	큐폴 아스트라
QUEST_LV_0500_20190509_000021	虽然梅德依那女神被卡鲁塔斯抓走了…{nl}启示者热心帮助我们寻找梅德依那女神的事，我们会铭记在心的。	비록 메데이나님이 카르타스에게 붙잡혀 가셨지만..{nl}저희는 계시자님께서 메데이나님을 찾는 일에 적극적으로 도와주신 것을 기억하고 있어요.{nl}	큐폴 아스트라
QUEST_LV_0500_20200227_000022	あなたがギルティネに立ち向かう準備ができたら、その時にまた私の元へ来てください。{nl}	당신이 길티네에게 맞설 준비가 된다면 그때 저를 다시 찾아오십시오.{nl}	여신 라이마
QUEST_LV_0500_20200227_000023	魔神ラガナと魔王ヴァイガにここで会うことになるとは、まったく予想できませんでした。	마신 라가나와 마왕 바이가를 여기서 마주칠 거라고는 전혀 예상하지 못했습니다.	여신 아우스테야
QUEST_LV_0500_20200227_000024	ヴァイガと話す時は気をつけた方がいいと思います。	바이가와 이야기할 때는 조심하시는 게 좋겠어요.	여신 아우스테야
QUEST_LV_0500_20200227_000025	まずは啓示者様がヴァイガを相手している間、私一人でもここで神樹の根を探してみます。	일단은 계시자님이 바이가를 상대하는 동안 저 혼자서라도 이곳에서 신수의 뿌리를 찾아볼게요.	여신 아우스테야
QUEST_LV_0500_20200227_000026	そしてヴァイガに気をつけてください。{nl}彼を完全に信じてはいけません。	그리고 바이가를 조심하세요.{nl}그를 온전히 믿어서는 안 됩니다.	여신 아우스테야
QUEST_LV_0500_20200227_000027	ご無事でしたか。{nl}この地域をすべて確認してみましたが…神樹の根は見つかりませんでした。	무사하셨군요.{nl}이 지역을 모두 확인해 봤지만.. 신수의 뿌리는 찾을 수 없었어요.	여신 아우스테야
QUEST_LV_0500_20200227_000028	メデイナ様の状態が非常に危険です。{nl}これまでカルタスからどれほどおぞましい苦痛を受けたのか、想像さえできません。	메데이나님의 상태가 많이 위독해요.{nl}그동안 카르타스에게 얼마나 끔찍한 고통을 받았는지 감히 상상도 할 수 없을 것 같아요.	큐폴
QUEST_LV_0500_20200227_000029	カルタスを許すことは絶対にできません…{nl}彼は必ず悲惨な最期を迎えることになるでしょう。	카르타스를 절대 용서할 수 없어요..{nl}그는 반드시 비참한 최후를 맞이하게 될 겁니다.	큐폴
QUEST_LV_0500_20200227_000030	消灭努卡战士、努欧暗杀者	누카 전사, 누오 암살자 처치	
QUEST_LV_0500_20200227_000031	由于柯拉佩达委託所传达员兰达的委託。{nl}必须在特比勒图玛斯要塞消灭努卡战士、努欧暗杀者。	클라페다 의뢰소의 접수원 람다의 의뢰로{nl}트비르투마스 요새에서 누카 전사, 누오 암살자 처치를 수행해야 합니다.	
QUEST_LV_0500_20200227_000032	消灭艾可拉斯沛达尔战士	아클라스 페탈 전사 처치	
QUEST_LV_0500_20200227_000033	由于柯拉佩达委託所传达员兰达的委託。{nl}必须在特比勒图玛斯要塞消灭艾可拉斯沛达尔战士。	클라페다 의뢰소의 접수원 람다의 의뢰로{nl}트비르투마스 요새에서 아클라스 페탈 전사 처치를 수행해야 합니다.	
QUEST_LV_0500_20200227_000034	消灭生灵盔甲	리빙 아머 처치	
QUEST_LV_0500_20200227_000035	由于柯拉佩达委託所传达员兰达的委託。{nl}必须在特比勒图玛斯要塞消灭生灵盔甲。	클라페다 의뢰소의 접수원 람다의 의뢰로{nl}트비르투마스 요새에서 리빙 아머 처치를 수행해야 합니다.	
QUEST_LV_0500_20200227_000036	消灭伊嘉兰卡	일가란카 처치	
QUEST_LV_0500_20200227_000037	由于柯拉佩达委託所传达员兰达的委託。{nl}必须在特比勒图玛斯要塞消灭伊嘉兰卡。	클라페다 의뢰소의 접수원 람다의 의뢰로{nl}트비르투마스 요새에서 일가란카 처치를 수행해야 합니다.	
QUEST_LV_0500_20200227_000038	消灭普洛格斯哥布林骑士、内克	블로거즈 고블린 라이더, 넥코 처치	
QUEST_LV_0500_20200227_000039	由于柯拉佩达委託所传达员兰达的委託。{nl}必须在斯卡尔达外城消灭普洛格斯哥布林骑士、内克。	클라페다 의뢰소의 접수원 람다의 의뢰로{nl}스칼다 외곽에서 블로거즈 고블린 라이더, 넥코 처치를 수행해야 합니다.	
QUEST_LV_0500_20200227_000040	消灭灰狼	그레이 울프 처치	
QUEST_LV_0500_20200227_000041	由于柯拉佩达委託所传达员兰达的委託。{nl}必须在斯卡尔达外城消灭灰狼。	클라페다 의뢰소의 접수원 람다의 의뢰로{nl}스칼다 외곽에서 그레이 울프 처치를 수행해야 합니다.	
QUEST_LV_0500_20200227_000042	消灭普洛格斯哥布林弓箭手	블로거즈 고블린 궁수 처치	
QUEST_LV_0500_20200227_000043	由于柯拉佩达委託所传达员兰达的委託。{nl}必须在斯卡尔达外城消灭普洛格斯哥布林弓箭手。	클라페다 의뢰소의 접수원 람다의 의뢰로{nl}스칼다 외곽에서 블로거즈 고블린 궁수 처치를 수행해야 합니다.	
QUEST_LV_0500_20200227_000044	消灭灰狼首领	그레이 울프 치프 처치	
QUEST_LV_0500_20200227_000045	由于柯拉佩达委託所传达员兰达的委託。{nl}必须在斯卡尔达外城消灭灰狼首领。	클라페다 의뢰소의 접수원 람다의 의뢰로{nl}스칼다 외곽에서 그레이 울프 치프 처치를 수행해야 합니다.	
QUEST_LV_0500_20200227_000046	消灭半兽人杀手	오크 살수병 처치	
QUEST_LV_0500_20200227_000047	由于柯拉佩达委託所传达员兰达的委託。{nl}必须在林克斯玛斯废墟消灭半兽人杀手。	클라페다 의뢰소의 접수원 람다의 의뢰로{nl}링크스마스 폐허에서 오크 살수병 처치를 수행해야 합니다.	
QUEST_LV_0500_20200227_000048	消灭半兽人咒术师	오크 주술사 처치	
QUEST_LV_0500_20200227_000049	由于柯拉佩达委託所传达员兰达的委託。{nl}必须在林克斯玛斯废墟消灭半兽人咒术师。	클라페다 의뢰소의 접수원 람다의 의뢰로{nl}링크스마스 폐허에서 오크 주술사 처치를 수행해야 합니다.	
QUEST_LV_0500_20200227_000050	消灭半兽人盾兵	오크 방패병 처치	
QUEST_LV_0500_20200227_000051	由于柯拉佩达委託所传达员兰达的委託。{nl}必须在林克斯玛斯废墟消灭半兽人盾兵。	클라페다 의뢰소의 접수원 람다의 의뢰로{nl}링크스마스 폐허에서 오크 방패병 처치를 수행해야 합니다.	
QUEST_LV_0500_20200227_000052	消灭半兽人队长	오크 리더 처치	
QUEST_LV_0500_20200227_000053	由于柯拉佩达委託所传达员兰达的委託。{nl}必须在林克斯玛斯废墟消灭半兽人队长。	클라페다 의뢰소의 접수원 람다의 의뢰로{nl}링크스마스 폐허에서 오크 리더 처치를 수행해야 합니다.	
QUEST_LV_0500_20200227_000054	消灭林克斯玛斯废墟的怪物	링크스마스 폐허의 몬스터 처치	
QUEST_LV_0500_20200227_000055	由于柯拉佩达委託所传达员兰达的委託。{nl}必须在林克斯玛斯废墟消灭足够数量的怪物。	클라페다 의뢰소의 접수원 람다의 의뢰로{nl}링크스마스 폐허에서 충분한 수의 몬스터 처치를 수행해야 합니다.	
QUEST_LV_0500_20200227_000056	消灭半兽人重炮手	오크 캐논병 처치	
QUEST_LV_0500_20200227_000057	由于柯拉佩达委託所传达员兰达的委託。{nl}必须在终结之路消灭 半兽人重炮手。	클라페다 의뢰소의 접수원 람다의 의뢰로{nl}종언의 길에서 오크 캐논병 처치를 수행해야 합니다.	
QUEST_LV_0500_20200227_000058	消灭半兽人旗帜兵	오크 깃발병 처치	
QUEST_LV_0500_20200227_000059	由于柯拉佩达委託所传达员兰达的委託。{nl}必须在终结之路消灭 半兽人旗帜兵。	클라페다 의뢰소의 접수원 람다의 의뢰로{nl}종언의 길에서 오크 깃발병 처치를 수행해야 합니다.	
QUEST_LV_0500_20200227_000060	消灭半兽人首领	오크 대장 처치	
QUEST_LV_0500_20200227_000061	由于柯拉佩达委託所传达员兰达的委託。{nl}必须在终结之路消灭半兽人首领。	클라페다 의뢰소의 접수원 람다의 의뢰로{nl}종언의 길에서 오크 대장 처치를 수행해야 합니다.	
QUEST_LV_0500_20200227_000062	消灭终结之路的怪物	종언의 길의 몬스터 처치	
QUEST_LV_0500_20200227_000063	由于柯拉佩达委託所传达员兰达的委託。{nl}必须在终结之路消灭足够数量的怪物。	클라페다 의뢰소의 접수원 람다의 의뢰로{nl}종언의 길에서 충분한 수의 몬스터 처치를 수행해야 합니다.	
QUEST_LV_0500_20200227_000064	由于柯拉佩达委託所传达员兰达的委託，必须在特比勒图玛斯要塞消灭努卡战士、努欧暗杀者。	클라페다 의뢰소의 접수원 람다의 의뢰로 트비르투마스 요새에서 누카 전사, 누오 암살자 처치를 수행해야 합니다.	
QUEST_LV_0500_20200227_000065	由于柯拉佩达委託所传达员兰达的委託，必须在特比勒图玛斯要塞消灭艾可拉斯沛达尔战士。	클라페다 의뢰소의 접수원 람다의 의뢰로 트비르투마스 요새에서 아클라스 페탈 전사 처치를 수행해야 합니다.	
QUEST_LV_0500_20200227_000066	由于柯拉佩达委託所传达员兰达的委託，必须在特比勒图玛斯要塞消灭生灵盔甲。	클라페다 의뢰소의 접수원 람다의 의뢰로 트비르투마스 요새에서 리빙 아머 처치를 수행해야 합니다.	
QUEST_LV_0500_20200227_000067	由于柯拉佩达委託所传达员兰达的委託，必须在特比勒图玛斯要塞消灭伊嘉兰卡。	클라페다 의뢰소의 접수원 람다의 의뢰로 트비르투마스 요새에서 일가란카 처치를 수행해야 합니다.	
QUEST_LV_0500_20200227_000068	由于柯拉佩达委託所传达员兰达的委託，必须在斯卡尔达外城消灭普洛格斯哥布林骑士、内克。	클라페다 의뢰소의 접수원 람다의 의뢰로 스칼다 외곽에서 블로거즈 고블린 라이더, 넥코 처치를 수행해야 합니다.	
QUEST_LV_0500_20200227_000069	由于柯拉佩达委託所传达员兰达的委託，必须在斯卡尔达外城消灭灰狼。	클라페다 의뢰소의 접수원 람다의 의뢰로 스칼다 외곽에서 그레이 울프 처치를 수행해야 합니다.	
QUEST_LV_0500_20200227_000070	由于柯拉佩达委託所传达员兰达的委託，必须在斯卡尔达外城消灭普洛格斯哥布林弓箭手。	클라페다 의뢰소의 접수원 람다의 의뢰로 스칼다 외곽에서 블로거즈 고블린 궁수 처치를 수행해야 합니다.	
QUEST_LV_0500_20200227_000071	由于柯拉佩达委託所传达员兰达的委託，必须在斯卡尔达外城消灭灰狼首领。	클라페다 의뢰소의 접수원 람다의 의뢰로 스칼다 외곽에서 그레이 울프 치프 처치를 수행해야 합니다.	
QUEST_LV_0500_20200227_000072	由于柯拉佩达委託所传达员兰达的委託，必须在林克斯玛斯废墟消灭半兽人杀手。	클라페다 의뢰소의 접수원 람다의 의뢰로 링크스마스 폐허에서 오크 살수병 처치를 수행해야 합니다.	
QUEST_LV_0500_20200227_000073	由于柯拉佩达委託所传达员兰达的委託，必须在林克斯玛斯废墟消灭半兽人咒术师。	클라페다 의뢰소의 접수원 람다의 의뢰로 링크스마스 폐허에서 오크 주술사 처치를 수행해야 합니다.	
QUEST_LV_0500_20200227_000074	由于柯拉佩达委託所传达员兰达的委託，必须在林克斯玛斯废墟消灭半兽人盾兵。	클라페다 의뢰소의 접수원 람다의 의뢰로 링크스마스 폐허에서 오크 방패병 처치를 수행해야 합니다.	
QUEST_LV_0500_20200227_000075	由于柯拉佩达委託所传达员兰达的委託，必须在林克斯玛斯废墟消灭半兽人队长。	클라페다 의뢰소의 접수원 람다의 의뢰로 링크스마스 폐허에서 오크 리더 처치를 수행해야 합니다.	
QUEST_LV_0500_20200227_000076	由于柯拉佩达委託所传达员兰达的委託，必须在林克斯玛斯废墟消灭足够数量的怪物。	클라페다 의뢰소의 접수원 람다의 의뢰로 링크스마스 폐허에서 충분한 수의 몬스터 처치를 수행해야 합니다.	
QUEST_LV_0500_20200227_000077	由于柯拉佩达委託所传达员兰达的委託，必须在终结之路消灭半兽人重炮手。	클라페다 의뢰소의 접수원 람다의 의뢰로 종언의 길에서 오크 캐논병 처치를 수행해야 합니다.	
QUEST_LV_0500_20200227_000078	由于柯拉佩达委託所传达员兰达的委託，必须在终结之路消灭半兽人旗帜兵。	클라페다 의뢰소의 접수원 람다의 의뢰로 종언의 길에서 오크 깃발병 처치를 수행해야 합니다.	
QUEST_LV_0500_20200227_000079	由于柯拉佩达委託所传达员兰达的委託，必须在终结之路消灭半兽人首领。	클라페다 의뢰소의 접수원 람다의 의뢰로 종언의 길에서 오크 대장 처치를 수행해야 합니다.	
QUEST_LV_0500_20200227_000080	由于柯拉佩达委託所传达员兰达的委託，必须在终结之路消灭足够数量的怪物。	클라페다 의뢰소의 접수원 람다의 의뢰로 종언의 길에서 충분한 수의 몬스터 처치를 수행해야 합니다.	
QUEST_LV_0500_20200403_000081	等一下，你是启示者吗?	잠시만요, 혹시 계시자인가요?	세이지 파견원
QUEST_LV_0500_20200403_000082	大事不好了。{nl}神树之日以后，次元经常出现破坏的现象。{nl}	큰일입니다.{nl}신수의 날 이후로 종종 차원이 붕괴하는 현상이 나타나고 있어요.{nl}	세이지 파견원
QUEST_LV_0500_20200403_000083	不仅如此，附近的怪物们正加速著崩坏。{nl}如不阻止这一切，次元崩坏会蔓延至大陆全区域的。{nl}靠我一个人要阻止这件事情实在太困难了，所以我正请求启示者们的协助。{nl}拜託你了。	더군다나 근처의 몬스터들이 붕괴를 가속하고 있죠.{nl}막지 않으면 차원 붕괴가 대륙 전역으로 번질 거예요.{nl}저 혼자서는 벅찬일이라 계시자들에게 도움을 구하고 있습니다.{nl}이렇게 부탁드립니다.	세이지 파견원
QUEST_LV_0500_20200403_000084	请勿被捲进次元崩坏裡而丧失性命。{nl}如尚未准备妥当，请勿前往靠近。	차원 붕괴에 휘말려 아까운 목숨을 잃지 않도록 주의하세요.{nl}준비가 충분하지 않으면 가까이 가지 않는 게 좋습니다.	세이지 파견원
QUEST_LV_0500_20200403_000085	阻止次元崩坏	차원 붕괴 저지	
QUEST_LV_0500_20200403_000086	表示是启示者	계시자가 맞다고 한다.	
QUEST_LV_0500_20200403_000087	表示非启示者	계시자가 아니라고 한다.	
QUEST_LV_0500_20200403_000088	与贤者派遣员对话。	세이지 파견원과 대화하기.	
QUEST_LV_0500_20200403_000089	位于废都的贤者派遣员正在分发某个东西给启示者们，请去与贤者派遣员对话。	폐도에 위치한 세이지 파견원이 계시자들에게 무언가를 지급하고 있습니다. 세이지 파견원과 대화하세요.	
QUEST_LV_0500_20200724_000090	我们在这裡调查最近发生的寒流现象。{nl}	저희는 여기서 최근에 일어난 한파 현상에 대해 조사하고 있습니다.{nl}	크루세이더 마스터
QUEST_LV_0500_20200724_000091	经过三次的调查，终于知道绝壁下方的魔族就是造成寒流的原因。{nl}	세 차례에 걸친 조사로 이 절벽 아래에 있는 마족이 한파의 원인이라는 건 알아냈습니다.{nl}	크루세이더 마스터
QUEST_LV_0500_20200724_000092	魔族的名字是...{nl}	마족의 이름은..{nl}	크루세이더 마스터
QUEST_LV_0500_20200724_000093	格莱伊希欧。{nl}	글레이시어.{nl}	크루세이더 마스터
QUEST_LV_0500_20200724_000094	是一个叫格莱伊希欧的魔族。{nl}而且我们还发现到在特殊装置上漂浮的黑色水晶。{nl}虽然不确定其来历，但却浓缩著强大的魔力。{nl}	글레이시어라고 하는 마족입니다.{nl}그리고 특별한 장치 위에 떠 있는 검은 수정도 발견했습니다.{nl}정체가 확실하지는 않지만, 강한 마력을 응축하고 있었습니다.{nl}	크루세이더 마스터
QUEST_LV_0500_20200724_000095	几次曾试图讨伐格莱伊希欧，但都没有突破寒流和魔族的攻势。{nl}	몇 차례 글레이시어 토벌을 시도했지만, 한파와 마족의 공세를 뚫는 데 실패했습니다.{nl}	크루세이더 마스터
QUEST_LV_0500_20200724_000096	有听说过启示者们的活跃表现。{nl}请帮助我们消灭格莱伊希欧。	계시자들의 활약상은 들었습니다.{nl}글레이시어  처치를 도와주십시오.	크루세이더 마스터
QUEST_LV_0500_20200724_000097	那麽，请做好前往绝壁下方的准备后再见面吧。	그럼, 절벽 아래로 내려갈 준비를 마친 후 다시 뵙겠습니다.	크루세이더 마스터
QUEST_LV_0500_20200724_000098	前往绝壁下方后，很难再请求支援。{nl}而且要突破格莱伊希欧所掀起的寒流，应该也很困难。{nl}	절벽 아래로 내려간다면, 추가 지원을 요청하기는 힘들 겁니다.{nl}글레이시어가 일으키고 있는 한파를 버젓이 뚫고 가기도 쉽지 않을 겁니다.{nl}	크루세이더 마스터
QUEST_LV_0500_20200724_000099	我们可以助你在此搭乘铁笼车，安全抵达绝壁下方。{nl}	저희는 여기서 계시자님이 철창을 타고 절벽 아래로 무사히 내려갈 수 있도록 돕겠습니다.{nl}	크루세이더 마스터
QUEST_LV_0500_20200724_000100	格莱伊希欧就拜託你了。	글레이시어를 잘 부탁합니다.	크루세이더 마스터
QUEST_LV_0500_20200724_000101	启示者。{nl}能给我一点时间吗？{nl}	계시자님.{nl}잠시 시간 좀 내주시겠습니까?{nl}	크루세이더 파견원
QUEST_LV_0500_20200724_000102	上次在调查绝壁下方时发现了几个问题。{nl}其中，这红色液体...{nl}在那寒冷当中竟然没有结冻，只有结一层薄冰而已。{nl}	지난 번, 절벽 아래를 조사하는 중에 몇 가지를 발견한 게 있습니다.{nl}그중 이 붉은 액체..{nl}그 추위 속에서 얼지 않고 살얼음만 띄고 있더군요.{nl}	크루세이더 파견원
QUEST_LV_0500_20200724_000103	觉得有点可疑，所以採集了一些。{nl}如果有人可以委託分析的话，就交给启示者你了。	아무래도 심상치 않아 채취했습니다.{nl}혹시 분석을 맡길 만한 사람이 있다면 계시자님께 맡기겠습니다.	크루세이더 파견원
QUEST_LV_0500_20200724_000104	谢谢。{nl}分析完毕后，请再来找我。	감사합니다.{nl}분석이 완료되면 다시 저를 찾아와 주세요.	크루세이더 파견원
QUEST_LV_0500_20200724_000105	你是说分析溶液吗？{nl}虽然不是什麽难事，但有股不祥的感觉。{nl}	용액을 분석해 달라는 말씀이신가요?{nl}어려운 일은 아니지만, 불길한 짐작이 드는군요.{nl}	플레이그 닥터 마스터
QUEST_LV_0500_20200724_000106	为了准确的分析，我需要植物。{nl}附近不管什麽都可以，能帮我找一个吗？{nl}这麽说来，正好离这裡不远的地方有个长长的植物，就帮我找那个吧。	확실히 하기 위해서는 식물이 필요합니다.{nl}근처에서 어떤 것이든 상관없으니 하나만 구해주시겠습니까?{nl}그러고 보니 마침, 여기서 멀지 않은 쪽에 길게 자란 식물이 있으니 그게 좋겠네요.	플레이그 닥터 마스터
QUEST_LV_0500_20200724_000107	分析完毕后，请再来找我。	분석이 완료되면 다시 저를 찾아와 주세요.	크루세이더 파견원
QUEST_LV_0500_20200724_000108	这是...nl}	이건..{nl}	플레이그 닥터 마스터
