QUEST_UNUSED_20151102_002532	あなたがパラディンとして行ってきたことは他のパラディンたちの見本となっています。{nl}でも私は直接自分の目で確認したいのです。{nl}	그 사이 실력이 또 일취월장하셨군요.{nl}아무래도 마지막 단계로 나아가기 위한 시험을 치르셔야겠어요.{nl}그 실력을 증명할 방법이 필요하겠군요.	QUEST_UNUSED_20151022_001223	あなたがパラディンとして行ってきたことは他のパラディンたちの見本となっています。{nl}でも私は直接自分の目で確認したいのです。{nl}	그 사이 실력이 또 일취월장하셨군요. 이 정도라면 저희 삼촌도 놀라겠는걸요.{nl}아무래도 마지막 단계로 나아가기 위한 시험을 치르셔야겠어요.{nl}그 실력을 증명할 방법이 필요하겠군요.	팔라딘 서브 마스터
QUEST_UNUSED_20151102_002533	この試験もこれで最後ですので、少し難易度は上がります。{nl}テナンツ農場のガイガラス…今のあなたにぴったりの相手だと思います。	마침 적당한 상대를 알고 있지요.{nl}테넌츠 농장에서 가이갈라스라는 몬스터가 날뛰는 모양이에요.{nl}녀석이 더 이상 사람들을 해치지 못하도록 처리해 주세요.	QUEST_UNUSED_20151022_001224	この試験もこれで最後ですので、少し難易度は上がります。{nl}テナンツ農場のガイガラス…今のあなたにぴったりの相手だと思います。	마침 적당한 상대를 알고 있지요.{nl}테넌츠 농장에서 가이갈라스라는 몬스터가 날뛰는 모양이에요.	팔라딘 서브 마스터
QUEST_UNUSED_20151102_002534	噂というものは誇張されるものですが…。{nl}あなたに限っては真実そのものですね。{nl}	솔직히 좀 위험하지 않을까 싶었는데 제가 당신의 실력을 오판한 모양이군요.{nl}대단하세요.{nl}누구든지 당신이라면 높은 경지의 팔라딘이 될 수 있는 자격이 있음을 인정할 겁니다.	QUEST_UNUSED_20151022_001226	噂というものは誇張されるものですが…。{nl}あなたに限っては真実そのものですね。{nl}	솔직히 좀 위험하지 않을까 싶었는데 제가 당신의 실력을 오판한 모양이군요.{nl}대단하군요. 당신이라면 누구라도 가장 높은 경지의 팔라딘으로 인정할 겁니다.	팔라딘 서브 마스터
QUEST_UNUSED_20151102_002535	終わり	끝	
QUEST_UNUSED_20151102_002536	進行！	진행!	계시자 미하일
QUEST_UNUSED_20151102_002537	進行？	진행?	마법사 멜히오라스
QUEST_UNUSED_20151102_002538	終わり？	끝?	계시자 미하일
QUEST_UNUSED_20151102_002539	ここなら女神ジェミナの行方をつかめるかと思ったのに、亡者だらけだなんて…。{nl}こんなのは初めて見ました。早くジェミナ様を探さなきゃいけないのに。	여기라면 제미나 여신의 행방을 찾을 수 있을까 했는데 망자들만 가득하다니..{nl}이런 건 처음 봐요. 어서 제미나님을 찾아야 할 텐데요.	QUEST_UNUSED_20151001_000537	ここなら女神ジェミナの行方を追えるかもと思ったのに、亡者たちでいっぱいだなんて…。{nl}こんなの初めて見ました。早くジェミナ様を見つけなきゃいけないのに。	여기라면 제미나 여신의 행방을 찾을 수 있을까 했는데 망자들만 가득하다니..{nl}이런 건 처음 봐요. 어서 제미나님을 찾아야 할텐데요.	보코르 유타
QUEST_UNUSED_20151102_002540	近寄れもしないようにされた聖物か…。{nl}モンスターや魔族ならともかく、人も近寄れないなんて理解できませんね。	가까이 가지도 못하게 막아 놓은 성물이라..{nl}몬스터나 마족은 이해한다 쳐도, 사람까지 막아놓는 건 이해가 안되네요.	QUEST_LV_0100_20151001_008743	A holy relic that you can't even approach... {nl}I understand if they block the monsters or demons from getting close to it but even humans, that I don't understand.	가까히 가지도 못하게 막아 놓은 성물이라..{nl}몬스터나 마족은 이해한다 쳐도, 사람까지 막아놓는 건 이해가 안되네요.	보코르 유타
QUEST_UNUSED_20151102_002541	あれは一体何だったんですか？{nl}無事で本当に良かったです。危く女神のもとへ行くところでした。{nl}	그건 도대체 뭐였죠? {nl}무사해서 정말 다행이에요. 하마터면 여신의 품으로 갈 뻔 했네요.{nl}	QUEST_LV_0100_20151001_008771	Thank you for saving me. I almost went to the goddess. {nl}I guess it is a lie that it was a holy relic of the goddess. {nl}	구해주셔서 감사해요. 하마터면 여신의 품으로 갈 뻔 했네요.{nl}역시 그게 여신의 성물이라는 건 거짓말이었나봐요.{nl}	보코르 유타
QUEST_UNUSED_20151102_002542	やっぱり…あれが女神の聖物だなんて嘘だったんですね。{nl}	역시.. 그게 여신의 성물이라는 건 거짓말이었나봐요.{nl}	QUEST_LV_0100_20151001_008772	The relic of the goddess would not summon such a monster. {nl}I smell something fishy with that Order of the Tree of Truth. 	여신의 성물이 저런 몬스터를 불러낼 리는 없으니까요.{nl}그 진리의 나무교단이라는 사람들도 의심스럽네요.	보코르 유타
QUEST_UNUSED_20151102_002543	この記録は君に預けよう。{nl}君が責任を持ってこの記録を始末してくれれば、またゆっくり休めそうだ。	내 이 기록을 자네에게 주겠네.{nl}자네가 책임지고 이 기록을 없애준다면 다시 편히 잠들 수 있을 것 같아.	QUEST_LV_0100_20151001_008851	I will give this record to you. If you make sure destroy it, I will be able to lay in peace again. {nl}Please.	내 이 기록을 자네에게 주겠네.{nl}자네가 책임지고 이 기록을 없애준다면 다시 편히 잠들 수 있을 것 같네. {nl}부탁하네.	칼라일의 영혼
QUEST_UNUSED_20151102_002544	初めて見る方…ですね。{nl}	처음 보는 분.. 이네요.{nl}	QUEST_UNUSED_20151022_001229	ちょっと、そこのあなた。{nl}こんな人気の無い森に来るなんて何者ですか？{nl}ああ、誰でも構いません。私に力を貸してください。{nl}	응?{nl}이렇게 인적 드문 숲에는 어쩐 일로 오신거죠?{nl}아.. 그건 아무래도 좋아요. 괜찮으시면 절 좀 도와주시겠어요?{nl}	드루이드 레야
QUEST_UNUSED_20151102_002545	うっ…それはいいんです…。{nl}もし良かったら、手を貸してもらえませんか？{nl}	윽.. 그건 아무래도 좋아요. {nl}괜찮다면 절 도와주시겠어요?{nl}	QUEST_UNUSED_20151016_000799	私はこの森で暮らすドルイドのレヤ。{nl}村を襲って食糧を奪ったフェレットを追っていてここまで来たんです。{nl}でも、食糧を取り戻すどころか、逆にフェレットたちに攻撃されて…。{nl}	저는 이 숲에 사는 드루이드 레야라고 해요.{nl}페릿이 마을을 습격해서 식량을 훔쳐달아나는 걸 쫓다가 여기까지 왔죠.{nl}그런데 식량도 못찾고 오히려 페릿들에게 공격당해버렸네요.{nl}	드루이드 레야
QUEST_UNUSED_20151102_002546	フェレットが村の食糧を盗んでいったのを追ってきたら、こんな奥地まで来てしまいました。{nl}でも、食糧を取り戻すどころか、フェレットたちに逆に攻撃されて…。{nl}	페릿이 마을의 식량을 훔쳐 달아나는 걸 쫓다가 여기까지 와버렸어요.{nl}그런데 식량을 되찾긴 커녕 오히려 페릿들에게 공격당해버렸네요.{nl}	QUEST_UNUSED_20151016_000800	村へ戻る前に傷の治療をしたいんですが…。{nl}あの上に登ると傷に効く薬草があるんです。その薬草を取って来てください。	마을로 돌아가기 전에 상처를 좀 추스려야할 것 같은데..{nl}저 위에 올라가면 상처에 잘 듣는 약초가 있어요. 그 약초를 좀 가져다주세요.	드루이드 레야
QUEST_UNUSED_20151102_002547	できれば応急処置をしたいんですが…動けなくて。{nl}ルブダ絶壁の方に止血によく効く薬草があるんです。それを取ってきていただけませんか？	어떻게든 응급처치라도 하고 싶은데..{nl}르브다 절벽 쪽에 지혈에 잘 듣는 약초가 있어요. 그걸 부탁드려도 될까요?	드루이드 레야
QUEST_UNUSED_20151102_002548	多分、フェレットたちが襲ってくると思います。{nl}この森は自分たちのものだと主張しているみたい。	어쩌면 페릿들이 공격해올지도 몰라요.{nl}언젠가부터 이 숲에서 나는 모든 게 자기들 거라고 생각하는 것 같더라고요.	QUEST_UNUSED_20151016_000801	薬草を採集していたら、フェレットたちが攻撃してくるかもしれません。{nl}いつからかこの森の全てが自分たちの物だと考えるようになったみたいなんです。	약초를 채집하다보면 페릿들이 공격해올지도 몰라요.{nl}언젠가부터 이 숲에서 나는 모든 게 자기꺼라고 생각하는 것 같더라구요.	드루이드 레야
QUEST_UNUSED_20151102_002549	本当にありがとうございます。{nl}血が止まったらすぐに村人たちがいる作業場へ戻らないと…。{nl}	정말 감사해요. 제대로 구해 오셨네요.{nl}조금만 쉬었다가 마을 사람들이 있는 작업장으로 돌아 가야겠어요.{nl}	QUEST_UNUSED_20151022_001230	ありがとうございます。でも、村人たちはよそ者を嫌うので…。{nl}外部の人に頼み事をするなんて、めったにないんです。{nl}もしも村へ行くつもりなら、戻った方が良いと思いますよ。	제대로 구해오셨네요. 고마워요.{nl}마을로 모셔가서 보답해드리고 싶지만..{nl}우리 마을 사람들은 외지인을 반기는 편이 아니라서요..{nl}	드루이드 레야
QUEST_UNUSED_20151102_002550	謎の少女が巨大な斧を持った魔族に追われていた？{nl}その魔族は魔将ジャウラだと思うんですが…少女のことはわからないですね。{nl}	웬 소녀가 거대한 도끼를 든 마족에 쫓기는 걸 보셨다고요?{nl}마족은 마군주 자우라 같은데, 그 소녀는 저도 잘 모르겠네요.{nl}	QUEST_UNUSED_20151022_001231	戻って来る途中で少女と少女を追う魔族に会ったんですか？{nl}啓示者と少女を会わせてはいけないとは…。{nl}確かに何かありそうですが…あなたとは関係ないことじゃありませんか？	돌아오는 길에 거대한 도끼를 든 마족과 그 마족에게 쫓기는 소녀를 보셨다구요?{nl}거대한 도끼를 든 마족이라면 마군주 자우라인데..{nl}계시자와 소녀를 만나게 해서는 안된다니.. 확실히 심상치 않은 일이네요..{nl}	드루이드 레야
QUEST_UNUSED_20151102_002551	それに、その少女を啓示者と会わせてはいけないなんて…どういうことかしら。{nl}	게다가 그 소녀가 계시자와 만나게 해선 안된다니.. {nl}	QUEST_UNUSED_20151022_001232	このことを村に知らせて村の人々と調べてみなければなりません。{nl}私たちの村のことで外部の人を危険に陥れることはできません。	이 일은 마을에 알리고 마을 사람들과 알아봐야겠어요.{nl}우리 마을 일로 외지인을 위험에 빠뜨릴 수는 없죠.	드루이드 레야
QUEST_UNUSED_20151102_002552	嫌な予感がします。{nl}このことを村人たちに知らせないと。{nl}	느낌이 안 좋아요.{nl}이건 마을 사람들에게 알려야 할 것 같아요.{nl}	드루이드 레야
QUEST_UNUSED_20151102_002553	え？{nl}あなたが啓示者ですって？{nl}	네?{nl}당신이 계시자라고요?{nl}	QUEST_UNUSED_20151022_001233	え？あなたは啓示者なんですか？{nl}だったら、あなたもあの凶夢を見たんですね？{nl}…もしかしたら、あなたが伝説で伝わる異邦人なのでしょうか。{nl}	네? 당신이 계시자라고요?{nl}그렇다면 혹시 재앙의 꿈을 꾸고 이 곳으로 온건가요?{nl}..그렇다면 당신이 우리 마을에 내려오는 전승 속의 계시자일지도 모르겠어요.{nl}	드루이드 레야
QUEST_UNUSED_20151102_002554	ということは、災いの夢を見てここへ来たんです？{nl}	그렇다면 혹시 재앙의 꿈을 꾸고 이 곳으로 오신 건가요?{nl}	QUEST_UNUSED_20151022_001234	うちの村には遥か昔、女神ライマが残したという伝説があるんです。{nl}村が危機に瀕した時、凶夢を追う異邦人が聖なる光と共に現れ、{nl}邪悪な気を払って村を救うだろうという伝説なんですけど…。{nl}こうしてる場合じゃないわ。急いで村へ行って確かめなきゃ！{nl}	우리 마을에는 먼 옛날 라이마 여신께서 남긴 예지가 전승으로 내려오고 있어요.{nl}마을이 위기에 처했을 때 재앙의 꿈을 쫓아온 계시자가 성스러운 빛과 함께{nl}사악한 기운을 물리치고 마을을 구할거라는 내용이죠.{nl}이럴 때가 아니에요. 얼른 마을에 가서 확실히 알아봐야겠어요.{nl}	드루이드 레야
QUEST_UNUSED_20151102_002555	まさか、今度こそ…本当に…？{nl}あの…あなたは、村に伝わる物語に出て来る啓示者様かもしれないんです。{nl}	설마, 이번에야말로.. {nl}우리 마을에 내려 오는 이야기 속의 진짜 계시자가 당신일지도 모르겠어요.{nl}	QUEST_UNUSED_20151022_001235	ああ…食糧…フェレットに盗まれた食糧を取り戻さなきゃ…。{nl}神樹の日の後、この森の川の水が赤く染まって、果物が巨大化したんです。{nl}そして、なぜか川の水も果物も毒で汚染されて…。{nl}そのせいで食べられる物が少なくなったのに、それさえフェレットに盗まれちゃうんです。{nl}	제가 먼저 마을로 가서 전승에 대해 좀 더 자세히 알아보고 있을테니{nl}계시자님은 페릿들이 훔쳐간 식량을 되찾아주세요.{nl}아무리 외지인을 꺼리더라도 페릿이 훔쳐간 식량을 되찾아주신다면 마을 사람들도 힘을 보탤 거에요.	드루이드 레야
QUEST_UNUSED_20151102_002556	村にはこう伝わっています。『村が危機に瀕した時、災いの夢を見た啓示者が現れるだろう。{nl}啓示者、聖なる光と共に魔気を払って村を救わん』…って。{nl}	마을이 위기에 처했을 때, 재앙의 꿈을 쫓아온 계시자가 나타날 것이다.{nl}성스러운 빛과 함께 사악한 기운을 물리치고 마을을 구원하리라.. 라고요.{nl}	QUEST_LV_0100_20151016_009827	Revelator. This town is having a food crisis.{nl}Please, use this anti-ferret paralysis powder to retrieve the food they stole.{nl}I will head back to town and ask more about the legend.	계시자님. 지금 마을 사람들은 식량 문제로 크게 곤란해하고 있어요.{nl}여기 페릿용 마비 가루를 드릴테니 페릿들로부터 페릿이 훔쳐간 식량을 되찾아주세요.{nl}저는 먼저 마을로 돌아가서 전승에 대해 좀 더 자세히 알아볼게요.	드루이드 레야
QUEST_UNUSED_20151102_002557	遥か昔から村に伝わる女神ライマが予知したお話です。{nl}でも…うーん…。{nl}	오래 전부터 마을에 전해져 오는 라이마 여신의 예지이지요.{nl}하지만.. 음..{nl}	드루이드 레야
QUEST_UNUSED_20151102_002558	話しこんでいる場合ではありませんね。{nl}私はとりあえず、村長に伝説について詳しく聞いてみます。{nl}ご心配なく。足が痛いなんて言っていられません！	이럴 때가 아니에요.{nl}저는 일단 촌장님께 전승에 대해 자세히 알아보고 있을게요.{nl}	드루이드 레야
QUEST_UNUSED_20151102_002559	あ…ついでといったらアレですけど、フェレットが盗んだ食糧を取り戻してくださいません？{nl}ベライの森の作業場にいる村長に届けていただきたいので、目的地は一緒ですから。{nl}	그 동안 계시자님께선 페릿들이 훔쳐간 식량을 되찾아 주세요.{nl}벨라이 숲 작업장에 계시는 촌장님께 가져다 주시면 돼요.{nl}	드루이드 레야
QUEST_UNUSED_20151102_002560	村では事情があってよそ者を受け入れないしきたりなのですが、{nl}力を貸してくれる人に冷たくはしないはずです。	마을 사람들이 예전 일 때문에 외지인을 꺼리긴 하지만..{nl}도와 준 사람을 외면하진 않을 거예요.	드루이드 레야
QUEST_UNUSED_20151102_002561	君がレヤの言っていた啓示者かね？{nl}そしてこれは…盗まれた食糧だな。{nl}	당신이 레야가 말한 계시자인가요?{nl}그리고 이건.. 저희가 도둑맞은 식량이군요.{nl}	QUEST_UNUSED_20151022_001236	君か？君がレヤの言っていた啓示者なのか？{nl}村の司祭の話だと君が村に光をもたらすそうだが…。{nl}ついにこの時が来たのか…。村を救う異邦人が現れた…。{nl}おお、女神ライマよ…。感謝いたしますぞ。まだ我らをお見捨てではなかったのですな…。{nl}	자넨가? 자네가 레야가 말한 계시자인가?{nl}페릿에게 습격당한 마을 사제도 자네가 빛으로 구해줬다지?{nl}드디어 왔네. 왔어. 마을을 구할 계시자가 온게야.{nl}오오.. 라이마 여신이시여.. 감사합니다. 우릴 버리지 않으셨군요..{nl}	마을 촌장
QUEST_UNUSED_20151102_002562	我らの食糧を取り戻してくれて本当にありがとう。{nl}だが、だからといって、無条件で信じるわけにはいかん。{nl}	저희 식량을 되찾아 준 건 고맙지만.. {nl}그렇다고 해서 무작정 믿을 순 없어요.{nl}	QUEST_UNUSED_20151022_001237	それは何かね？な、なんと！異邦人がフェレットに盗まれた食糧を取り戻したぞ！{nl}本当にこの村を救いに来てくれたのか。おお…ありがたや、ありがたや…。	그건 뭔가? 페릿이 훔쳐갔던 식량 아닌가?!{nl}이보게들! 이것 좀 보게! 계시자께서 페릿들이 훔쳐간 식량을 되찾아오셨네!{nl}정말 우리 마을을 구해주러 온 게 맞나보구만.{nl}고맙네. 정말 고마워.	마을 촌장
QUEST_UNUSED_20151102_002563	理解してくれ。{nl}我らは一度、魔族に謀られているのだよ。	이해해 주세요. {nl}우린 마족에게 한 번 속은 적이 있었으니까요.	마을 촌장
QUEST_UNUSED_20151102_002564	レヤは他に用があると他の場所へいたぞ。{nl}だが、どこに行ったのは言えん。{nl}	레야는 따로 볼 일이 있다며 다른 곳으로 갔어요.{nl}하지만 어디로 갔는지는 말해줄 순 없지요.{nl}	QUEST_UNUSED_20151022_001238	レヤはライマ台地へ行ったようだな。女神が巨大女神像に何かを残しているはずだと言っていたが…。{nl}	레야는 자네에게 도움이 될 것을 찾겠다며 먼저 제라하로 갔네.{nl}그 곳에는 라이마 여신을 모시던 선조들이 조각한 여신상이 있지.{nl}라이마 여신께서 필시 여신상에 자네를 위한 준비를 해뒀을 거라면서 말이네.{nl}제라하로 갈 생각이라면 가기 전에 내 얘기를 좀 들어보게나.{nl}	마을 촌장
QUEST_UNUSED_20151102_002565	さっきも言ったが、我らは君を根拠なく信用することができないのだ。{nl}	아까도 말했다시피, 우린 당신을 무작정 믿을 수는 없으니까요.{nl}	QUEST_UNUSED_20151022_001239	わが村はライマ台地で女神ライマに仕える村だった。{nl}はるか昔、女神ライマは不吉な未来を予知し、それに備えるための旅に出られることになったのだ。{nl}村人たちは心配した女神ライマは、女神ラダに村を託されてな。{nl}女神ラダにも防げない危機が村を襲ったときには、凶夢を見てやってきた異邦人が{nl}光と共に村を救うだろうという伝説を残されたのだよ。{nl}	먼 옛날 라이마 여신께서는 불길한 미래를 예지하시고 자취를 감추셨을 때,{nl}남은 우리를 걱정한 라이마 여신께서는 라다 여신께 마을을 부탁하셨네.{nl}하지만 라이마 여신의 걱정과는 달리 마을은 평화로웠어.{nl}	마을 촌장
QUEST_UNUSED_20151102_002566	以前、自分は啓示者だと名乗ってここに来た者がいてな。{nl}青白い顔をした髪の長い男だった。{nl}	예전에 자신이 계시자라며 이 곳에 찾아 온 사람이 있었죠.{nl}창백한 얼굴에 긴 머리의 남자였어요.{nl}	QUEST_UNUSED_20151022_001240	そして神樹の日が到来し、女神ライマが予知した未来が現実のものとなってしまった。{nl}川の水は赤く染まり、その水で育った果物もろとも人には口にできない毒で汚染されてしまった。{nl}そんな中で、魔族が村を襲撃したのだ。	그렇게 평화로움이 계속 되던 중 신수의 날이 왔네.{nl}마족들이 마을을 습격해서 라다 여신을 납치해갔고, 강물이 붉게 물들었지.{nl}강물을 마시는 사람은 고통에 시달렸고, 그 강물을 먹고 자란 과일은 거대해졌지.{nl}거대해진 과일 역시 붉은 물 처럼 먹으면 고통에 시달려서 먹을 수가 없게 됐네.{nl}	마을 촌장
QUEST_UNUSED_20151102_002567	我らはついに伝説の啓示者が現れたと信じ、その男の言う通りにした。{nl}だが、その正体は…魔族だったのだ。{nl}	우리는 드디어 전승 속의 계시자가 나타났다고 믿었기에 그 남자가 시키는 대로 따랐어요.{nl}하지만 그의 정체는.. 마족이었지요.{nl}	QUEST_UNUSED_20151022_001241	災難が村を襲った今、村の人々は災難の夢を追ってきた啓示者が{nl}邪悪な気勢をはね除けて光と共に村を救うことという伝承だけを信じているよ。{nl}	재앙이 마을을 덮친 지금, 마을 사람들은 재앙의 꿈을 쫓아 온 계시자가{nl}사악한 기운을 물리치고 빛과 함께 마을을 구할거라는 전승만을 믿고 있네.{nl}	마을 촌장
QUEST_UNUSED_20151102_002568	我らが魔族に騙されたせいで女神ラダは姿を消し…大人しかったフェレット族まで{nl}凶暴化してしまった。{nl}	우리가 그 마족에게 놀아난 덕분에 라다 여신은 납치되었고.. {nl}온순했던 페릿 부족까지 난폭하게 돌변했어요.{nl}	QUEST_UNUSED_20151022_001242	奴らは女神ラダを狙い、我らは女神を守ることができなかった。{nl}女神をさらった魔族どもはおとなしかったフェレット族まで凶暴化させて、我らを苦しめ続けているのだ。{nl}	이 와중에 가장 급한 문제는 온순했던 페릿 부족마저 난폭하게 돌변했다는 걸세.{nl}힘을 합쳐 납치 당한 라다 여신을 구하고 싶지만 난폭해진 페릿 부족이 마을을 습격하고{nl}식량까지 훔쳐가는 통에 마을 사람들 모두 괴로워하고 있네.{nl}아무래도 이 근처 페릿 부족 근거지에 마족이 세운 마족 토템이 페릿 부족을 난폭하게 만든 것 같네..{nl}	마을 촌장
QUEST_UNUSED_20151102_002569	きっと我らが魔族に騙されて作った魔族のトーテムのせいだろう。{nl}力を合わせて女神ラダを救いたいが、フェレット族の攻撃のせいでどうにもできない。{nl}	아마 우리가 그 마족에게 속아서 세운 마족 토템 때문이겠지요.{nl}힘을 합쳐 라다 여신을 구하고 싶지만 페릿 부족의 공격 때문에 어쩌질 못하고 있어요.{nl}	QUEST_UNUSED_20151022_001243	凶暴化したフェレットは村を襲い、人を傷つけて食糧まで奪っていく。{nl}フェレット族の本拠地には魔族が立てたトーテムがあるのだが、そのトーテムがフェレットを凶暴化させているらしいのだ。{nl}フェレット族の本拠地にある魔族のトーテムを破壊してくれないか？{nl}フェレット続さえ元に戻れば、この村もだいぶ楽になるはずだ。	페릿이 마족토템을 지키는 탓에 우리 힘으로는 마족 토템을 부수기가 어렵네.{nl}마을을 위해서 자네가 마족 토템을 부숴 줄 수 있겠나?{nl}그렇다면 우리도 라다 여신을 구하기 위해 힘을 보탤 수 있을 것 같네.{nl}빛과 함께 마을을 구하러 온 자네라면 분명 페릿 부족 역시 되돌릴 수 있을걸세.	마을 촌장
QUEST_UNUSED_20151102_002570	フェレット族の攻撃をかいくぐったとしても、あのトーテムも魔気のせいで{nl}我々では近寄ることすらできずにいる。{nl}しかし、君が真の啓示者ならば、神聖な力であのトーテムを壊せるはずだ。{nl}	그 토템 또한 사악한 기운 때문에 가까이 갈 엄두도 못 내고 있어요.{nl}하지만 당신이 진정 계시자라면 신성한 힘으로 그 토템을 부술 수 있겠지요.{nl}	마을 촌장
QUEST_UNUSED_20151102_002571	証明してくれないかね。{nl}君が真の啓示者だということを…。	보여주세요. {nl}당신이 진짜 계시자라는 것을..	마을 촌장
