QUEST_UNUSED_20151022_001727	移住民飯縄は巨大なモンスターのため汲む森の中に孤立した北地域移住民を助けるために3/4地域の憩い場たき火をつけてくれと言ってしました	이주민 이즈나는 거대한 몬스터 때문에 길을 숲 속에 고립된 북쪽 지역 이주민들을 돕기 위해 3/4 지역의 쉼터 모닥불을 켜달라고 했습니다	
QUEST_UNUSED_20151022_001728	憩い場薪のやまにたきつける	쉼터 장작더미에 불 지피기	
QUEST_UNUSED_20151022_001729	移住民飯縄は憩い場薪のやまにたきつけて遠い所にいる移住民が見られるようにしてくれとお願いしました	이주민 이즈나는 쉼터 장작더미에 불을 지펴서 먼 곳에 있는 이주민들이 볼 수 있도록 해 달라고 부탁했습니다	
QUEST_UNUSED_20151022_001730	ウッドスピリット退治	우드스피릿 처치	
QUEST_UNUSED_20151022_001731	移住民ダラナスはあなたの冒険を祝福してくれました。そしてジェミナ女神像に祈りを捧げて女神の加護を受けるよう助言されました。	이주민 달라나스는 당신의 모험을 축복해주었습니다. 그리고 제미나 여신상에 경배하여 여신의 가호를 받아보라고 조언해주었습니다	
QUEST_UNUSED_20151022_001732	臨時休憩所のモンスター退治	임시 휴식처의 몬스터 처치	
QUEST_UNUSED_20151022_001733	移住民ダルラナスは移住民がオルシャに入って行くために待機した臨時休息所がこの間からモンスターの出没で危なくなったと言います。臨時休息所のモンスターを処理してくれましょう	이주민 달라나스는 이주민들이 오르샤로 들어가기 위해 대기하던 임시 휴식처가 얼마 전부터 몬스터들의 출몰로 위험해졌다고 합니다. 임시 휴식처의 몬스터들을 처리해 줍시다	QUEST_UNUSED_20150729_000346	進行	진행	
QUEST_UNUSED_20151022_001734	移住民ダルラナスは臨時休息所に散らばっている移住民を連れて来てくれと言ってお願いしました	이주민 달라나스는 임시 휴식처에 흩어져 있는 이주민들을 데리고 와달라고 부탁했습니다	QUEST_UNUSED_20151016_000883	移住民ダルラナスは周辺に散らばっている移住民を連れてワダラとお願いしました	이주민 달라나스는 주변에 흩어져 있는 이주민들을 데리고 와다라라고 부탁했습니다	
QUEST_UNUSED_20151022_001735	このネッサヘモンデイルと話し合ってください	이네사 해먼데일과 대화하세요	
QUEST_UNUSED_20151022_001736	女神像に敬排して見てください	여신상에 경배해보세요	
QUEST_UNUSED_20151022_001737	雑貨商人と対話	잡화상인과 대화	
QUEST_UNUSED_20151022_001738	雑貨商人と話し合ってください	잡화상인과 대화하세요	
QUEST_UNUSED_20151022_001739	アクセサリ商人と話してください。	악세서리 상인과 대화하세요	
QUEST_UNUSED_20151022_001740	重ね橋の森の情報員チェラシアと話す	정보원 체라시아와 대화	
QUEST_UNUSED_20151022_001741	情報院チェラシアと話し合ってください	정보원 체라시아와 대화하세요	
QUEST_UNUSED_20151022_001742	司祭イルマのメモのページ収集	사제 이르마의 쪽지 낱장 수집	
QUEST_UNUSED_20151022_001743	周辺モンスターを片付けて師弟イルマのメッセージ一枚一枚を収集してください	주변 몬스터들을 처치하여 사제 이르마의 쪽지 낱장을 수집하세요	
QUEST_UNUSED_20151022_001744	情報員モレンと会話	정보원 모렌과 대화	
QUEST_UNUSED_20151022_001745	開始情報院モレンと話し合ってください	시작정보원 모렌과 대화하세요	
QUEST_UNUSED_20151022_001746	モレン周辺モンスター処置	모렌 주변 몬스터 처치	
QUEST_UNUSED_20151022_001747	情報院モレンが収集した情報を分析する間保護してください。周辺モンスターを処理するほどモレンが安心してさらに早く情報を分析することができます	정보원 모렌이 수집한 정보를 분석하는 동안 보호해 주세요. 주변 몬스터들을 처리할 수록 모렌이 안심하고 더 빨리 정보를 분석할 수 있습니다	
QUEST_UNUSED_20151022_001748	情報院モレンと話し合ってください	정보원 모렌과 대화하세요	
QUEST_UNUSED_20151022_001749	半分燃えたメモ収集	반쯤 타버린 쪽지 수집	
QUEST_UNUSED_20151022_001750	半分燃えたメモを集めてください	반쯤 타버린 쪽지를 수집하세요	
QUEST_UNUSED_20151022_001751	追跡者イェウリスと会話	추적자 예울리스와 대화	
QUEST_UNUSED_20151022_001752	追跡者イェウリスに会いに行ってください。	추적자 예울리스와 대화하세요	
QUEST_UNUSED_20151022_001753	司祭を確認	사제들의 은거지 확인	
QUEST_UNUSED_20151022_001754	司祭を確認してください	사제들의 은거지를 확인하세요	
QUEST_UNUSED_20151022_001755	謎の日誌の内容を確認	우르보나스의 일지 습득	
QUEST_UNUSED_20151022_001756	失踪した司教ウルボナスの日誌を発見しました。追跡者イェウリスに届けましょう。	사제들의 은신처에서 우르보나스의 일지를 발견했습니다. 주워서 추적자 예울리스에게 전해줍시다	
QUEST_UNUSED_20151022_001757	ミノタウロス退治	미노타우르스 처치	
QUEST_UNUSED_20151022_001758	追跡者タルバーシと話す	추적자 탈바시와 대화	
QUEST_UNUSED_20151022_001759	パウフィスの渡し場にいる追跡者タルバーシを探してください	파우피스 나루에 있는 추적자 탈바시를 찾아가세요	
QUEST_UNUSED_20151022_001760	情報員ペルニフと話す	정보원 페르니프와 대화	
QUEST_UNUSED_20151022_001761	情報員ペルニフと話してください。	정보원 페르니프와 대화하세요	
QUEST_UNUSED_20151022_001762	地域 モンスター退治	지역 몬스터 처치	QUEST_UNUSED_20150729_000346	進行	진행	
QUEST_UNUSED_20151022_001763	情報員ペルニフは他の情報員たちの調査を手伝っているそうです。ズブカの中庭にいるモンスターを退治してください。	정보원 페르니프는 1/2번 지역의 몬스터를 처치해달라고 부탁했습니다	QUEST_UNUSED_20150729_000346	進行	진행	
QUEST_UNUSED_20151022_001764	ラペザード退治	라페자드 처치	QUEST_JOBSTEP_20150323_002333	Defeat %s	%s 처치	
QUEST_UNUSED_20151022_001765	ラペマイター退治	라페마이터 처치	QUEST_JOBSTEP_20150323_002333	Defeat %s	%s 처치	
QUEST_UNUSED_20151022_001766	臭い荷車を処理	악취나는 수레 처리	
QUEST_UNUSED_20151022_001767	情報員ペルニフはきちんと処理をしていないモンスターの死骸から放たれる悪臭のせいで、他のモンスターがさらに興奮していると言います。ズブカの中庭にある臭い荷車を燃やしてください。	정보원 페르니프는 1/2번 지역의 냄새나는 수레를 불태워서 없애달라고 부탁했습니다	QUEST_UNUSED_20150729_000346	進行	진행	
QUEST_UNUSED_20151022_001768	追跡者ゲルメイヤと話す	추적자 게르메이야와 대화	
QUEST_UNUSED_20151022_001769	追跡者ゲルメイヤと話してください。	추적자 게르메이야와 대화하세요	
QUEST_UNUSED_20151022_001770	モンスター 誘引剤を使う	몬스터 유인제 사용	
QUEST_UNUSED_20151022_001771	追跡者ゲルメイヤはモンスターを興奮させてお互いを攻撃するようにさせる薬をくれるそうです。モンスター刺激薬をモンスターに使ってみてください。	추적자 게르메이야는 일손이 부족하니 몬스터들끼리 영역다툼을 일으켜보자고 합니다	QUEST_UNUSED_20150729_000346	進行	진행	
QUEST_UNUSED_20151022_001772	追跡者ライティスと話す	추적자 라이티스와 대화	
QUEST_UNUSED_20151022_001773	追跡者ライティスと話してください。	추적자 라이티스와 대화하세요	
QUEST_UNUSED_20151022_001774	追跡者ライティスから、4番地域の通路に現れるモンスターを退治してほしいと頼まれました。	추적자 라이티스는 4번 지역 통로에 나타나는 몬스터들을 처리해달라고 부탁했습니다	
QUEST_UNUSED_20151022_001775	モンスター群落を破壊	몬스터 군락지 파괴	
QUEST_UNUSED_20151022_001776	モンスター群落を破壊してください	몬스터 군락지를 파괴하세요	
QUEST_UNUSED_20151022_001777	襲いかかるチェイファー退治	급습한 체이퍼 처치	
QUEST_UNUSED_20151022_001778	追跡者タルバーシと話してください。	추적자 탈바시와 대화하세요	
QUEST_UNUSED_20151022_001779	司祭ゲリヤのメモ収集	사제 겔리야의 쪽지 수집	
QUEST_UNUSED_20151022_001780	周辺のモンスターを退治して司祭ゲリヤのメモを集めてください	주변 몬스터들을 처치하여 사제 겔리야의 쪽지를 수집하세요	QUEST_UNUSED_20150729_000346	進行	진행	
QUEST_UNUSED_20151022_001781	司祭ゲリヤのメモ	사제 겔리아의 쪽지	
QUEST_UNUSED_20151022_001782	隠居地を捜索	은거지 수색	
QUEST_UNUSED_20151022_001783	追跡者タルバーシから、情報員ラレーナのところへ行く前に、最近発見された司祭たちの隠居地を捜索してほしいと頼まれました。	추적자 탈바시는 정보원 라레나에게로 가기 전에 얼마 전 발견된 사제들의 은거지를 수색해달라고 부탁했습니다.	
QUEST_UNUSED_20151022_001784	情報員ラレーナと話す	정보원 라레나와 대화	
QUEST_UNUSED_20151022_001785	情報員ラレーナと話してください。	정보원 라레나와 대화하세요	
QUEST_UNUSED_20151022_001786	司祭たちの痕跡を捜索	사제들의 흔적 수색	
QUEST_UNUSED_20151022_001787	情報員ラレーナは司祭たちが飼っていた犬と一緒に司祭の痕跡を探してほしいと言います。	정보원 라레나는 사제들이 기르던 개를 데리고 주변에서 사제들의 흔적을 찾아와 달라고 부탁했습니다	QUEST_UNUSED_20150729_000346	進行	진행	
QUEST_UNUSED_20151022_001788	追跡者センダルと話す	추적자 센달과 대화	
QUEST_UNUSED_20151022_001789	追跡者センダルと話してください。	추적자 센달과 대화하세요	
QUEST_UNUSED_20151022_001790	司祭プラナス救出	사제 프라나스 구출	
QUEST_UNUSED_20151022_001791	追跡者センダルは司祭プラナスと一緒にオタカラコウの丘を調べていたら、魔族を遭遇したそうです。魔族に捕らわれている司祭プラナスを救ってほしいと頼まれました。	추적자 센달은 마족에게 잡혀 위기에 처한 사제 프라나스를 구해달라고 부탁했습니다	
QUEST_UNUSED_20151022_001792	司祭プラナスと話す	사제 프라나스와 대화	
QUEST_UNUSED_20151022_001793	司祭プラナスと話してください。	사제 프라나스와 대화하세요	
QUEST_UNUSED_20151022_001794	司教ウルボナスの痕跡を探す	주교 우르보나스의 흔적 찾기	
QUEST_UNUSED_20151022_001795	司祭プラナスは司教ウルボナスの痕跡を探してオルシャに伝達してほしいと言っています。 プラナスは怪我が酷いので、オルシャへ先に帰りました。	사제 프라나스는 은거지에서 주교 우르보나스의 흔적을 찾아서 오르샤로 돌아와 달라고 부탁했습니다. 프라나스는 부상 때문에 오르샤로 먼저 돌아갔습니다	
QUEST_UNUSED_20151022_001796	情報員オルウェンと話す	정보원 오르웬과 대화	
QUEST_UNUSED_20151022_001797	情報員オルウェンと話してください。	정보원 오르웬과 대화하세요	
QUEST_UNUSED_20151022_001798	情報員オルウェンは捜索活動を妨害するモンスターを片付けてくれと言っています。	정보원 오르웬은 정보원들의 수색 활동 방해하는 몬스터들을 처치해달라고 부탁했습니다	QUEST_UNUSED_20150729_000346	進行	진행	
QUEST_UNUSED_20151022_001799	魔族の魔法陣を解体する	마족 마법진 해체	
QUEST_UNUSED_20151022_001800	情報員オルウェンは1/2地域に分布した魔族の魔法陣を解体してくれと言いました。	정보원 오르웬은 1/2 지역에 분포한 마족의 마법진을 해체해 달라고 부탁했습니다	QUEST_UNUSED_20150729_000346	進行	진행	
QUEST_UNUSED_20151022_001801	情報員ノトレスと話す	정보원 노토레스와 대화	
QUEST_UNUSED_20151022_001802	情報員ノトレスはオルシャに押し寄せる移住民たちを安全に移住させるため、事前に3番地域が安全かどうか確認しようとしています。その地域のモンスターが退治できる水準なのか調べてみましょう。	정보원 노토레스는 오르샤로 몰려오는 이주민들의 안전한 이주를 위해 사전에 3번지역이 안전한지 확인해보려고 합니다. 해당 지역의 몬스터들이 처치할 수 있는 수준인지 알아봐달라고 부탁했습니다.	
QUEST_UNUSED_20151022_001803	通路のモンスター退治	통로의 몬스터 처치	QUEST_JOBSTEP_20150323_002333	Defeat %s	%s 처치	
QUEST_UNUSED_20151022_001804	キャンプ地域を確認	캠프 지역 확인	
QUEST_UNUSED_20151022_001805	情報員ノトレスは移住民たちがオルシャに入れるまで4番地域のキャンプで休めるか確認したいそうです。4番キャンプ地域が安全かどうか確認してみましょう	정보원 노토레스는 이주민들이 오르샤로 향하는 동안 4번 장소의 캠프에서 쉬어도 좋을지 확인하고 싶다고 합니다. 4번 캠프 지역이 안전한지 확인해 봅시다	
QUEST_UNUSED_20151022_001806	情報員ノトレスと話してください。	정보원 노토레스와 대화하세요	
QUEST_UNUSED_20151022_001807	ボスモンスター退治	보스 몬스터 처치	QUEST_JOBSTEP_20150323_002333	Defeat %s	%s 처치	
QUEST_UNUSED_20151022_001808	汚染された血収集	오염된 피 수집	
QUEST_UNUSED_20151022_001809	情報員ノトレスは狂暴になったモンスターから魔族の兆しを捕捉したと言います。 モンスターを片付けて彼らの汚染した血を収集してノートレスに伝達しましょう。	정보원 노토레스는 광포해진 몬스터들로부터 마족의 징후를 포착했다고 합니다. 몬스터들을 처치하여 그들의 오염된 피를 수집해서 정보원 노토레스에게 전달합시다	QUEST_UNUSED_20150729_000346	進行	진행	
QUEST_UNUSED_20151022_001810	追跡者ゼガウスと会話	추적자 제가우스와 대화	
QUEST_UNUSED_20151022_001811	追跡者ゼガウスと話してください。	추적자 제가우스와 대화하세요	
QUEST_UNUSED_20151022_001812	追跡者ゼガウスに、負傷した自分たちのために周囲のモンスターを倒してくれと頼まれました。	추적자 제가우스는 부상당한 자신들을 위해 주변 몬스터를 처치해달라고 부탁했습니다	QUEST_UNUSED_20150729_000346	進行	진행	
QUEST_UNUSED_20151022_001813	追跡者たちの袋を回収	추적자들의 주머니 회수	
QUEST_UNUSED_20151022_001814	追跡者たちの袋を回収してください	추적자들의 주머니 회수하세요	QUEST_UNUSED_20150729_000346	進行	진행	
QUEST_UNUSED_20151022_001815	司祭プラナスがパウフィスの渡し場のアシャーク地下監獄入口であなたを待っています。	사제 프라나스가 파우피스 나루의 아샤크 지하 감옥 입구에서 당신을 기다리고 있습니다	
QUEST_UNUSED_20151022_001816	司祭プラナスを追う	사제 프라나스 따라가기	
QUEST_UNUSED_20151022_001817	司祭プラナスは仲間と一緒にアシャク地下監獄1階で先に進入すると言いました。 アシャク地下監獄1階で司祭プラナスに追いましょう。	사제 프라나스는 동료들과 함께 아샤크 지하 감옥 1층으로 먼저 진입하겠다고 말했습니다. 아샤크 지하 감옥 1층으로 사제 프라나스를 따라가세요	
QUEST_UNUSED_20151022_001818	司祭プラナスと話してください	사제 프라나스와 대화와 대화하세요	
QUEST_UNUSED_20151022_001819	呪いのトーテムを解除する方法を探す	저주 토템을 해제할 방법 찾기	
QUEST_UNUSED_20151022_001820	司祭プラナスから、呪いのトーテムを解除する方法を探してほしいと頼まれました。	사제 프라나스는 저주 토템을 해제할 방법을 찾아달라고 부탁했습니다	
QUEST_UNUSED_20151022_001821	呪いのトーテム 確認	저주 토템 확인	
QUEST_UNUSED_20151022_001822	周辺の魔族を十分に退治しました。呪いのトーテムを確認してみましょう	주변의 마족들을 충분히 처리했습니다. 저주토템을 다시 확인해 봅시다	
QUEST_UNUSED_20151022_001823	呪いのトーテム 破壊	저주 토템 파괴	
QUEST_UNUSED_20151022_001824	司祭プラナスは同じ方式で設置されている呪いトーテムを破壊してくれと言っています。	사제 프라나스는 같은 방식으로 우르보나스의 은거지로 가는 길에 설치되어 있는 저주 토템을 파괴해 달라고 부탁했습니다	
QUEST_UNUSED_20151022_001825	呪いのトーテムの破片除去	저주 토템 파편 제거	
QUEST_UNUSED_20151022_001826	司祭プラナスが処理してほしいと頼んだ呪いのトーテムはすでに誰かの手で破壊されていました。でもその破片はまだ作動しているようです。呪いのトーテムの破片を除去してください	사제 프라나스가 처리해달라고 부탁한 저주 토템이 이미 누군가에 의해 파괴되어 있습니다. 하지만 그 파편들이 아직 작동하는 것 같습니다. 저주 토템의 파편들을 제거하세요	
QUEST_UNUSED_20151022_001827	呪いのトーテムを確認してください	저주 토템 확인을 확인하세요	
QUEST_UNUSED_20151022_001828	トーテムを守るボスモンスター退治	토템을 지키는 보스몬스터 처치	QUEST_UNUSED_20150729_000346	進行	진행	
QUEST_UNUSED_20151022_001829	司祭プラナスから依頼されたトーテムを破壊しようとするとトーテムを守っているボスモンスターが現れました。とりあえず、先に倒してください。	사제 프라나스가 부탁한 저주 토템을 파괴하는 중 토템을 지키려하는 보스몬트서가 나타났습니다	
QUEST_UNUSED_20151022_001830	ウルボナスと話す	우르보나스와 대화	
QUEST_UNUSED_20151022_001831	ウルボナスと話してください。	우르보나스와 대화와 대화하세요	
QUEST_UNUSED_20151022_001832	ウルボナスと話してください。	우르보나스와 대화하세요	
QUEST_UNUSED_20151022_001833	司教ウルボナスは、同じ宗派だと言うならその魔法陣に乗って証明してみなさいと言います。	주교 우르보나스는 그의 교단에서 계시자를 위해 준비한 마법진에 올라가서 계시자임을 확인해보라고 했습니다	
QUEST_UNUSED_20151022_001834	追撃者トルヴァナと話す	추적자 토르바나와 대화	
QUEST_UNUSED_20151022_001835	赤い結晶収集	붉은 결정 수집	
QUEST_UNUSED_20151022_001836	追跡者トルヴァナは領主直属情報隊員の助けになるよう魔族が使う赤い結晶を収集してくれと言っています。	추적자 토르바나는 영주 직속 정보대원들에게 도움을 주기 위해 마족들이 사용하는 붉은 결정을 수집해달라고 부탁했습니다	QUEST_UNUSED_20150729_000346	進行	진행	
QUEST_UNUSED_20151022_001837	追撃者トルヴァナと話してください。	추적자 토르바나와 대화와 대화하세요	
QUEST_UNUSED_20151022_001838	黒い木の欠片収集	검은 나무 조각 수집	
QUEST_UNUSED_20151022_001839	追跡者トルヴァナは領主直属情報隊員に依頼した黒い木切れを収集してくれと言っています。	추적자 토르바나는 영주 직속 정보대에서 의뢰한 검은 나무 조각을 수집해달라고 부탁했습니다	QUEST_UNUSED_20150729_000346	進行	진행	
QUEST_UNUSED_20151022_001840	追撃者ダラマウスと話す	추적자 다라마우스와 대화	
QUEST_UNUSED_20151022_001841	魔族の包み獲得	마족 꾸러미 습득	
QUEST_UNUSED_20151022_001842	追撃者ダラマウスは領主直属の情報隊の依頼で魔族が使っている物を調査しなければならないそうです。魔族を退治して魔族の包みを手に入れてください。	추적자 다라마우스는 영주 직속 정보대의 의뢰로 마족들이 사용하는 물건들을 조사해봐야 겠다고 합니다. 마족을 처치하여 마족 꾸러미를 습득하세요	
QUEST_UNUSED_20151022_001843	魔族の包みを調べる	마족 꾸러미 조사	
QUEST_UNUSED_20151022_001844	追撃者ダラマウスに依頼された通り、魔族の包みを集めました。魔族の包みを使ってみて、その効果をダラマウスに伝えましょう	추적자 다라마우스가 의뢰한 대로 마족 꾸러미를 충분히 모았습니다. 마족 꾸러미를 사용해보고 그 효롸를 다라마우스에게 알려줍시다	
QUEST_UNUSED_20151022_001845	追撃者ダラマウスと話してください。	추적자 다라마우스와 대화와 대화하세요	ETC_20150317_001977	Complete	완료	
QUEST_UNUSED_20151022_001846	司祭プラナスを追ってアシャーク地下監獄 2階へ行ってください	사제 프라나스를 따라 아샤크 지하 감옥 2층으로 가세요	
QUEST_UNUSED_20151022_001847	司祭プラナスはアシャーク地下監獄2階に設置されている呪いトーテムを破壊してくれと言っています。	사제 프라나스는 아샤크 지하 감옥 2층에 설치되어 있는 저주 토템을 파괴해달라고 부탁했습니다	
QUEST_UNUSED_20151022_001848	司祭イルマ救出	사제 이르마 구출	
QUEST_UNUSED_20151022_001849	司祭プラナスは3番区域に孤立してしまった司祭イルマを救出してくれと言っています。	사제 프라나스는 3번 구역에 고립된 사제 이르마를 구출해달라고 부탁했습니다	
QUEST_UNUSED_20151022_001850	司祭イルマと話してください。	사제 이르마와 대화와 대화하세요	
QUEST_UNUSED_20151022_001851	監視トーテム破壊	감시 토템 파괴	
QUEST_UNUSED_20151022_001852	司祭イルマは監視トーテムを破壊することで魔将マルノックスの注意を引きアシャーク地下監獄3階の魔族指令書を回収しに行こうと言います。 監視トーテムを破壊してください。	사제 이르마는 감시 토템을 파괴하여 마군주 마르녹스의 관심을 다른 곳으로 돌리고 아샤크 지하 감옥 3층의 마족 지령서를 회수하러 가자고 합니다. 감시 토템을 파괴하세요	
QUEST_UNUSED_20151022_001853	司祭イルマは監視トーテムを破壊することで魔将マルノックスの注意を引きアシャーク地下監獄3階の魔族指令書を回収しに行こうと言います。 2つ目の監視トーテム周辺の不安定な魔石を収集して監視トーテムにくっつけて破壊してください。	사제 이르마는 감시 토템을 파괴하여 마군주 마르녹스의 관심을 다른 곳으로 돌리고 아샤크 지하 감옥 3층의 마족 지령서를 회수하러 가자고 합니다. 두 번째 감시토템 주변의 불안정한 마석을 수집하여 감시 토템에 부착하여 파괴하세요	
QUEST_UNUSED_20151022_001854	ゲリヤと話す	겔리야와 대화	
QUEST_UNUSED_20151022_001855	ゲリヤと話してください。	겔리야와 대화와 대화하세요	
QUEST_UNUSED_20151022_001856	司祭アウラナスと話す	사제 아우라나스와 대화	
QUEST_UNUSED_20151022_001857	司祭アウラナスと話してください。	사제 아우라나스와 대화와 대화하세요	
QUEST_UNUSED_20151022_001858	きらめく真珠の粉を集める	반짝이는 진주가루 수집	
QUEST_UNUSED_20151022_001859	司祭アラニスは司教ウルボナスの指示でアシャーク地下監獄に様々な非常物資を用意しておいたそうです。監視塔へ行ってアラニスが用意したきらめく真珠の粉を取って来てください。	사제 아우라나스는 우르보나스의 요청으로 오늘과 같은 일이 일어날 때를 대비하여 아샤크 지하 감옥을 맡아서 각종 함정과 물품들을 준비해 왔다고 합니다. 아우라나스가 준비해둔 반짝이는 진주가루를 1번 지역에서 수집해오면 마족들을 처리하는 데 유용한 물건을 만들어 준다고 합니다	
QUEST_UNUSED_20151022_001860	宝珠が示す魔族退治	마족 처리	
QUEST_UNUSED_20151022_001861	司祭アラニスはこの宝珠を使えば、序列の高い魔族を発見できるはずだと言います。宝珠を使って宝珠が示す魔族を退治してください。	사제 아우라나스는 진주로 만든 보주를 사용하면 마족들 중에서 서열이 높은 마족을 발견할 수 있을 거라고 합니다. 진주로 만든 보주를 사용하면 서열 높은 마족과 부하 마족의 영혼을 묶을 수 있으며 서열 높은 마족을 처리하면 부하 마족도 동시에 처리할 수 있을 거라고 합니다	
