QUEST_UNUSED_20151022_001004	アンタナスさんに頼まれて来たんですよね？{nl}ずいぶんと細かい注文で…苦労しましたよ。{nl}	안타나스씨가 보내서 온 건가?{nl}어휴, 그 아저씨 어찌나 주문이 까다로운지..{nl}	QUEST_LV_0200_20151016_009685	So Antanas sent you.{nl}Here's the hammer.	안타나스가 보내서 오신 분이군요.{nl}여기 주문해 두신 망치가 있습니다.	대장장이
QUEST_UNUSED_20151022_001005	私以外あんな注文を受ける人はいませんよ。{nl}神聖な呪文を刻みたいようですね？	나니까 그 주문을 받은 거야.{nl}자. 여기 망치. 신성한 주문을 새길 건가 보지?	QUEST_LV_0200_20151001_009191	{nl}Hmm...	{nl}흠..	대장장이
QUEST_UNUSED_20151022_001006	石のみですか？{nl}あぁ…それはアンタナスさんの注文に合わせられない部分があったので、他の人に任せました。{nl}	정?{nl}아아. 그건 그 아저씨 주문에 도저히 맞출 수가 없는 부분이 있어서 따로 맡겼어.{nl}	QUEST_LV_0100_20151016_009623	Pill?{nl}You should be able to get that from the equipment merchant.	정?{nl}그건 장비상인에게 있을 겁니다.	대장장이
QUEST_UNUSED_20151022_001007	ユルラを訪ねてみてください。{nl}装備商店で働いています。	율라를 찾아가 봐.{nl}그 아이는 장비 상점에서 일하고 있어.	대장장이
QUEST_UNUSED_20151022_001008	またな。{nl}これから修理はここでしてくれよ、お客さん。	나중에 또 봐.{nl}앞으로 수리는 꼭 여기서 하실거죠, 손님?	QUEST_LV_0100_20151016_009624	Take care on the long road ahead.	먼 길 조심하세요.	대장장이
QUEST_UNUSED_20151022_001009	いらっしゃいませ！{nl}オルシャ一の装備商店ですよ！{nl}	어서 오세요! {nl}오르샤 제일의 장비 상점입니다!{nl}	QUEST_LV_0100_20151016_009625	Yes. I've prepared the pill you've requested.{nl}Farewell.	네. 주문해 두셨던 정은 준비해 두었습니다.{nl}그럼 안녕히 가세요.	장비 상인 율라
QUEST_UNUSED_20151022_001010	石のみですか？{nl}あ、イルラナイさんが注文したもののことでしょうか？{nl}	정이요?{nl}아, 일라나이 언니가 맡긴 것 말씀이신가요?{nl}	QUEST_LV_0100_20151001_008386	{nl}Well, I just bought some old chisels from other Revelators... {nl}If you need, you can take one of it. 	{nl}마침 내구도가 다 떨어져서 다른 계시자들이 팔고 간 낡은 정들이 있으니..{nl}이거라도 한 개 가져가면 될 거예요.	장비상인
QUEST_UNUSED_20151022_001011	さあ、どうぞ。{nl}このようなものを注文されるのを見ると、女神への信仰心が深い方のようですね。	자, 받으세요.{nl}이런 걸 주문하신 걸 보면 여신의 신앙이 돈독하신 모양이시네요.	장비 상인 율라
QUEST_UNUSED_20151022_001012	石のみは私ではなくユルラに任せました。{nl}ユルラは装備商人です。	정은 내가 아니라 율라에게 맡겨 두었다구.{nl}장비 상점에서 점원으로 일하고 있어.	QUEST_LV_0100_20151016_009626	Have you retrieved the pill?	정은 구하셨어요?	대장장이
QUEST_UNUSED_20151022_001013	おお、注文通りにちゃんと作られているな。{nl}これで仕事を始められるぞ。	오, 주문대로 정말 잘 만들어 왔구먼.{nl}이제 일을 시작할 수 있겠어.	QUEST_LV_0100_20151001_008388	Oh, you got them all. 	오, 모두 구해왔구먼.	안타나스
QUEST_UNUSED_20151022_001014	えっと、他にご注文はありますか？{nl}見るだけでも大丈夫なので、また来てくださいね。	앗, 또 주문하실 것이 있으신가요?{nl}구경만 하셔도 좋으니까 자주 찾아 주세요.	장비 상인 율라
QUEST_UNUSED_20151022_001015	石のみは見つかりましたか？{nl}これからもこういった特別注文は大歓迎です。よろしくお願いしますね。	정은 찾은 거야?{nl}앞으로도 이런 주문은 환영하니까 잘 부탁해.	QUEST_LV_0100_20151016_009627	Now go.	어서 가 보시오.	대장장이
QUEST_UNUSED_20151022_001016	あなたはどう思いますか？{nl}信仰は違くても、魔族を滅ぼすことが重要だと考えるなら、私たちに協力してほしいのです。	당신은 어떻게 생각하세요?{nl}뜻은 달라도 마족을 뿌리뽑는 게 중요하다 생각하시면 저희를 도와주시는 건 어떠신지요.	알비나스
QUEST_UNUSED_20151022_001017	今、汚染された碑石は一つや二つじゃありません。{nl}私はこれを壊すので、あなたはウサスの丘にある汚染された碑石を破壊してください。{nl}	우선 오염된 비석은 한 두개가 아니에요.{nl}저는 이걸 부숴버릴 테니, 당신은 우사스 언덕에 있는 오염된 비석을 파괴해 주세요.{nl}	QUEST_LV_0100_20151016_009637	There are more than a few defiled tombstones.{nl}I shall destroy this one, so you go and destroy the tombstones over there.{nl}	우선 오염된 비석은 한 두개가 아니에요.{nl}저는 이걸 부숴버릴 테니, 당신은 저쪽의 오염된 비석을 파괴해 주세요.{nl}	알비나스
QUEST_UNUSED_20151022_001018	きっとその碑石も赤い気を放っているはずです。{nl}横の碑石のように。汚染されている証拠ですよ。	아마 그 비석도 붉은 기운을 뿜어 내고 있을 겁니다.{nl}옆에 있는 비석처럼요. 오염의 증거이지요.	QUEST_LV_0100_20151016_009638	That tombstone over there should also be glowing red.{nl}Just like the tombstone next to you. It's evidence that it has been defiled.	아마 저 쪽의 비석도 붉은 기운을 뿜어 내고 있을 겁니다.{nl}옆의 비석처럼요. 오염의 증거이지요.	알비나스
QUEST_UNUSED_20151022_001019	アルビナス？アナストス派の一員？？？{nl}そんなはずはありません。{nl}	기도 안 차는구먼.{nl}알비나스? 아나스토스 파의 일원이라고? {nl}그럴리가 없는데?{nl}	QUEST_LV_0100_20151016_009644	I am at a loss for words.{nl}Albinas? A member of the Anastos? It can't be!{nl}	기도 안 차는구먼.{nl}알비나스? 아나스토스 파의 일원이라고? 그럴리가 없는데?{nl}	다미요나스
QUEST_UNUSED_20151022_001020	私がアナストス派の全員を知ってるわけではありませんが…{nl}同じ教団ですから、彼らのことはよく知っています。{nl}	내가 아나스토스파의 모든 사람을 아는 건 아니지만..{nl}같은 교단 사람인지라 그들과는 원래 잘 아는 사이란 말이오.{nl}	QUEST_LV_0100_20151016_009645	Bring him to me! {nl}I must see for myself!	그 사람을 데려오시오! {nl}당장 확인 해 봐야겠소!	다미요나스
QUEST_UNUSED_20151022_001021	あんたじゃ埒が明かない。その人を連れて来てください！{nl}私が直接確かめますから！	안되겠어, 당장 그 사람을 데려오시오! {nl}내 직접 확인해야겠어!	다미요나스
QUEST_UNUSED_20151022_001022	使えそうな石材を手に入れて向こうのネストスキャンプにいるエデュナスを訪ねてください。{nl}彼が修復用の石材に加工してくれるはずです。{nl}	적당한 석재를 구해서 네스토스파의 캠프에 있는 에뒤나스에게 찾아가시오.{nl}그가 복구용 석재로 다듬어 줄 거요.{nl}	QUEST_LV_0100_20151016_009648	Obtain some suitable stone blocks and go find Eduinas at the Nestos Camp over there.{nl}	적당한 석재를 구해서 저 쪽 네스토스 캠프에 있는 에뒤나스에게 찾아가시오.{nl}	다미요나스
QUEST_UNUSED_20151022_001023	あなたが碑石を壊したことを知れば、エデュナスが怒り狂うでしょうけどね。{nl}責任を取るって言ったからには、それくらい覚悟の上ですもんね？	하지만 당신이 비석을 이렇게 만들었다는 걸 알면 에뒤나스가 길길이 날뛰겠지.{nl}책임을 지려면 그 정도는 감수해야 할 게요.	QUEST_LV_0100_20151016_009649	Eduinas will not be happy if he knows that you've done this to the tombstone.{nl}Get ready to take responsibility for that at the very least.	당신이 비석을 이렇게 만들었다는 걸 알면 에뒤나스가 길길이 날뛰겠지.{nl}책임을 지려면 그 정도는 감수하시오.	다미요나스
QUEST_UNUSED_20151022_001024	…ちょっと。あなたの顔を見ているとムカムカして。{nl}資材を削る間、この辺りで暴れまわるモンスターでも倒していてくれません？	자재를 다듬을 동안만이라도 당신 얼굴은 보고싶지 않네요.{nl}이 주변을 어지럽히는 몬스터나 정리해 주시던가요.	QUEST_LV_0100_20151016_009654	I don't want to see you while I get the materials ready.{nl}Go and clear the area of monsters or something.	자재를 다듬을 동안 당신 얼굴은 보고싶지 않네요.{nl}이 주변을 어지럽히는 몬스터나 정리해 주시던가요.	에뒤나스
QUEST_UNUSED_20151022_001025	…できていますよ。{nl}もう二度と、二度と！壊すなんてことがないように！	다 됐으니 이걸 가지고 다미요나스에게 돌아가 보세요.{nl}이젠 다시는, 절대로 그러지 마세요.	QUEST_LV_0100_20151016_009656	All done. {nl}Now, don't do that ever again.	다 됐네요. {nl}이젠 다시는, 절대로 그러지 마세요.	에뒤나스
QUEST_UNUSED_20151022_001026	持って来られましたか。では、修理しますよ。{nl}破損がこの程度で済んで良かったんじゃないですか。	구해 왔군. 이제 복구를 시작하겠소.{nl}파손 정도가 심하지 않아서 이 정도로 끝난 게 다행이군.	QUEST_LV_0100_20151016_009657	You've gathered the neccessary items. Let's see if we can repair it.{nl}It's lucky that it wasn't damaged too badly.	구해 왔군. 이제 수리해 보세나.{nl}파손 정도가 심하지 않아서 이 정도로 끝난 게 다행이군.	다미요나스
QUEST_UNUSED_20151022_001027	私たちとアナストス派は意見が少し違うだけで、お互いを敵視しているわけではないんです。{nl}ですが、聞いたことも無い名前が飛び出して来れば疑いますよね。{nl}	우리와 아나스토스파와는 그저 의견이 좀 다를 뿐이지 서로를 적대시하던가 하는 일은 없소.{nl}그런데 알지도 못하는 이름이 튀어나오니 의심하는 것이 당연하지 않겠소?{nl}	QUEST_LV_0100_20151016_009658	We've never had any trouble with Anastos, just some different opinions.{nl}We have to be suspicious since we've heard a name that we know nothing about.{nl}	우리와 아나스토스파와는 그저 의견이 좀 다를 뿐이지 서로를 적대시하던가 하는 일은 없네.{nl}그런데 알지도 못하는 이름이 튀어나오니 의심하는 것이 당연하지 않겠나.{nl}	다미요나스
QUEST_UNUSED_20151022_001028	しかも、苦労して建てた碑石を壊されたんですから。{nl}ともかく、再建をしっかりとやり遂げてくださいましたから、もう勘弁して差し上げます。	게다가 힘들게 세운 비석을 부숴버렸으니 말이오.{nl}어쨌든 책임을 졌으니 일단 이 정도로 용서하겠소.{nl}	QUEST_LV_0100_20151016_009659	Especially since they've destroyed the tombstone that we've barely managed to craft.{nl}We'll forgive them since they've taken responsibility.{nl}	게다가 힘들게 세운 비석을 부숴버렸으니 말일세.{nl}어쨌든 책임을 졌으니 일단 이 정도로 용서하지.{nl}	다미요나스
QUEST_UNUSED_20151022_001029	あなたもこのままでは納得できないでしょう？{nl}向こうにアナストス派のキャンプがあるから、一度行ってみてはいかがです？{nl}何だか…イヤな予感がするんですよね…。	자네도 이대로 넘어가기엔 억울하지 않소?{nl}저 위에 아나스토스파의 캠프가 있었으니 한 번 가서 물어나 보시오.{nl}정말 이상해..	QUEST_LV_0100_20151016_009661	Aren't you dejected to go like this?{nl}Anastos has their camp up there so why don't you go ask them.This is strange...	자네도 이대로 넘어가기엔 억울하지 않겠나.{nl}저 위에 아나스토스파의 캠프가 있었으니 한 번 가서 물어나 보게.{nl}정말 이상해..	다미요나스
QUEST_UNUSED_20151022_001030	ええ、私はアナストス派の…そうです。{nl}アルビナス？いや、あのちょっと…。{nl}	예, 제가 아나스토스의.. 맞습니다.{nl}뭘 물어보러 오셨다고요?{nl}	QUEST_LV_0100_20151016_009662	Yes, of Anastos... that is correct.{nl}You've come here to ask about something?{nl}Oh dear, I am quite flustered at the moment so it's a bit difficult to answer anything..{nl}	예, 제가 아나스토스의.. 맞습니다.{nl}뭘 물어보러 오셨다고요?{nl}아이고, 지금 제가 정신이 없어서 뭐든 물어보셔도 답해 드리기가 좀..{nl}	게다스
QUEST_UNUSED_20151022_001031	すみません、今ちょっと取り込み中でして…。{nl}私の研究資料がモンスターに…取り返してきていただけないですか？話はそれからです。	아이고, 지금 제가 정신이 없어서 뭐든 물어보셔도 답해 드리기가 좀..{nl}제 연구 자료를 되찾아 주시면 여유가 생길지도..	QUEST_LV_0100_20151016_009663	We might get a break if you can manage to retrieve the research materials that I'm looking for.	제가 찾고 있는 연구 자료를 되찾아 주시면 여유가 생길지도 모르겠습니다.	게다스
QUEST_UNUSED_20151022_001032	女神だけを盲目的に信仰するよりも、魔族の退治や災いに備える暮らし…。{nl}そういうものを重視すべきだと考えているんです。{nl}	여신만을 향한 맹목적인 신앙 보다는 마족 퇴치, 재앙에 대비하는 삶.. {nl}그런 것들 위주로 말이에요.{nl}	QUEST_LV_0100_20151016_009674	Focusing on defeating demons and preparing for calamities.. {nl}More than simply devout faith in the goddesses.{nl}	여신만을 향한 맹목적인 신앙 보다는 마족 퇴치, 재앙에 대비하는 삶.. {nl}그런 것들 위주로 나야가야 한다고 말입니다.{nl}	게다스
QUEST_UNUSED_20151022_001033	何やらおかしいですね。{nl}我が宗派を名乗っている以上、きちんと調べる必要がありそうです。{nl}	이건 확실히 이상해요. {nl}동료를 보내서 알아 볼 필요가 있겠어요.	QUEST_LV_0100_20151016_009675	This is definitely strange. {nl}We'll need to send someone to investigate.{nl}	확실히 이상해요. {nl}이건 사람을 보내서 알아 볼 필요가 있겠어요.{nl}	게다스
QUEST_UNUSED_20151022_001034	雨も降っているので、もしもの危険に備えて炎弾を持たせようと思うんですが…。{nl}ちょうどいい物が無いんです。{nl}	아 그런데, 혹시 모를 위험에 대비해서 신호탄을 들려 보낼 건데요.{nl}적당한 게 없네요.{nl}	QUEST_LV_0100_20151016_009677	Get me some flamable powder.{nl}It won't be too difficult to find since there are always more than enough monsters.	불에 잘 타는 가루를 구해 주세요.{nl}몬스터들은 언제나 들끓으니까, 재료를 구하는 것은 어렵지 않을 거예요.	게다스
QUEST_UNUSED_20151022_001035	よく燃えそうな粉末を集めてもらえませんか？{nl}モンスターたちはどんどん集まってくるので、材料を集めるのは難しくないはずです。	불에 잘 타는 가루를 구해 주실 수 있을까요?{nl}몬스터들은 언제나 들끓으니까, 재료를 구하는 것은 어렵지 않을 거예요.	게다스
QUEST_UNUSED_20151022_001036	後は調査結果を待つだけですね。{nl}彼は有能なので、すぐに調べて来るはずです。	이제 조사 결과를 기다려보죠.{nl}유능한 친구이니 금방 알아올 거예요.	QUEST_LV_0100_20151016_009679	Now we'll have to wait for the results.{nl}He's a capable person, so it won't take too long.	이제 조사 결과를 기다려야겠습니다.{nl}유능한 친구이니 금방 알아올 거예요.	게다스
QUEST_UNUSED_20151022_001037	それまでじっと待っているのも何なので、我々も別のルートで調べるとしましょうか。{nl}	그 동안 가만히 있기 뭐하니 우리도 따로 알아보도록 할까요?{nl}	QUEST_LV_0100_20151016_009680	How about doing some investigation ourselves in the meanwhile.{nl}	그 동안 가만히 있기 뭐하니 우리도 따로 알아보지요.{nl}	게다스
QUEST_UNUSED_20151022_001038	そうそう。バルテなら何か知っているかもしれませんね。{nl}このキャンプに合流したばかりなんですよ。{nl}	그렇지. 바르테라면 뭔가 본 게 있을 지도 몰라요.{nl}우리 캠프에 합류한 지 얼마 안되었거든요.{nl}	QUEST_LV_0100_20151016_009681	Of course. Barte might know something.{nl}He hasn't been here too long and he's quite the knowledgeable chap.{nl}	그렇지. 바르테라면 뭔가 알고 있을지도 몰라요.{nl}우리 캠프에 합류한 지 얼마 안 된데다가 무척 박식한 청년이거든요.{nl}	게다스
QUEST_UNUSED_20151022_001039	彼女にアルビナスという人物について聞いてみてはどうでしょうか？{nl}	그녀에게 알비나스라는 사람에 대해 물어보고 오시면 어떨까요?{nl}	QUEST_LV_0100_20151016_009682	How about asking him about the person called Albinas?{nl}	그에게 알비나스라는 사람에 대해 물어보면 어떨까요?{nl}	게다스
QUEST_UNUSED_20151022_001040	アルビナス？{nl}うーん…あなたが言った背格好に似た人ならマジバ墓地で見かけましたよ。{nl}	알비나스요?{nl}음.. 당신이 말한 인상착의와 비슷한 사람을 마지바 묘지에서 보긴 했어요.{nl}	QUEST_LV_0100_20151016_009685	Albinas?{nl}Umm.. I did see a person that looks similar to what you've described.{nl}	알비나스요?{nl}음.. 당신이 말한 인상착의와 비슷한 사람을 보긴 했어요.{nl}	바르테
QUEST_UNUSED_20151022_001041	マジバ墓地に行けば、あの皮が残ってるかもしれません。{nl}私は…女神に行けと言われても、怖くて行けそうにありませんが…。	마지바 묘지에 다시 가면 그 가죽이 남아 있을지도 몰라요.{nl}전.. 여신께서 가라 하셔도 무서워서 도저히 못가겠네요.	바르테
QUEST_UNUSED_20151022_001042	一体どういうことなんでしょうか？{nl}あんな紋様を持っているのはヴァイガの手下以外にいないと思うんですが…。{nl}	도대체 이게 무슨 일이죠?{nl}저런 문양을 쓰는 건 바이가의 하수인 말곤 생각할 수 없어요.{nl}	QUEST_LV_0100_20151016_009696	What on earth could be happening.{nl}No one else uses such insignia unless they work for Baiga.{nl}	도대체 이게 무슨 일일까요.{nl}저런 문양을 쓰는 건 바이가의 하수인 말곤 생각할 수 없어요.{nl}	바르테
QUEST_UNUSED_20151022_001043	これは急いで他の人にも伝えなければなりません！{nl}あなたはゲダスに伝えてください！{nl}	이건 빨리 사람들에게 알려야 할 것 같아요.{nl}당신은 게다스에게 알려주세요!{nl}	QUEST_LV_0100_20151016_009697	We have to alert the others about this!{nl}You go tell Gedas!{nl}	이건 사람들에게 알려야 될 것 같아요!{nl}당신은 게다스에게 알려주세요!{nl}	바르테
QUEST_UNUSED_20151022_001044	どうか、ファビユスを助けてください！{nl}ああ、その前にネストス派のところへ寄った方がいいかもしれません！{nl}	제발, 파비유스를 구해 주세요!{nl}아, 그 전에 네스토스파에게 들르는 게 좋겠어요!{nl}	QUEST_LV_0100_20151016_009701	We must let everyone know!{nl}Please, notify Gedas!{nl}	서둘러서 파비유스에게 가 주세요!{nl}아, 그 전에 네스토스파에게 들르는 게 좋겠어요!{nl}	게다스
QUEST_UNUSED_20151022_001045	この聖水を持って行ってください。{nl}一度くらいは魔族に痛手を負わせられるはずです。	여기 성수, 이걸 가져가세요.{nl}한 번 정도는 마족에게 크게 본때를 보일 수 있을 겁니다.	QUEST_LV_0100_20151016_009704	It's dangerous to go alone, take this Holy Water.{nl}It can do one hell of damage.	여기 성수, 이걸 가져가세요.{nl}한 번 정도는 크게 한 방을 먹일 수 있을 겁니다.	에뒤나스
QUEST_UNUSED_20151022_001046	無事でしたか。{nl}アルビナスという人物…いや、魔族の正体についてはファビユスから聞きました。{nl}	무사하셨군요.{nl}알비나스라는 사람, 아니 그 마족의 정체는 파비유스에게 들었습니다.{nl}	QUEST_LV_0100_20151016_009705	Thank goodness, you are safe.{nl}Fabijus told me about who Albinas really was.{nl}	무사하셨군요.{nl}알비나스라는 사람, 아니 마족의 정체는 파비유스에게 다 들었습니다.{nl}	게다스
QUEST_UNUSED_20151022_001047	一体何を言っているんです？{nl}神聖な碑石をメチャクチャにしておいて、今更何ですって？いない？{nl}	그걸 지금 말이라고 하는 게요?{nl}멀쩡한 비석을 맘대로 부수고 이제와서 뭐? 없다고?{nl}	QUEST_LV_0100_20151016_009707	Are you hearing yourself right now?{nl}You have a lot of nerve coming back after breaking the stele.{nl}	그걸 지금 말이라고 하는 게요?{nl}멀쩡한 비석을 맘대로 부수고 이제와서 뭐?{nl}	다미요나스
QUEST_UNUSED_20151022_001048	まだ何か言いたいことがあるんですか？{nl}碑石のことで頭がいっぱいなので、もう話しかけないでくれませんか…。	뭘 더 말하라는 게요?{nl}비석 때문에 머리가 아프니 더 이상 말 걸지 마시오.	QUEST_LV_0100_20151016_009711	What do you want now?{nl}I am too busy figuring out how to restore the stele. Leave me alone.	뭘 더 말하라는 게요?{nl}비석 복구할 궁리 중이니 더 말 걸지 마시오.	다미요나스
QUEST_UNUSED_20151022_001049	ああ。私の聖水が役に立って何よりです。{nl}それにしても、魔族は人間に紛れ込んで仲たがいをさせようとするなんて…本当に恐ろしいですね。{nl}	아, 제가 드린 성수가 도움이 되었다니 정말 다행이에요.{nl}이젠 하다하다 마족이 사람 틈에 섞여서 이간질까지 하다니 정말 소름돋아요.{nl}	QUEST_LV_0100_20151016_009715	I'm glad to hear that Holy Water that I gave you was of some use.{nl}It's terrifying to think that demons walking among us and dividing us. They must be really desperate.{nl}	아, 제가 드린 성수가 도움이 되었다니 정말 다행이에요.{nl}이젠 하다하다 마족이 사람 속에 섞여서 이간질까지 하다니 정말 소름돋네요.{nl}	에뒤나스
QUEST_UNUSED_20151022_001050	ダミヨナスにもこの事実を知らせてもらえませんか？{nl}きっと今もウサスの丘に立てた碑石を守っているはずです。	다미요나스에게도 이 사실을 알려주시겠어요?{nl}아마 아직도 우사스 언덕에서 부서진 비석을 지키고 있을 겁니다.	QUEST_LV_0100_20151016_009716	Could you inform Damijonas of this as well?{nl}He would be protecting the stele that got destroyed last time.	다미요나스에게도 이 사실을 알려주시겠어요?{nl}아마 저번에 부서진 비석을 지키고 있을 겁니다.	에뒤나스
QUEST_UNUSED_20151022_001051	あなたのおかげで魔族の陰謀を阻止することができました。{nl}危く、仲間同士で本当に憎しみ合うところでしたよ。	당신 덕분에 마족의 음모를 막을 수 있었습니다.{nl}하마터면 저희들끼리 정말 영영 갈라설 뻔 했어요.	QUEST_LV_0100_20151016_009717	The demon's plan has been foiled all thanks to you.{nl}We might have crossed the point of no return forever.	당신 덕분에 마족의 음모를 막을 수 있었습니다.{nl}하마터면 정말 영영 갈라설 뻔 했어요.	게다스
QUEST_UNUSED_20151022_001052	ああ、あんたか。 {nl}アルビナスって奴については何か分かったか？{nl}	오, 그래. {nl}알비나스란 자에 대해 알아온 게 있소?{nl}	QUEST_LV_0100_20151016_009718	Oh, good. {nl}So, have you found something about Albinas?{nl}	오, 그래. {nl}알비나스란 자에 대해 알아온 게 있나?{nl}	다미요나스
QUEST_UNUSED_20151022_001053	きっと俺たち以外にも引っかかった奴らがいるはずだ。{nl}力で抑えつけるだけじゃなく、内側から崩そうとしているんだろう…。{nl}	분명 우리 말고도 이런 이간질에 넘어간 사람들이 있을 게요.{nl}힘으로 눌러찍는 것 뿐만 아니라 속에서부터 점점 무너뜨리려는 게지..{nl}	QUEST_LV_0100_20151016_009720	There must be someone else who have fallen for a trick like this other than us.{nl}These demons are not just using brute force but also the cunning plans to divide us internally..{nl}	분명 우리 말고도 이런 이간질에 넘어간 사람들이 있을게야.{nl}힘으로 눌러찍는 것 뿐만 아니라 속에서부터 점점 무너뜨리려는 게지..{nl}	다미요나스
