QUEST_LV_0500_20190419_000001	누군가는 해야 할 일이면 다른 사람이 했으면 좋겠어요.{nl}왜 저한태 이런 걸 시키는 걸까요.	케도라 상단원 이네타
QUEST_LV_0500_20190419_000002	몬스터와 마족들이 득실거리니..{nl}적어도 강도를 만날 걱정은 안 해도 되겠어.{nl}살아서 돌아갈 수 있다면 말이지.	케도라 상단원 타다스
QUEST_LV_0500_20190419_000003	정찰하는 데 며칠, 보고하는 데 또 며칠!{nl}이러면 일은 언제 끝낼 생각인 거지?	바바리안 볼케
QUEST_LV_0500_20190419_000004	전 타다스님을 도우러 온 것이지.{nl}볼케님이 사고 치는 걸 처리하러 온 게 아닙니다.	케도라 상단원 니르기
QUEST_LV_0500_20190419_000005	카르타스의 눈을 속여 신수의 씨앗을 빼앗기지 않았어요.{nl}이 속박을 풀어낸다면 씨앗의 능력으로 힘을 다시 회복할 수 있을 거예요.	여신 메데이나
QUEST_LV_0500_20190419_000006	카르타스가 이 숲에 거대한 결계를 펼치면서까지 저를 쫓는 이유가 무엇일까요..{nl}정말 이 씨앗의 존재를 알고 있는 걸까요?	여신 메데이나
QUEST_LV_0500_20190419_000007	저는 몸을 추스리는대로 네링가님을 찾아가 보려 해요.{nl}네링가님이라면 분명 카르타스로부터 메데이나님을 구할 방법을 알고 계실 거에요.	큐폴 아스트라
QUEST_LV_0500_20190419_000008	아! 계시자님! 이 숲에는 사악한 결계가 펼쳐져 있어서 들어오시면 위험해요!{nl}어서 벗어나세요!	큐폴 아스트라
QUEST_LV_0500_20190419_000009	카르타스가 숲 일대에 펼친 결계 때문에 지금 메데이나님의 힘으로는 이곳을 벗어날 수 없어요.{nl}메데이나님이 어서 기운을 차리시고 회복하셔야 할 텐데..	큐폴 일로나
QUEST_LV_0500_20190419_000010	카르타스가 이곳을 발견하면 큰일이에요.{nl}메데이나님이 회복할 수 있도록 계시자님께서 도와주세요.	큐폴 일로나
QUEST_LV_0500_20190419_000011	속박의 결계에 걸리긴 했지만.. 그래도 일로나가 무사해서 다행이에요.{nl}계시자님. 결계를 해제할만한 방법이 있을지 찾아봐 주세요.	큐폴 율리아
QUEST_LV_0500_20190419_000012	어서 일로나와 함께 메데이나님을 찾으러 가 봐요.	큐폴 율리아
QUEST_LV_0500_20190419_000013	메데이나님의 흔적이 이 앞에서 끊겼으니 이 안뜰 안쪽을 확인해보는 게 어떨까요?	큐폴 율리아
QUEST_LV_0500_20190419_000014	메데이나님이 무사하셔서 다행이에요!{nl}그보다 메데이나님에게 펼쳐진 마계 이동 마법진을 파훼해야 할텐데..	큐폴 율리아
QUEST_LV_0500_20190419_000015	계시자님! 메데이나님에게 펼쳐진 마계 이동 마법진을 없애주세요.{nl}카르타스가 없는 지금이 기회에요.	큐폴 일로나
QUEST_LV_0500_20190419_000016	계시자님 덕분에 메데이나님이 결계를 풀어낼 수 있었네요.{nl}어서 이곳을 벗어나야 할 텐데..	큐폴 일로나
QUEST_LV_0500_20190419_000017	보조 마법진에 마력을 과부하 되게 주입하는 게 효과가 있었네요.	큐폴 율리아
QUEST_LV_0500_20190419_000018	아.. 저희 때문에 메데이나님이..	큐폴 율리아
QUEST_LV_0500_20190419_000019	메데이나님..	큐폴 일로나
QUEST_LV_0500_20190419_000020	제가 너무 늦었어요..	큐폴 아스트라
QUEST_LV_0500_20190419_000021	비록 메데이나님이 카르타스에게 붙잡혀 가셨지만..{nl}저희는 계시자님께서 메데이나님을 찾는 일에 적극적으로 도와주신 것을 기억하고 있어요.{nl}	큐폴 아스트라
QUEST_LV_0500_20200129_000022	누카 전사, 누오 암살자 처치	
QUEST_LV_0500_20200129_000023	클라페다 의뢰소의 접수원 람다의 의뢰로{nl}트비르투마스 요새에서 누카 전사, 누오 암살자 처치를 수행해야 합니다.	
QUEST_LV_0500_20200129_000024	아클라스 페탈 전사 처치	
QUEST_LV_0500_20200129_000025	클라페다 의뢰소의 접수원 람다의 의뢰로{nl}트비르투마스 요새에서 아클라스 페탈 전사 처치를 수행해야 합니다.	
QUEST_LV_0500_20200129_000026	리빙 아머 처치	
QUEST_LV_0500_20200129_000027	클라페다 의뢰소의 접수원 람다의 의뢰로{nl}트비르투마스 요새에서 리빙 아머 처치를 수행해야 합니다.	
QUEST_LV_0500_20200129_000028	일가란카 처치	
QUEST_LV_0500_20200129_000029	클라페다 의뢰소의 접수원 람다의 의뢰로{nl}트비르투마스 요새에서 일가란카 처치를 수행해야 합니다.	
QUEST_LV_0500_20200129_000030	블로거즈 고블린 라이더, 넥코 처치	
QUEST_LV_0500_20200129_000031	클라페다 의뢰소의 접수원 람다의 의뢰로{nl}스칼다 외곽에서 블로거즈 고블린 라이더, 넥코 처치를 수행해야 합니다.	
QUEST_LV_0500_20200129_000032	그레이 울프 처치	
QUEST_LV_0500_20200129_000033	클라페다 의뢰소의 접수원 람다의 의뢰로{nl}스칼다 외곽에서 그레이 울프 처치를 수행해야 합니다.	
QUEST_LV_0500_20200129_000034	블로거즈 고블린 궁수 처치	
QUEST_LV_0500_20200129_000035	클라페다 의뢰소의 접수원 람다의 의뢰로{nl}스칼다 외곽에서 블로거즈 고블린 궁수 처치를 수행해야 합니다.	
QUEST_LV_0500_20200129_000036	그레이 울프 치프 처치	
QUEST_LV_0500_20200129_000037	클라페다 의뢰소의 접수원 람다의 의뢰로{nl}스칼다 외곽에서 그레이 울프 치프 처치를 수행해야 합니다.	
QUEST_LV_0500_20200129_000038	오크 살수병 처치	
QUEST_LV_0500_20200129_000039	클라페다 의뢰소의 접수원 람다의 의뢰로{nl}링크스마스 폐허에서 오크 살수병 처치를 수행해야 합니다.	
QUEST_LV_0500_20200129_000040	오크 주술사 처치	
QUEST_LV_0500_20200129_000041	클라페다 의뢰소의 접수원 람다의 의뢰로{nl}링크스마스 폐허에서 오크 주술사 처치를 수행해야 합니다.	
QUEST_LV_0500_20200129_000042	오크 방패병 처치	
QUEST_LV_0500_20200129_000043	클라페다 의뢰소의 접수원 람다의 의뢰로{nl}링크스마스 폐허에서 오크 방패병 처치를 수행해야 합니다.	
QUEST_LV_0500_20200129_000044	오크 리더 처치	
QUEST_LV_0500_20200129_000045	클라페다 의뢰소의 접수원 람다의 의뢰로{nl}링크스마스 폐허에서 오크 리더 처치를 수행해야 합니다.	
QUEST_LV_0500_20200129_000046	링크스마스 폐허의 몬스터 처치	
QUEST_LV_0500_20200129_000047	클라페다 의뢰소의 접수원 람다의 의뢰로{nl}링크스마스 폐허에서 충분한 수의 몬스터 처치를 수행해야 합니다.	
QUEST_LV_0500_20200129_000048	오크 캐논병 처치	
QUEST_LV_0500_20200129_000049	클라페다 의뢰소의 접수원 람다의 의뢰로{nl}종언의 길에서 오크 캐논병 처치를 수행해야 합니다.	
QUEST_LV_0500_20200129_000050	오크 깃발병 처치	
QUEST_LV_0500_20200129_000051	클라페다 의뢰소의 접수원 람다의 의뢰로{nl}종언의 길에서 오크 깃발병 처치를 수행해야 합니다.	
QUEST_LV_0500_20200129_000052	오크 대장 처치	
QUEST_LV_0500_20200129_000053	클라페다 의뢰소의 접수원 람다의 의뢰로{nl}종언의 길에서 오크 대장 처치를 수행해야 합니다.	
QUEST_LV_0500_20200129_000054	종언의 길의 몬스터 처치	
QUEST_LV_0500_20200129_000055	클라페다 의뢰소의 접수원 람다의 의뢰로{nl}종언의 길에서 충분한 수의 몬스터 처치를 수행해야 합니다.	
QUEST_LV_0500_20200129_000056	클라페다 의뢰소의 접수원 람다의 의뢰로 트비르투마스 요새에서 누카 전사, 누오 암살자 처치를 수행해야 합니다.	
QUEST_LV_0500_20200129_000057	클라페다 의뢰소의 접수원 람다의 의뢰로 트비르투마스 요새에서 아클라스 페탈 전사 처치를 수행해야 합니다.	
QUEST_LV_0500_20200129_000058	클라페다 의뢰소의 접수원 람다의 의뢰로 트비르투마스 요새에서 리빙 아머 처치를 수행해야 합니다.	
QUEST_LV_0500_20200129_000059	클라페다 의뢰소의 접수원 람다의 의뢰로 트비르투마스 요새에서 일가란카 처치를 수행해야 합니다.	
QUEST_LV_0500_20200129_000060	클라페다 의뢰소의 접수원 람다의 의뢰로 스칼다 외곽에서 블로거즈 고블린 라이더, 넥코 처치를 수행해야 합니다.	
QUEST_LV_0500_20200129_000061	클라페다 의뢰소의 접수원 람다의 의뢰로 스칼다 외곽에서 그레이 울프 처치를 수행해야 합니다.	
QUEST_LV_0500_20200129_000062	클라페다 의뢰소의 접수원 람다의 의뢰로 스칼다 외곽에서 블로거즈 고블린 궁수 처치를 수행해야 합니다.	
QUEST_LV_0500_20200129_000063	클라페다 의뢰소의 접수원 람다의 의뢰로 스칼다 외곽에서 그레이 울프 치프 처치를 수행해야 합니다.	
QUEST_LV_0500_20200129_000064	클라페다 의뢰소의 접수원 람다의 의뢰로 링크스마스 폐허에서 오크 살수병 처치를 수행해야 합니다.	
QUEST_LV_0500_20200129_000065	클라페다 의뢰소의 접수원 람다의 의뢰로 링크스마스 폐허에서 오크 주술사 처치를 수행해야 합니다.	
QUEST_LV_0500_20200129_000066	클라페다 의뢰소의 접수원 람다의 의뢰로 링크스마스 폐허에서 오크 방패병 처치를 수행해야 합니다.	
QUEST_LV_0500_20200129_000067	클라페다 의뢰소의 접수원 람다의 의뢰로 링크스마스 폐허에서 오크 리더 처치를 수행해야 합니다.	
QUEST_LV_0500_20200129_000068	클라페다 의뢰소의 접수원 람다의 의뢰로 링크스마스 폐허에서 충분한 수의 몬스터 처치를 수행해야 합니다.	
QUEST_LV_0500_20200129_000069	클라페다 의뢰소의 접수원 람다의 의뢰로 종언의 길에서 오크 캐논병 처치를 수행해야 합니다.	
QUEST_LV_0500_20200129_000070	클라페다 의뢰소의 접수원 람다의 의뢰로 종언의 길에서 오크 깃발병 처치를 수행해야 합니다.	
QUEST_LV_0500_20200129_000071	클라페다 의뢰소의 접수원 람다의 의뢰로 종언의 길에서 오크 대장 처치를 수행해야 합니다.	
QUEST_LV_0500_20200129_000072	클라페다 의뢰소의 접수원 람다의 의뢰로 종언의 길에서 충분한 수의 몬스터 처치를 수행해야 합니다.	
QUEST_LV_0500_20200320_000073	잠시만요, 혹시 계시자인가요?	세이지 파견원
QUEST_LV_0500_20200320_000074	큰일입니다.{nl}신수의 날 이후로 종종 차원이 붕괴하는 현상이 나타나고 있어요.{nl}	세이지 파견원
QUEST_LV_0500_20200320_000075	더군다나 근처의 몬스터들이 붕괴를 가속하고 있죠.{nl}막지 않으면 차원 붕괴가 대륙 전역으로 번질 거예요.{nl}저 혼자서는 벅찬일이라 계시자들에게 도움을 구하고 있습니다.{nl}이렇게 부탁드립니다.	세이지 파견원
QUEST_LV_0500_20200320_000076	차원 붕괴에 휘말려 아까운 목숨을 잃지 않도록 주의하세요.{nl}준비가 충분하지 않으면 가까이 가지 않는 게 좋습니다.	세이지 파견원
QUEST_LV_0500_20200320_000077	차원 붕괴 저지	
QUEST_LV_0500_20200320_000078	계시자가 맞다고 한다.	
QUEST_LV_0500_20200320_000079	계시자가 아니라고 한다.	
QUEST_LV_0500_20200320_000080	세이지 파견원과 대화하기.	
QUEST_LV_0500_20200320_000081	폐도에 위치한 세이지 파견원이 계시자들에게 무언가를 지급하고 있습니다. 세이지 파견원과 대화하세요.	
QUEST_LV_0500_20200710_000082	저희는 여기서 최근에 일어난 한파 현상에 대해 조사하고 있습니다.{nl}	크루세이더 마스터
QUEST_LV_0500_20200710_000083	세 차례에 걸친 조사로 이 절벽 아래에 있는 마족이 한파의 원인이라는 건 알아냈습니다.{nl}	크루세이더 마스터
QUEST_LV_0500_20200710_000084	마족의 이름은..{nl}	크루세이더 마스터
QUEST_LV_0500_20200710_000085	글레이시어.{nl}	크루세이더 마스터
QUEST_LV_0500_20200710_000086	글레이시어라고 하는 마족입니다.{nl}그리고 특별한 장치 위에 떠 있는 검은 수정도 발견했습니다.{nl}정체가 확실하지는 않지만, 강한 마력을 응축하고 있었습니다.{nl}	크루세이더 마스터
QUEST_LV_0500_20200710_000087	몇 차례 글레이시어 토벌을 시도했지만, 한파와 마족의 공세를 뚫는 데 실패했습니다.{nl}	크루세이더 마스터
QUEST_LV_0500_20200710_000088	계시자들의 활약상은 들었습니다.{nl}글레이시어  처치를 도와주십시오.	크루세이더 마스터
QUEST_LV_0500_20200710_000089	그럼, 절벽 아래로 내려갈 준비를 마친 후 다시 뵙겠습니다.	크루세이더 마스터
QUEST_LV_0500_20200710_000090	절벽 아래로 내려간다면, 추가 지원을 요청하기는 힘들 겁니다.{nl}글레이시어가 일으키고 있는 한파를 버젓이 뚫고 가기도 쉽지 않을 겁니다.{nl}	크루세이더 마스터
QUEST_LV_0500_20200710_000091	저희는 여기서 계시자님이 철창을 타고 절벽 아래로 무사히 내려갈 수 있도록 돕겠습니다.{nl}	크루세이더 마스터
QUEST_LV_0500_20200710_000092	글레이시어를 잘 부탁합니다.	크루세이더 마스터
QUEST_LV_0500_20200710_000093	계시자님.{nl}잠시 시간 좀 내주시겠습니까?{nl}	크루세이더 파견원
QUEST_LV_0500_20200710_000094	지난 번, 절벽 아래를 조사하는 중에 몇 가지를 발견한 게 있습니다.{nl}그중 이 붉은 액체..{nl}그 추위 속에서 얼지 않고 살얼음만 띄고 있더군요.{nl}	크루세이더 파견원
QUEST_LV_0500_20200710_000095	아무래도 심상치 않아 채취했습니다.{nl}혹시 분석을 맡길 만한 사람이 있다면 계시자님께 맡기겠습니다.	크루세이더 파견원
QUEST_LV_0500_20200710_000096	감사합니다.{nl}분석이 완료되면 다시 저를 찾아와 주세요.	크루세이더 파견원
QUEST_LV_0500_20200710_000097	용액을 분석해 달라는 말씀이신가요?{nl}어려운 일은 아니지만, 불길한 짐작이 드는군요.{nl}	플레이그 닥터 마스터
QUEST_LV_0500_20200710_000098	확실히 하기 위해서는 식물이 필요합니다.{nl}근처에서 어떤 것이든 상관없으니 하나만 구해주시겠습니까?{nl}그러고 보니 마침, 여기서 멀지 않은 쪽에 길게 자란 식물이 있으니 그게 좋겠네요.	플레이그 닥터 마스터
QUEST_LV_0500_20200710_000099	분석이 완료되면 다시 저를 찾아와 주세요.	크루세이더 파견원
QUEST_LV_0500_20200710_000100	이건..{nl}	플레이그 닥터 마스터
QUEST_LV_0500_20200710_000101	아무래도 크루비나인 것 같군요.{nl}소문으로 들은 적이 있습니다.{nl}액체의 형태이지만.. 실제로 보는 건 처음이군요.{nl}	플레이그 닥터 마스터
QUEST_LV_0500_20200710_000102	다만, 여기에는 피가 더 많이 섞여 있습니다.{nl}아무래도.. 누군가의 몸에 있다가 피와 함께 토해낸 거로 생각합니다.{nl}	플레이그 닥터 마스터
QUEST_LV_0500_20200710_000103	이를테면.. 말씀하신 글레이시어라는 마족이겠네요.{nl}	플레이그 닥터 마스터
QUEST_LV_0500_20200710_000104	안 좋은 징조입니다.	플레이그 닥터 마스터
QUEST_LV_0500_20200710_000105	이번 일에 대해서 책임을 갖고 조사해주시기를 부탁드립니다.{nl}이런 물건이라면 평범한 마족 정도만 탐낼 물건이 아닐 겁니다.	플레이그 닥터 마스터
QUEST_LV_0500_20200710_000106	오셨습니까?{nl}	크루세이더 파견원
QUEST_LV_0500_20200710_000107	알겠습니다.{nl}이 용액에 대한 처리와 조사는 저희가 맡겠습니다.{nl}도와주셔서 정말 감사합니다.	크루세이더 파견원
QUEST_LV_0500_20200710_000108	계시자님.{nl}스토가스 고원의 야영지에 주둔한 병사 중에서 의문의 여인에 대한 목격담을 이야기했다는 소식을 들었습니다.	크루세이더 파견원
QUEST_LV_0500_20200710_000109	저는 현 위치를 유지하라는 명령을 받았습니다.{nl}아무래도 마스터님에게는 보고하지 않은 조사라 제가 움직이기는 힘들 것 같습니다.{nl}저를 대신해 야영지의 병사들을 만나봐 주실 수 있으실까요?	크루세이더 파견원
QUEST_LV_0500_20200710_000110	도와주셔서 정말 감사합니다.{nl}야영지에 있는 스토가스 분대장 아데스라는 사람을 찾아보시면 수고를 줄이실 수 있으실 겁니다.	크루세이더 파견원
QUEST_LV_0500_20200710_000111	의문의 여인에 대한 목격담을 듣고 오셨다고요?	스토가스 분대장 아데스
QUEST_LV_0500_20200710_000112	분명히 기억하고 있어요.{nl}이상했던 게, 누구든지 자신을 도와달라며 울면서도 도와주려는 저희를 무시하는 듯했었죠.{nl}그러면서 아무도 자신을 돕지 않는다며 중얼거리기도 했습니다.{nl}제정신 같지가 않았어요.	스토가스 분대장 아데스
QUEST_LV_0500_20200710_000113	이해하기 힘드시다면, 고원병사 모티머에게 물어보시면 됩니다.{nl}그 여인을 발견했던 게 바로 모티머였습니다.	스토가스 분대장 아데스
QUEST_LV_0500_20200710_000114	야영지에 있는 스토가스 분대장 아데스라는 사람을 찾아보시면 수고를 줄이실 수 있으실 겁니다.	크루세이더 파견원
QUEST_LV_0500_20200710_000115	무슨 일이시죠?	고원병사 모티머
QUEST_LV_0500_20200710_000116	여인에 대해서라면 고원병사 모티머에게 물어보시면 됩니다.{nl}그 여인을 발견했던 게 바로 모티머였습니다.	스토가스 분대장 아데스
QUEST_LV_0500_20200710_000117	여인에 대해서 여쭤보시는 거군요.	고원병사 모티머
QUEST_LV_0500_20200710_000118	아, 하지만 지금은 곤란합니다.{nl}서둘러 처리할 일이 있어서요.{nl}제가 일을 마무리하는 동안 게히마 공터로 가는 길목을 살펴보시는 게 좋을 겁니다.{nl}그 여인을 처음 발견했던 게 그 근처였습니다.	고원병사 모티머
QUEST_LV_0500_20200710_000119	그럼, 서둘러 일을 마무리할 테니 게히마 공터의 길목을 먼저 조사해 보십시오.	고원병사 모티머
QUEST_LV_0500_20200710_000120	저는 서둘러 일을 마무리할 테니 게히마 공터의 길목을 먼저 조사해 보십시오.	고원병사 모티머
QUEST_LV_0500_20200710_000121	마침 계시자님을 찾던 중이었습니다.	고원병사 모티머
QUEST_LV_0500_20200710_000122	그 족쇄는..{nl}그 여인의 발목에 채워져 있던 족쇄군요.	고원병사 모티머
QUEST_LV_0500_20200710_000123	그 여인은 마치 저희가 전혀 보이지도 들리지도 않는 것처럼 허공을 응시하며 도와달라고만 했습니다.{nl}제가 어떻게든 도우려고 했지만, 그럴 수도 없을 지경이었죠.{nl}여인은 아무도 자신을 돕지 않는다며 중얼거리면서 알몰 제2 노역장 방향으로 갔습니다.	고원병사 모티머
QUEST_LV_0500_20200710_000124	이런 지형에서 살아남기도 힘들어 보이는 상태였죠.{nl}그러고 보니 허공을 응시하고 있던 눈동자가 이상했습니다.{nl}검은자가.. 없었던 것 같습니다.{nl}걷는 것이 힘들어 보여 족쇄를 끊어 주는 것만이 제가 할 수 있는 전부였습니다.	고원병사 모티머
QUEST_LV_0500_20200710_000125	오셨군요.{nl}야영지에서 발견된 여인의 목격담에 대해 조사를 마치셨습니까?	크루세이더 파견원
QUEST_LV_0500_20200710_000126	그렇게 된 것이군요.{nl}이곳까지 와서 절벽 아래로 떨어졌을 가능성이 높습니다.{nl}당연히 무사하진 못 했겠군요.	크루세이더 파견원
QUEST_LV_0500_20200710_000127	떨어져 있던 물품에 크루비나 용액이 묻어 있었다는 말은.. 그 여인이 곧, 글레이시어겠군요.	크루세이더 파견원
QUEST_LV_0500_20200710_000128	계시자님께서 조사해주신 내용과 저희가 그동안 조사한 내용을 토대로 추측해봤을 때, 글레이시어는 더 큰 존재에게 해를 입었을 것으로 생각됩니다.{nl}아무래도 그녀의 정신을 해치고 마족화시킨 배후가 있겠군요.	크루세이더 파견원
QUEST_LV_0500_20200710_000129	계시자님.{nl}이제는 저 절벽 아래로 내려가봐야 할 때인 것 같습니다.{nl}하얀 마녀의 숲에서 무엇이든지 발견하신다면 저에게 알려주시길 부탁드립니다.	크루세이더 파견원
QUEST_LV_0500_20200710_000130	글레이시어는 절벽 아래로 떨어진 이후 지금에 이르렀을 겁니다.{nl}하얀 마녀의 숲에서 무엇이든지 발견하신다면, 저에게 알려주시길 부탁드립니다.	크루세이더 파견원
QUEST_LV_0500_20200710_000131	계시자님 지금은..	크루세이더 파견원
QUEST_LV_0500_20200710_000132	멈춰주십시오.	크루세이더 마스터
QUEST_LV_0500_20200710_000133	계시자님.{nl}드릴 말씀이 있습니다.	크루세이더 마스터
QUEST_LV_0500_20200710_000134	이곳의 지휘를 담당하고 있는 것은 바로 저입니다.{nl}허가되지 않은 조사 활동은 삼가 주십시오.{nl}아무리 계시자님이라고 하셔도, 왕국의 법을 어기신다면 불리한 입장에 처하시게 될 겁니다.	크루세이더 마스터
QUEST_LV_0500_20200710_000135	조사에 협조해주신 계시자님의 헌신에 대해서는 분명한 감사를 표하겠습니다.{nl}다만, 적이 누구든지 신수에 위협이 될 존재라면 마땅히 처단해야 합니다.{nl}크루세이더가 가진 의무는 그것뿐입니다.	크루세이더 마스터
QUEST_LV_0500_20200710_000136	앞으로는 독단적인 조사는 지양해주십시오.	크루세이더 마스터
QUEST_LV_0500_20200710_000137	누바스크 절벽에서 발생하고 있는 이상 한파 현상에 대해 조사하고 있습니다.{nl}하지만, 인력이 부족한 탓에 어려움을 겪고 있습니다.{nl}괜찮으시다면 도와주실 수 있으십니까?	크루세이더 파견원
QUEST_LV_0500_20200710_000138	감사합니다.{nl}누바스크 절벽으로 가시죠.	크루세이더 파견원
QUEST_LV_0500_20200710_000139	이상 한파는 누바스크 절벽에서 발생하고 있습니다.	크루세이더 파견원
QUEST_LV_0500_20200710_000140	조사를 도와주셔서 감사합니다.{nl}충분한 증거가 모이면 왕국에 가져가 대책을 마련할 생각입니다.{nl}항상 인력이 부족해서 고민이군요..	크루세이더 파견원
QUEST_LV_0500_20200710_000141	도울 수 없다고 한다.	
QUEST_LV_0500_20200710_000142	하얀 마녀와 크루세이더(1)	
QUEST_LV_0500_20200710_000143	지금은 다른 일 때문에 바쁘다고 한다.	
QUEST_LV_0500_20200710_000144	하얀 마녀와 크루세이더(2)	
QUEST_LV_0500_20200710_000145	이번 일에 최선을 다하겠다고 한다.	
QUEST_LV_0500_20200710_000146	이쯤에서 그만두고 싶다고 한다.	
QUEST_LV_0500_20200710_000147	하얀 마녀와 크루세이더(3)	
QUEST_LV_0500_20200710_000148	더 관여하고 싶지 않다고 말한다.	
QUEST_LV_0500_20200710_000149	하얀 마녀와 크루세이더(4)	
QUEST_LV_0500_20200710_000150	관심이 없다고 한다.	
QUEST_LV_0500_20200710_000151	하얀 마녀와 크루세이더(5)	
QUEST_LV_0500_20200710_000152	조사 결과를 전한다.	
QUEST_LV_0500_20200710_000153	아직 조사가 끝나지 않았다고 한다.	
QUEST_LV_0500_20200710_000154	하얀 마녀와 크루세이더(6)	
QUEST_LV_0500_20200710_000155	지금은 다른 일이 있다고 한다.	
QUEST_LV_0500_20200710_000156	하얀 마녀와 크루세이더(7)	
QUEST_LV_0500_20200710_000157	편지를 보여준다.	
QUEST_LV_0500_20200710_000158	시치미를 뗀다.	
QUEST_LV_0500_20200710_000159	스토가스 고원의 이상 한파	
QUEST_LV_0500_20200710_000160	조사에 도움을 준다.	
QUEST_LV_0500_20200710_000161	조사를 돕지 않는다.	
QUEST_LV_0500_20200710_000162	크루세이더 마스터와 대화하기	
QUEST_LV_0500_20200710_000163	스토가스 고원 지대에서 조사 임무를 맡던 크루세이더 마스터가 계시자들에게 도움을 요청하고 있습니다.{nl}스토가스 고원의 크루세이더 마스터 조피아 엘레노라를 찾아가 이야기를 들어보세요.	
QUEST_LV_0500_20200710_000164	준비를 마치고 크루세이더 마스터에게 돌아가기	
QUEST_LV_0500_20200710_000165	조피아는 절벽 아래에 있는 글레이시어를 처치하기 위해 계시자들에게 도움을 요청했다고 합니다.{nl}절벽 아래로 내려 갈 준비를 마쳤다면 조피아에게 돌아가 이야기하세요.	
QUEST_LV_0500_20200710_000166	하얀 마녀와 크루세이더	
QUEST_LV_0500_20200710_000167	크루세이더 파견원과 대화하기.	
QUEST_LV_0500_20200710_000168	크루세이더 파견원이 당신에게 할 말이 있는 듯 합니다.{nl}크루세이더 파견원과 이야기를 나눠 보세요.	
QUEST_LV_0500_20200710_000169	식물을 채집하기.	
QUEST_LV_0500_20200710_000170	크루세이더 파견원은 하얀 마녀의 숲을 탐사 중 발견한 물건에 대해 조사를 맡겼습니다.{nl}플레이그 닥터 마스터에게 찾아가 살얼음 띈 붉은 액체의 분석을 의뢰하세요.	
QUEST_LV_0500_20200710_000171	플레이그 닥터 마스터에게 돌아가기.	
QUEST_LV_0500_20200710_000172	플레이그 닥터 마스터가 말한 식물을 구했습니다.{nl}플레이그 닥터 마스터에게 돌아가 의뢰를 용액 분석을 마무리할 수 있도록 식물을 전해주세요.	
QUEST_LV_0500_20200710_000173	플레이그 닥터 마스터에게 조사 결과를 받기	
