QUEST_LV_0500_20210115_000738	Episode13 지역의 대형 몬스터 처치	
QUEST_LV_0500_20210115_000739	Episode13 지역에서 중형 몬스터 3000마리 처치	
QUEST_LV_0500_20210115_000740	Episode13 지역의 중형 몬스터 처치	
QUEST_LV_0500_20210115_000741	Episode13 지역에서 소형 몬스터 3000마리 처치	
QUEST_LV_0500_20210115_000742	Episode13 지역의 소형 몬스터 처치	
QUEST_LV_0500_20210115_000743	Episode13 지역에서 몬스터 8000마리 처치	
QUEST_LV_0500_20210115_000744	Episode13 지역의 몬스터 처치	
QUEST_LV_0500_20210115_000745	베르니케 파편 던전 50층 이상 클리어	
QUEST_LV_0500_20210115_000746	어시스터 던전 6구간 이상 클리어	
QUEST_LV_0500_20210115_000747	1인 레이드 클리어	
QUEST_LV_0500_20210115_000748	레전드 레이드 10회 클리어	
QUEST_LV_0500_20210115_000749	주간 보스 레이드 누적 대미지 5억 이상 달성	
QUEST_LV_0500_20210115_000750	협동전 2회 참가	
QUEST_LV_0500_20210115_000751	레벨 던전 10회 클리어	
QUEST_LV_0500_20210115_000752	챌린지 모드 3단 이상으로 30회 클리어{nl}자동 매칭은 제 3구역에서 진행할 수 있습니다.	
QUEST_LV_0500_20210115_000753	챌린지 모드 : 분열 특이점 3단 이상, 자동 매칭 10회 클리어	
QUEST_LV_0500_20210115_000754	렘파라사 연못의 일반 필드에서 몬스터 200마리 처치	
QUEST_LV_0500_20210115_000755	덧댄다리 숲의 일반 필드에서 몬스터 200마리 처치	
QUEST_LV_0500_20210115_000756	파우피스 나루의 일반 필드에서 몬스터 200마리 처치	
QUEST_LV_0500_20210115_000757	파우피스 나루의 몬스터 처치	
QUEST_LV_0500_20210115_000758	이사우고티 숲의 일반 필드에서 몬스터 200마리 처치	
QUEST_LV_0500_20210115_000759	이사우고티 숲의 몬스터 처치	
QUEST_LV_0500_20210115_000760	키르티마스 숲의 일반 필드에서 몬스터 200마리 처치	
QUEST_LV_0500_20210115_000761	키르티마스 숲의 몬스터 처치	
QUEST_LV_0500_20210115_000762	렘파라사 연못의 일반 필드에서 몬스터를 처치하고 부산물 50 획득	
QUEST_LV_0500_20210115_000763	렘파라사 연못의 몬스터 처치 후 리프스나의 조직 회수	
QUEST_LV_0500_20210115_000764	덧댄다리 숲의 일반 필드에서 몬스터를 처치하고 부산물 50 획득	
QUEST_LV_0500_20210115_000765	덧댄다리 숲의 몬스터 처치 후 다르바스의 보급품 회수	
QUEST_LV_0500_20210115_000766	파우피스 나루의 일반 필드에서 몬스터를 처치하고 부산물 50 획득	
QUEST_LV_0500_20210115_000767	파우피스 나루의 몬스터 처치 후 마족의 피 회수	
QUEST_LV_0500_20210115_000768	이사우고티 숲의 일반 필드에서 몬스터를 처치하고 부산물 50 획득	
QUEST_LV_0500_20210115_000769	이사우고티 숲의 몬스터 처치 후 소거마스의 영혼 회수	
QUEST_LV_0500_20210115_000770	키르티마스 숲의 일반 필드에서 몬스터를 처치하고 부산물 50 획득	
QUEST_LV_0500_20210115_000771	키르티마스 숲의 몬스터 처치 후 파편 회수	
QUEST_LV_0500_20210115_000772	Episode13 지역에서 몬스터 60000마리 처치	
QUEST_LV_0500_20210115_000773	레전드 레이드 50회 클리어	
QUEST_LV_0500_20210115_000774	챌린지 모드 3단 이상으로 250회 클리어{nl}자동 매칭은 제 3구역에서 진행할 수 있습니다.	
QUEST_LV_0500_20210115_000775	오르샤 영주 이네사 해먼데일에게 도움을 요청해 봅시다	
QUEST_LV_0500_20210115_000776	이네사 해먼데일에게 도움을 요청해보세요	
QUEST_LV_0500_20210115_000777	이네사 해먼데일이 지원해주는 물품을 받으세요	
QUEST_LV_0500_20210115_000778	머티니스 저장소 찾기	
QUEST_LV_0500_20210115_000779	이사우고티 숲으로 이동하여 머티니스가 저장된 곳을 찾아봅시다	
QUEST_LV_0500_20210115_000780	저장소에서 물러나기	
QUEST_LV_0500_20210115_000781	저장소로 보이는 곳을 찾았지만 적들이 너무 많으니 물러나야 합니다	
QUEST_LV_0500_20210115_000782	마족들을 유인하기 적합한 장소 찾기	
QUEST_LV_0500_20210115_000783	라다 여신의 계획대로 마족들을 유인하기 적합한 장소를 찾아보세요	
QUEST_LV_0500_20210115_000784	마족들을 유인하기 적합한 장소 조사하기	
QUEST_LV_0500_20210115_000785	라가나와 바이가 세력의 마족을 유인하기에 적합한 장소를 찾아보세요	
QUEST_LV_0500_20210115_000786	마지막 조사 장소 확인하기	
QUEST_LV_0500_20210115_000787	마지막 장소가 적합한지 확인하세요	
QUEST_LV_0500_20210115_000788	라다 여신과 대화하여 다음 계획을 진행하세요	
QUEST_LV_0500_20210115_000789	라가나 세력에게 거짓 정보 전달	
QUEST_LV_0500_20210115_000790	라가나의 직속 부하로 보이는 마족에게 거짓 정보를 전달하여 라가나를 속이세요	
QUEST_LV_0500_20210115_000791	라가나의 전령에게 거짓 정보를 전달하였습니다	
QUEST_LV_0500_20210115_000792	바이가의 전령과 대화	
QUEST_LV_0500_20210115_000793	바이가의 직속 부하로 보이는 마족에게 거짓 정보를 전달하세요	
QUEST_LV_0500_20210115_000794	바이가의 세력에게 거짓 정보 전달	
QUEST_LV_0500_20210115_000795	바이가의 전령에게 거짓 정보를 전달하였습니다.	
QUEST_LV_0500_20210115_000796	라다 여신에게 거짓 정보를 무사히 넘겼음을 알리세요	
QUEST_LV_0500_20210115_000797	머티니스 저장소 근처로 가기	
QUEST_LV_0500_20210115_000798	마족들이 거짓 정보에 속았는지 확인해봅시다	
QUEST_LV_0500_20210115_000799	머티니스 저장소 살펴보기	
QUEST_LV_0500_20210115_000800	무사히 침투한 것 같습니다.{nl}저장된 머티니스가 어디에 있는지 살펴봅시다	
QUEST_LV_0500_20210115_000801	남아있는 마족 경비병 처치하기	
QUEST_LV_0500_20210115_000802	머티니스 저장소를 살펴보고 폭탄을 설치하기 적당한 곳을 찾으세요	
QUEST_LV_0500_20210115_000803	머티니스 저장소에 폭탄 설치하기	
QUEST_LV_0500_20210115_000804	그동안 채굴한 머티니스가 쌓인 곳에 폭탄을 설치하세요	
QUEST_LV_0500_20210115_000805	폭탄을 마저 설치하기	
QUEST_LV_0500_20210115_000806	폭탄을 마저 설치합시다	
QUEST_LV_0500_20210115_000807	폭탄 설치를 방해하는 소거마스 집행자 처치하기	
QUEST_LV_0500_20210115_000808	자리 벗어나기	
QUEST_LV_0500_20210115_000809	폭발의 영향에서 벗어나기 위해 멀리 떨어지세요	
QUEST_LV_0500_20210115_000810	폭탄 작동시키기	
QUEST_LV_0500_20210115_000811	이 정도면 안전한 것 같으니 폭탄을 원격 조작 스크롤로 폭파시킵시다	
QUEST_LV_0500_20210115_000812	폭탄이 무사히 터진 것 같습니다	
QUEST_LV_0500_20210115_000813	머티니스 살펴보기	
QUEST_LV_0500_20210115_000814	폭탄이 머티니스를 완벽하게 제거하였는지 살펴봅시다	
QUEST_LV_0500_20210115_000815	주시자의 공격으로부터 도망치기	
QUEST_LV_0500_20210115_000816	분노한 주시자의 공격으로부터 도망치세요	
QUEST_LV_0500_20210115_000817	기다리고 있는 존재와 대화	
QUEST_LV_0500_20210115_000818	도망친 곳에 누군가가 기다리고 있는 것 같습니다	
QUEST_LV_0500_20210115_000819	라가나와 대화	
QUEST_LV_0500_20210115_000820	라가나와 대화하세요	
QUEST_LV_0500_20210115_000821	주시자에게서 도망치기	
QUEST_LV_0500_20210115_000822	주시자의 공격으로부터 도망치세요	
QUEST_LV_0500_20210115_000823	기다리고 있는 존재 확인	
QUEST_LV_0500_20210115_000824	누군가가 기다리고 있는 것 같습니다	
QUEST_LV_0500_20210115_000825	바이가와 대화	
QUEST_LV_0500_20210115_000826	바이가가 당신을 기다리고 있습니다	
QUEST_LV_0500_20210115_000827	라다 여신에게 보고	
QUEST_LV_0500_20210115_000828	마신 바우바스와 만난 사실을 라다 여신에게 보고합시다	
QUEST_LV_0500_20210115_000829	라다 여신에게 겪었던 일을 설명하세요	
QUEST_LV_0500_20210115_000830	오르샤 영주 이네사 해먼데일에게 상황을 전달하세요	
QUEST_LV_0500_20210115_000831	라다 여신에게 돌아갑시다.	
QUEST_LV_0500_20210115_000832	라다 여신에게 앞으로의 여정에 대해 물어보세요	
QUEST_LV_0500_20210115_000833	라다 여신에게 돌아가세요	
QUEST_LV_0500_20210115_000834	왕국 재건단 오르샤 담당인과 만나기	
QUEST_LV_0500_20210115_000835	신수의 날로 왕국을 비롯한 세계가 재앙의 피해로 무너진 지금, 세계 곳곳에는 다시 희망을 갖고 움직이는 사람들이 있습니다{nl}왕국 재건단은 사라진 여신들에 의지 하지 않고, 인간 스스로의 힘으로 다시 왕국이 부흥하기를 바라는 사람들이 모여 만들어졌습니다{nl}이미 세계 곳곳에는 왕국 재건단의 단원들이 흩어져 왕국 재건에 헌신하고 있습니다.{nl}그들의 이야기를 들어보기 위해 오르샤의 왕국 재건단 담당인과 만나세요	
QUEST_LV_0500_20210518_000836	라다 여신이 일부러 축복을 흘려둔 것 같다{nl}축복을 이용해 모르꼬스 농장에서 마력의 근원지를 찾아보자	QUEST_LV_0500_20210115_000407	라다 여신이 일부로 축복을 흘려둔 것 같다{nl}축복을 이용해 모르꼬스 농장에서 마력의 근원지를 찾아보자	PC
QUEST_LV_0500_20210809_000837	오르샤 피해복구반 단원	
QUEST_LV_0500_20210809_000838	계시자님이 오르샤에 계신다는 이야기는 들었습니다만{nl}이렇게 저희를 도와주실 줄은 몰랐군요.{nl}마지막으로 이곳에 왔을 땐, 고작 케파 몇 마리가 전부였건만..	오르샤 피해복구반 단원
QUEST_LV_0500_20210809_000839	남부 각지에서 왕국 재건단을 돕기 위해 모이고 있습니다만..{nl}숲 사이 샛길조차 이렇게 괴물들이 들끓어서야 누구 하나 무사히 도시로 진입하기 힘들 것 같군요.	오르샤 피해복구반 단원
QUEST_LV_0500_20210809_000840	여유가되신다면 저희를 좀 도와주실 수 있겠습니까?	오르샤 피해복구반 단원
QUEST_LV_0500_20210809_000841	이럴 수가, 계시자님이셨군요!{nl}단원들에게 이야기는 익히 들었습니다만 실제로 뵙게 되어 영광입니다.	오르샤 피해복구반 단원
QUEST_LV_0500_20210809_000842	{nl}오늘은 제게 운이 따르나 봅니다.{nl}이렇게 왕국의 영웅과 계시자를 한날한시에 뵙게 될 줄이야!{nl}계시자님도 어쩌면 파야우타님과 만날 수도 있겠군요.	오르샤 피해복구반 단원
QUEST_LV_0500_20210809_000843	계시자님께도 파야우타님을 소개시켜드리면 좋겠지만,{nl}안타깝게도 이른 아침에 파야우타님은 아다타 가도 너머로 수색을 나가셨습니다.{nl}그리고 말입니다...	오르샤 피해복구반 단원
QUEST_LV_0500_20210809_000844	파야우타님이 출발하시고 얼마 후에 임시 이주민 캠프 지역에 마족들이 집결하는 걸 발견 했습니다.{nl}아마도 이 주변을 장악할 생각인 것 같은데, 파야우타님이 돌아오실 때 맞닥뜨릴까 걱정이군요.{nl}그래서 말인데, 계시자님이 임시 이주민 캠프에서 녀석들을 처리해주시는 게 어떻겠습니까?	오르샤 피해복구반 단원
QUEST_LV_0500_20210809_000845	상황이 안 좋다는 건 들었지만, 예상보다 훨씬 안 좋아.{nl}듣기론 아주 대단한 일을 하며 돌아다니고 있던데, 여신들도 너만 바라본다고 하더구나.{nl}아주 대단해.	파야우타
QUEST_LV_0500_20210809_000846	계시자.. 계시자.. 계시자..{nl}이곳에 오며 만난 큐폴들도 모두 널 칭송하고 있더구나.{nl}다음에 여신들을 만나면 내 이야기도 좀 해주겠어?	파야우타
QUEST_LV_0500_20210809_000847	당신들 때문에 모든 걸 잃어버린 인간이 있다고.	파야우타
QUEST_LV_0500_20210809_000848	내가 너무 투덜거린 걸까?{nl}너는 그저 여신들을 도와 세상을 구한 것 뿐인데 말이야.	파야우타
QUEST_LV_0500_20210809_000849	잡담은 여기까지 하고 다시 떠나야겠어.{nl}너도 물론 함께 가겠지?	파야우타
QUEST_LV_0500_20210809_000850	우선 암지나 갈림길로 향해야 해.{nl}거기서 마족들을 처리해야 덧댄다리 숲에서 도망쳐 온 피난민들이 오르샤까지 무사히 갈 수 있어.	파야우타
QUEST_LV_0500_20210809_000851	출발할 준비가 되면 말해줘.	파야우타
QUEST_LV_0500_20210809_000852	혹시 블라드라는 큐폴을 만난 적 있어?	파야우타
QUEST_LV_0500_20210809_000853	아무것도 아니야.	파야우타
QUEST_LV_0500_20210809_000854	실력이 여전하구나.{nl}그럼 다음 지역으로 가볼까?	파야우타
QUEST_LV_0500_20210809_000855	다음은 말코스 벌목지야.{nl}클라페다령에서 오르샤로 소집된 왕국 재건단들이 말코스 벌목지를 지나서 오고 있어.{nl}먼거리를 이동하는 상단 정도의 집단이어서 이 지역의 마족들을 제대로 상대하기 힘들 거야.	파야우타
QUEST_LV_0500_20210809_000856	준비되면 출발하자.	파야우타
QUEST_LV_0500_20210809_000857	수도 근처를 수색할 때 기념구 지역과 외곽지역에서 큐폴들을 꽤 많이 마주쳤는데..{nl}몇 녀석 빼곤 날 무시했어.	파야우타
QUEST_LV_0500_20210809_000858	목숨을 살려줘도 인간은 어차피 인간이란 걸까?	파야우타
QUEST_LV_0500_20210809_000859	지금쯤이면 오실 거라 생각했습니다.{nl}뒤쪽 바위에서 안 오면 어쩌나 걱정하고 있었습니다.{nl}파야우타님도 무사해 보이는 군요.	오르샤 피해복구반 단원
QUEST_LV_0500_20210809_000860	그럼 덧댄다리 숲으로 함께 가시죠.{nl}저는 먼저 가서 주변을 살피고 있겠습니다.	오르샤 피해복구반 단원
QUEST_LV_0500_20210809_000861	이제 클라페다에서 오는 단원들이 안전하게 오르샤까지 갈 수 있을 거야.{nl}하지만 다른 방향에서 오르샤로 향하는 사람들도 도와야 해.{nl}오르샤 피해복구반 단원에게 돌아가자.	파야우타
QUEST_LV_0500_20210809_000862	이렇게 바로 와주셔서 감사합니다.	오르샤 피해복구반 단원
QUEST_LV_0500_20210809_000863	방금전 영주님의 전령과 이야기를 나눴습니다.{nl}오르샤에 피난민들이 너무 많아져서 그들을 쉬게 할 임시 거주지를 만들어야한다고 하는군요.{nl}하지만 물자가 없어서 왕국 재건단원들에게 도움을 요청하고 있다고 하십니다.	오르샤 피해복구반 단원
QUEST_LV_0500_20210809_000864	난감하군요.{nl}도시가 포화되는 것도 문제지만 고생한 피난민들이 쉴 곳이 없다니..	오르샤 피해복구반 단원
QUEST_LV_0500_20210809_000865	계시자님, 뭔가 좋은 방법이 없을까요?	오르샤 피해복구반 단원
QUEST_LV_0500_20210809_000866	그런 눈으로 보지 말아줘.{nl}난 바이보라 여신이 아니야, 그런 걸 주머니에서 꺼내줄 수 없다고.	파야우타
QUEST_LV_0500_20210809_000867	잠깐, 내게 좋은 생각이 있어.	파야우타
QUEST_LV_0500_20210809_000868	이곳의 마족들이 손에 쥐고 있는 물건들 봤어?{nl}녀석들을 손봐주고 그걸 좀 빌려 가는 게 어떨까?	파야우타
QUEST_LV_0500_20210809_000869	{nl}어차피 주인은 없어졌으니 돌려줄 필요도 없고 뒤탈은 없을 거 같은데 말이지.{nl}좋은 생각 같지 않아?	파야우타
QUEST_LV_0500_20210809_000870	역시 비범한 분들은 생각도 비범하군요!{nl}저는 여러분만 믿고 여기서 전령들을 안내하고 있겠습니다.	오르샤 피해복구반 단원
QUEST_LV_0500_20210809_000871	좋아 그럼 하나하나 모아볼까?{nl}일단 자재들은 내가 들고 있을 태니 네가 처리하는 게 좋겠어.	파야우타
QUEST_LV_0500_20210809_000872	우선 다르바스 캐리어에게 삽을 빌려오는 게 좋겠지?{nl}	파야우타
QUEST_LV_0500_20210809_000873	좋아, 이 정도면 영주님도 만족할 거야.{nl}다음은 어느녀석껄 빌려볼까..	파야우타
QUEST_LV_0500_20210809_000874	좋아, 저 녀석이 좋겠어.{nl}다르바스 마이너에게 곡괭이를 얻어볼까?	파야우타
QUEST_LV_0500_20210809_000875	몇 개는 좀 버리고 가야겠어.{nl}너무 무거우니까.	파야우타
QUEST_LV_0500_20210809_000876	마지막으로 하나만 더 구해보자.{nl}더 들고 다니긴 무리니까.	파야우타
QUEST_LV_0500_20210809_000877	다르바스 로더에게 이것저것 모을 수 있을 거 같은데..	파야우타
QUEST_LV_0500_20210809_000878	돌아오셨군요!{nl}어떤 걸 모아오셨습니까?{nl}분명 두 분이 힘을 합치셨으니 큰 도움이 되는 물건일 겁니다.{nl}어디보자..	오르샤 피해복구반 단원
QUEST_LV_0500_20210809_000879	삽.. 이건 손잡이가 부러졌군요.	오르샤 피해복구반 단원
QUEST_LV_0500_20210809_000880	곡괭이.. 이건 복구가 끝나면 광부들에게 유용하겠어요.	오르샤 피해복구반 단원
QUEST_LV_0500_20210809_000881	석재.. 이건.. 버리고 가는 게 좋겠군요.	오르샤 피해복구반 단원
QUEST_LV_0500_20210809_000882	단원을 대신하여 두 분의 노고에 감사드립니다.{nl}하지만 지금 당장 필요한 물건들은 아니군요.	오르샤 피해복구반 단원
QUEST_LV_0500_20210809_000883	파야우타는 뭔가 다른 것을 찾는 것 같다.	파야우타
QUEST_LV_0500_20210809_000884	너무 걱정하실 필요는 없습니다.{nl}두 분께서 오르샤에 있다는 것만으로 많은 주민들에게 희망이 되어줄 겁니다.	오르샤 피해복구반 단원
QUEST_LV_0500_20210809_000885	아참, 두 분께서 물자를 구하러 가시는 동안 전령과 만났습니다.{nl}주변 숲 속에 오르샤로 도망치지 못하고 오두막에 숨어있는 주민들이 있을 거라고 하는군요.	오르샤 피해복구반 단원
QUEST_LV_0500_20210809_000886	{nl}저는 우선 파우피스 나루로 가볼까 합니다만..{nl}두 분께서는 어떻게 하시겠습니까?	오르샤 피해복구반 단원
QUEST_LV_0500_20210809_000887	이 길로 나아가면 파우피스 나루입니다.{nl}먼저 가 있을 태니 준비되시면 파우피스 나루 초입에서 뵙지요.	오르샤 피해복구반 단원
QUEST_LV_0500_20210809_000888	아, 오셨군요.{nl}오시기 전에 제가 잠시 둘러봤는데 마족들이 너무 많군요.	오르샤 피해복구반 단원
QUEST_LV_0500_20210809_000889	옆 집은 연기가 나는 거로 봐선 얼마 전까지 사람이 있었나 봅니다.{nl}지금은 어떻게 된 건지..	오르샤 피해복구반 단원
QUEST_LV_0500_20210809_000890	두 분이 괜찮으시다면 이곳에서 나머지 수색을 부탁드리고 싶군요.{nl}저는 좀 더 깊은 숲으로 가서 전령과 주민들을 찾아봐야겠습니다.	오르샤 피해복구반 단원
QUEST_LV_0500_20210809_000891	이러고 있을 때가 아닌데..	파야우타
QUEST_LV_0500_20210809_000892	{nl}알겠어.{nl}가자.	파야우타
QUEST_LV_0500_20210809_000893	단원이 알려준 곳으로 우선 가보자.{nl}위치는 내가 지도에 표기해 뒀어.	파야우타
QUEST_LV_0500_20210809_000894	적어도 파우피스 나루에는 확인할 곳이 더 없는 것 같아.{nl}수고했어.	파야우타
QUEST_LV_0500_20210809_000895	그럼 동행은 여기까지만 할까?{nl}난 좀 더 이곳에서 확인해야 할 게 있어.{nl}넌 오르샤로 돌아갈꺼야?	파야우타
QUEST_LV_0500_20210809_000896	난감하군요..{nl}이 주변에 살아남은 마을도 오르샤보단 상황이 좋지 못하니 그들의 도움을 받을 수도 없습니다.	오르샤 피해복구반 단원
QUEST_LV_0500_20210809_000897	좋아, 그럼 단원 아저씨에게 우리 계획을 말해줘!{nl}난 옆에서 기다리고 있을게.	파야우타
QUEST_LV_0500_20210809_000898	음....	파야우타
QUEST_LV_0500_20210809_000899	성벽 보수하는 데 쓸만하겠는데.{nl}이제 복구반 단원에게 돌아가자.	파야우타
QUEST_LV_0500_20210809_000900	방금 모은 건 네가 들어줘.{nl}나머지는 내가 가지고 갈게.	파야우타
QUEST_LV_0500_20210809_000901	그래 주시겠습니까?{nl}두 분이 계셔서 정말 든든하군요.{nl}그럼 파우피스 나루 앞에서 뵙겠습니다.	오르샤 피해복구반 단원
QUEST_LV_0500_20210809_000902	역시 믿음직스럽군요!{nl}제가 사람들이 숨어있을 만한 곳을 알려드리겠습니다.	오르샤 피해복구반 단원
QUEST_LV_0500_20210809_000903	그럼 잘 부탁드립니다.{nl}두 분만 믿고 저는 먼저 가보겠습니다.	오르샤 피해복구반 단원
QUEST_LV_0500_20210809_000904	꾸물거리지 말고 어서 일을 끝내자.	파야우타
QUEST_LV_0500_20210809_000905	그래..{nl}그럼 좀 더 이 근처를 수색해볼까.	파야우타
QUEST_LV_0500_20210809_000906	뭔가 내가 찾는 걸 발견할 수 있을 거 같아.	파야우타
QUEST_LV_0500_20210809_000907	자네,{nl}성자의 기도소에 대해 들어본 적이 있는가?	채플린 마스터
QUEST_LV_0500_20210809_000908	전설적인 인물이셨던 대현자 실베스트로 메이번께서 살아생전 늘 기도를 올리시던 신성한 장소이지.	채플린 마스터
QUEST_LV_0500_20210809_000909	그곳이 정확히 어디에 있는지는 모르네.{nl}메이번께서 스스로 바라지 않는 한 그 누구에게도 기도소의 모습은 보이지 않거든.{nl}메이번께서 이 세상을 떠난 지 오랜 지금까지도 마찬가지라네.	채플린 마스터
QUEST_LV_0500_20210809_000910	그러나, 자네에게 이런 이야기를 하는 이유가 있네.{nl}신수의 날 당시 아발리스터 마스터인 빌리우스와 그 가족들이 오르샤 근방의 덧댄다리 숲에 있었네.{nl}그 당시 강력한 마족에게 쫓기다가 그의 가족들과 마족이 함께 의문의 폭발에 휩 싸이고는 감쪽같이 사라졌다고 하지.	채플린 마스터
QUEST_LV_0500_20210809_000911	성자의 기도소는 메이번께서 서품을 받았던 장소를 본따 만들었다고 전해지네.{nl}바로 그 장소가 지금은 메이번 대수도원으로 불리는 곳의 영광의 홀이라네.	채플린 마스터
QUEST_LV_0500_20210809_000912	마침, 빌리우스의 가족들이 사라진 지점과 메이번 대수도원은 지리적으로 꽤 가깝지.{nl}만약 그곳이 성자의 기도소라면..{nl}분명 메이번님의 뜻으로 그런 일이 벌어진 거로 생각하네.	채플린 마스터
QUEST_LV_0500_20210809_000913	마침 빌리우스가 오르샤의 상황을 듣고 덧댄다리 숲으로 갔으니 그를 만나보는 게 어떻겠나?	채플린 마스터
QUEST_LV_0500_20210809_000914	좋은 생각일세.{nl}빌리우스는 겉과 달리 마음속에 큰 짐을 지니고 있을게야.	채플린 마스터
QUEST_LV_0500_20210809_000915	어서 가서 그를 만나보게나.	채플린 마스터
QUEST_LV_0500_20210809_000916	성자의 기도소?	아발리스터 마스터
QUEST_LV_0500_20210809_000917	그렇다면 아직 그 마족이 살아 있을지도 모른다는 말이구나.	아발리스터 마스터
QUEST_LV_0500_20210809_000918	그렇다면 기꺼이 도움을 청할게.{nl}이제 와서 가족들이 살아있기까지는 바라지 않아.	아발리스터 마스터
QUEST_LV_0500_20210809_000919	다만,{nl}그 마족이 만에 하나 그곳을 빠져나오게 된다면..{nl}오르샤는 순식간에 쑥대밭이 될 거야.	아발리스터 마스터
QUEST_LV_0500_20210809_000920	단단히 준비하고 출발하자.	아발리스터 마스터
QUEST_LV_0500_20210809_000921	메이번께서 평생을 기도하던 장소라면..{nl}분명 대성당이나 여신을 모시는 성소에 버금가는 신성력이 존재하는 성역일걸세.	채플린 마스터
QUEST_LV_0500_20210809_000922	그런 장소라면 신수의 날로부터 몇 년이 지난 지금도 여전히 빌리우스의 가족들이 살아있을지도 모를 일이지.{nl}어쩌면 그 마족도 마찬가지겠지만..	채플린 마스터
QUEST_LV_0500_20210809_000923	어서 가서 빌리우스를 찾아보게.{nl}빌리우스는 덧댄다리 숲에 있다고 들었네.	채플린 마스터
QUEST_LV_0500_20210809_000924	오르샤의 상황을 듣고 도우러 왔어.{nl}여긴 내 가족들의 무덤이기도 해.{nl}그 어떤 마족에게도 넘겨줄 수 없어.	QUEST_20200128_011902	Now I'm here to help the convent work.{nl}I'll run wherever I need help.	지금은 여기서 수녀원의 일을 돕고 있어.{nl}도움이 필요한 곳이 있다면 언제든지 달려갈 생각이야.	아발리스터 마스터
QUEST_LV_0500_20210809_000925	하마터면 큰일 날 뻔했어.	파야우타
QUEST_LV_0500_20210809_000926	내가 어떻게 주시자의 활을 파괴했는지는 잘 모르겠지만..	파야우타
QUEST_LV_0500_20210809_000927	파울루스의 영혼은 결국 주시자가 가져간 거지?	파야우타
QUEST_LV_0500_20210809_000928	서둘러 델무어로 갈 준비를 하자.	파야우타
QUEST_LV_0500_20210809_000929	나 대신 오르샤 영주에게 여기서 모은 증거품들을 전해줄래?{nl}준비되면 델무어에서 다시 만나자.	파야우타
QUEST_LV_0500_20210809_000930	오르샤의 영주인 이네사 해먼데일에게 증거품들을 보여주자	PC
QUEST_LV_0500_20210809_000931	위기에 처한 오르샤를 위해서 애써주셔서 정말 감사합니다.	이네사 해먼데일
QUEST_LV_0500_20210809_000932	이것들을 아샤크 지하 감옥에서 발견했다는 말씀이시군요.	이네사 해먼데일
